course_id,course_name,difficulty,description,learning,tags,Average rating,Number of reviews,Popularity,combined_text
ITHAC_8,Introduction to HTML and CSS,Beginner,"This beginner-level course focuses on the fundamentals of web development, covering HTML for content structure and CSS for styling web pages.","Learn the basics of HTML for creating structured web content.
Understand how CSS is used to style and format web pages.
Create simple web pages using HTML and CSS.
Explore web development best practices and standards.","['HTML', 'CSS', 'web development', 'beginner']",3.0,10,High,html css web develop beginn beginnerlevel cours focus fundament web develop cover html content structur css style web page introduct html css
ITCS_1,Introduction to Computer Science,Beginner,"This course provides an introduction to the field of computer science. You will learn about the fundamental concepts, history, and various areas within computer science. Topics covered include algorithms, data structures, programming, and problem-solving.","Understand the basics of computer science and its importance in today's world.
Learn about algorithms and their role in solving problems efficiently.
Explore data structures and their applications in software development.
Get an overview of programming languages and their usage in computer science.","['computer science', 'beginner', 'programming', 'algorithms', 'data structures']",2.9,7,Low,comput scienc beginn program algorithm data structur cours provid introduct field comput scienc learn fundament concept histori variou area within comput scienc topic cover includ algorithm data structur program problemsolv introduct comput scienc
CPFB_14,C++ Programming for Beginners,Beginner,"This course is designed for beginners and covers the fundamentals of the C++ programming language. You will learn about C++ syntax, data types, and basic programming concepts.","Familiarize yourself with C++ syntax, including variables, loops, and functions.
Learn about C++ data types and their usage.
Write C++ programs to solve basic problems and tasks.
Understand how C++ can be used in various applications, including game development and system programming.","['C++', 'beginner', 'programming', 'data types']",2.9,9,Medium,c beginn program data type cours design beginn cover fundament c program languag learn c syntax data type basic program concept c program beginn
ABD_176,Advanced Blockchain Development,Advanced,This advanced-level course delves into advanced blockchain development. Learn to build decentralized applications (DApps) and smart contracts.,"Master advanced blockchain development techniques.
Learn to build decentralized applications (DApps) on blockchain platforms.
Explore smart contract development and blockchain security.
Implement blockchain solutions for various industries.","['blockchain development', 'advanced', 'DApps', 'smart contracts', 'blockchain security']",2.8,20,Very High,blockchain develop advanc dapp smart contract blockchain secur advancedlevel cours delv advanc blockchain develop learn build decentr applic dapp smart contract advanc blockchain develop
EHFCE_184,Ethical Hacking for Cybersecurity Experts,Advanced,This advanced-level course covers ethical hacking for cybersecurity experts. Learn advanced penetration testing and security assessment techniques.,"Master advanced ethical hacking techniques and methodologies.
Learn to conduct in-depth penetration tests and security assessments.
Explore advanced hacking tools and vulnerability exploitation.
Enhance cybersecurity defenses through ethical hacking expertise.","['ethical hacking', 'advanced', 'penetration testing', 'security assessment', 'cybersecurity experts']",3.0,11,High,ethic hack advanc penetr test secur assess cybersecur expert advancedlevel cours cover ethic hack cybersecur expert learn advanc penetr test secur assess techniqu ethic hack cybersecur expert
CRM_92,Cybersecurity Risk Management,Advanced,"This advanced-level course focuses on cybersecurity risk management. Learn about risk assessment, threat modeling, and risk mitigation strategies.","Conduct cybersecurity risk assessments for organizations.
Perform threat modeling and vulnerability assessments.
Develop risk mitigation strategies and incident response plans.
Manage cybersecurity risks in complex environments.","['cybersecurity', 'advanced', 'risk management', 'threat modeling']",2.7,6,Low,cybersecur advanc risk manag threat model advancedlevel cours focus cybersecur risk manag learn risk assess threat model risk mitig strategi cybersecur risk manag
BOGAGD_202,Basics of Gaming and Game Development,Beginner,"This beginner-level course covers the basics of gaming and game development. Learn about game design, development tools, and game industry insights.","Understand the fundamentals of gaming and the game development process.
Learn about game design principles and game mechanics.
Explore game development tools and platforms.
Begin your journey into the world of game creation and design.","['gaming', 'game development', 'beginner', 'game design', 'game mechanics']",2.6,9,Medium,game game develop beginn game design game mechan beginnerlevel cours cover basic game game develop learn game design develop tool game industri insight basic game game develop
FO3P_154,Fundamentals of 3D Printing,Beginner,"This beginner-level course covers the fundamentals of 3D printing technology. Learn about 3D modeling, printing processes, and applications of 3D printing.","Understand the basics of 3D printing technology and its applications.
Learn about 3D modeling and design for 3D printing.
Explore different 3D printing processes and materials.
Gain hands-on experience in 3D printing projects.","['3D printing', 'beginner', '3D modeling', 'printing processes', 'technology']",3.6,11,High,print beginn model print process technolog beginnerlevel cours cover fundament print technolog learn model print process applic print fundament print
HC_143,Human-AI Collaboration,Advanced,This advanced-level course explores human-AI collaboration. Learn how humans and artificial intelligence can work together in various domains.,"Understand the principles of human-AI collaboration.
Explore case studies of AI-human collaboration in healthcare, finance, and more.
Learn about AI augmentation of human capabilities.
Develop strategies for effective human-AI collaboration.","['human-AI collaboration', 'advanced', 'AI augmentation', 'collaboration strategies']",2.5,10,High,humanai collabor advanc ai augment collabor strategi advancedlevel cours explor humanai collabor learn human artifici intellig work togeth variou domain humanai collabor
ATIMLR_97,Advanced Topics in Machine Learning Research,Advanced,This advanced-level course explores advanced topics in machine learning research. Learn about cutting-edge algorithms and research trends.,"Explore advanced machine learning algorithms and models.
Understand recent research developments in machine learning.
Contribute to ongoing machine learning research projects.
Publish and present research findings in machine learning.","['machine learning', 'advanced', 'research', 'algorithms']",2.8,8,Medium,machin learn advanc research algorithm advancedlevel cours explor advanc topic machin learn research learn cuttingedg algorithm research trend advanc topic machin learn research
ITVPN_199,Introduction to Virtual Private Networks ,Beginner,This beginner-level course introduces virtual private networks (VPNs). Learn how VPNs work and how to use them for online security and privacy.,"Understand the concept of virtual private networks (VPNs).
Learn how VPNs enhance online security and privacy.
Explore VPN setup and configuration on different devices.
Use VPNs to protect your online activities and sensitive data.","['VPN', 'beginner', 'online security', 'privacy protection']",2.6,5,Low,vpn beginn onlin secur privaci protect beginnerlevel cours introduc virtual privat network vpn learn vpn work use onlin secur privaci introduct virtual privat network
AWD_76,Advanced Web Development,Intermediate,"This intermediate-level course delves deeper into web development. Learn about advanced web technologies, frameworks, and web application deployment.","Explore advanced web technologies like Node.js and Django.
Learn about web application frameworks and RESTful APIs.
Deploy web applications to production servers and cloud platforms.
Develop feature-rich web applications with modern UI/UX design.","['web development', 'intermediate', 'Node.js', 'Django', 'web application']",2.8,13,Very High,web develop intermedi nodej django web applic intermediatelevel cours delv deeper web develop learn advanc web technolog framework web applic deploy advanc web develop
WHADM_67,Web Hosting and Domain Management,Beginner,"This beginner-level course covers web hosting and domain management basics. Learn how to register domains, choose hosting providers, and manage websites.","Register and manage domain names for websites.
Choose appropriate web hosting providers and plans.
Set up and configure websites on web hosting servers.
Understand DNS and domain-related terminology.","['web hosting', 'domain management', 'beginner', 'DNS']",3.3,6,Low,web host domain manag beginn dn beginnerlevel cours cover web host domain manag basic learn regist domain choos host provid manag websit web host domain manag
CSFE_156,Computer Science for Educators,Beginner,"This beginner-level course is designed for educators. Learn about computer science concepts, programming basics, and integrating CS into education.","Understand fundamental computer science concepts and principles.
Learn the basics of programming and algorithmic thinking.
Explore strategies for integrating computer science into educational curricula.
Develop teaching approaches to enhance computer science education.","['computer science', 'beginner', 'programming basics', 'educational integration', 'teaching']",2.3,6,Low,comput scienc beginn program basic educ integr teach beginnerlevel cours design educ learn comput scienc concept program basic integr cs educ comput scienc educ
AIBS_174,AI in Business Strategy,Intermediate,This intermediate-level course focuses on the strategic use of AI in business. Learn to develop AI-driven business strategies and solutions.,"Understand the strategic implications of AI in business.
Learn to develop AI-driven business strategies and use cases.
Explore AI implementation in various business domains.
Leverage AI for competitive advantage and business growth.","['AI', 'business strategy', 'intermediate', 'AI implementation', 'competitive advantage']",2.0,8,Medium,ai busi strategi intermedi ai implement competit advantag intermediatelevel cours focus strateg use ai busi learn develop aidriven busi strategi solut ai busi strategi
CGAC_175,Cybersecurity Governance and Compliance,Advanced,This advanced-level course covers cybersecurity governance and compliance. Learn to establish robust cybersecurity frameworks and compliance measures.,"Master cybersecurity governance principles and best practices.
Learn to establish cybersecurity compliance measures.
Explore regulatory frameworks and cybersecurity audits.
Develop and implement cybersecurity policies and procedures.","['cybersecurity', 'governance', 'compliance', 'advanced', 'cybersecurity policies']",2.1,7,Low,cybersecur govern complianc advanc cybersecur polici advancedlevel cours cover cybersecur govern complianc learn establish robust cybersecur framework complianc measur cybersecur govern complianc
AUER_173,Advanced User Experience  Research,Intermediate,This intermediate-level course delves into advanced user experience (UX) research. Learn to conduct in-depth UX research and usability studies.,"Master advanced UX research methodologies and techniques.
Learn to conduct usability studies and user testing.
Explore user journey mapping and persona development.
Apply advanced UX research skills to improve product design.","['user experience', 'UX research', 'intermediate', 'usability studies', 'user testing']",3.9,12,Very High,user experi ux research intermedi usabl studi user test intermediatelevel cours delv advanc user experi ux research learn conduct indepth ux research usabl studi advanc user experi research
AFF_214,Advanced Front-End Frameworks,Intermediate,This intermediate-level course covers advanced front-end frameworks. Learn to build dynamic and responsive web interfaces.,"Master advanced front-end frameworks, such as React and Angular.
Learn to create interactive and responsive web applications.
Explore state management, routing, and component-based development.
Build advanced web interfaces with modern front-end technologies.","['front-end frameworks', 'intermediate', 'React', 'Angular', 'web applications']",3.2,6,Low,frontend framework intermedi react angular web applic intermediatelevel cours cover advanc frontend framework learn build dynam respons web interfac advanc frontend framework
ACSM_185,Advanced Cloud Security Management,Advanced,This advanced-level course focuses on advanced cloud security management. Learn to secure cloud environments and protect cloud-based assets.,"Master advanced cloud security concepts and best practices.
Learn to secure cloud infrastructure and data in diverse cloud environments.
Explore identity and access management (IAM) in cloud security.
Implement advanced cloud security strategies and incident response.","['cloud security', 'advanced', 'cloud infrastructure', 'IAM', 'incident response']",2.5,8,Medium,cloud secur advanc cloud infrastructur iam incid respons advancedlevel cours focus advanc cloud secur manag learn secur cloud environ protect cloudbas asset advanc cloud secur manag
NSAPT_79,Network Security and Penetration Testing,Intermediate,This intermediate-level course focuses on network security and penetration testing. Learn about securing networks and ethical hacking techniques.,"Master network security principles and secure network design.
Conduct penetration testing and vulnerability assessment.
Explore ethical hacking techniques for network security.
Analyze network traffic for security threats and anomalies.","['network security', 'intermediate', 'penetration testing', 'ethical hacking']",3.4,10,High,network secur intermedi penetr test ethic hack intermediatelevel cours focus network secur penetr test learn secur network ethic hack techniqu network secur penetr test
ITCFS_190,Introduction to Cloud File Storage,Beginner,This beginner-level course introduces cloud file storage services. Learn to store and manage files in the cloud.,"Understand the basics of cloud file storage services.
Learn to upload, download, and organize files in the cloud.
Explore file sharing and collaboration features in cloud storage.
Securely manage your digital files using cloud storage solutions.","['cloud file storage', 'beginner', 'file management', 'cloud security']",2.0,5,Low,cloud file storag beginn file manag cloud secur beginnerlevel cours introduc cloud file storag servic learn store manag file cloud introduct cloud file storag
ATICG_100,Advanced Topics in Computer Graphics,Advanced,"This advanced-level course explores advanced topics in computer graphics. Learn about real-time rendering, 3D modeling, and graphics programming.","Explore advanced techniques in real-time rendering and computer graphics.
Learn about 3D modeling, animation, and visualization.
Develop graphics applications and games using modern graphics APIs.
Apply computer graphics concepts in virtual reality and augmented reality.","['computer graphics', 'advanced', 'real-time rendering', '3D modeling']",3.1,8,Medium,comput graphic advanc realtim render model advancedlevel cours explor advanc topic comput graphic learn realtim render model graphic program advanc topic comput graphic
ITCSAB_113,Introduction to Cloud Storage and Backup,Beginner,"This beginner-level course introduces cloud storage and backup solutions. Learn about cloud storage providers, data backup strategies, and cloud data management.","Understand the advantages of cloud storage and backup solutions.
Learn about popular cloud storage providers and their offerings.
Implement data backup strategies in cloud environments.
Manage cloud-based data and ensure data security.","['cloud storage', 'beginner', 'data backup', 'cloud data management']",3.3,12,Very High,cloud storag beginn data backup cloud data manag beginnerlevel cours introduc cloud storag backup solut learn cloud storag provid data backup strategi cloud data manag introduct cloud storag backup
QCFC_235,Quantum Computing for Cryptanalysis,Advanced,This advanced-level course focuses on quantum computing for cryptanalysis. Learn to analyze and strengthen cryptographic systems against quantum attacks.,"Master advanced quantum computing concepts and cryptographic principles.
Learn to assess the vulnerability of cryptographic systems to quantum attacks.
Explore post-quantum cryptography and quantum-resistant algorithms.
Contribute to the security of digital communications in the quantum era.","['quantum computing', 'cryptanalysis', 'advanced', 'post-quantum cryptography', 'quantum-resistant algorithms']",2.2,8,Medium,quantum comput cryptanalysi advanc postquantum cryptographi quantumresist algorithm advancedlevel cours focus quantum comput cryptanalysi learn analyz strengthen cryptograph system quantum attack quantum comput cryptanalysi
ITDA_105,Introduction to Data Analysis,Beginner,"This beginner-level course focuses on data analysis basics. Learn about data exploration, visualization, and basic statistical analysis techniques.","Understand the fundamentals of data analysis and its applications.
Learn data exploration techniques and data cleaning.
Create data visualizations using tools like Excel and basic statistical analysis.
Analyze real-world data sets to gain data analysis skills.","['data analysis', 'beginner', 'data exploration', 'data visualization']",3.6,10,High,data analysi beginn data explor data visual beginnerlevel cours focus data analysi basic learn data explor visual basic statist analysi techniqu introduct data analysi
DSFB_7,Data Structures for Beginners,Beginner,"This beginner-level course introduces data structures and their importance in computer science. You will learn about arrays, linked lists, stacks, and queues.","Understand the concept of data structures and their significance.
Learn about commonly used data structures like arrays and linked lists.
Explore the principles of stack and queue data structures.
Implement and use data structures in practical programming scenarios.","['data structures', 'beginner', 'arrays', 'linked lists', 'stacks', 'queues']",3.6,5,Low,data structur beginn array link list stack queue beginnerlevel cours introduc data structur import comput scienc learn array link list stack queue data structur beginn
MAD_28,Mobile App Development,Intermediate,"This intermediate-level course covers mobile app development for iOS and Android platforms. Learn about app design, development frameworks, and deployment.","Explore mobile app design principles and user interfaces.
Learn mobile app development using platforms like Swift (iOS) or Java/Kotlin (Android).
Understand app testing, debugging, and deployment.
Develop and publish mobile apps for real-world use.","['mobile app development', 'iOS', 'Android', 'intermediate', 'app deployment']",2.8,11,High,mobil app develop io android intermedi app deploy intermediatelevel cours cover mobil app develop io android platform learn app design develop framework deploy mobil app develop
ITDS_65,Introduction to Data Science,Beginner,"This beginner-level course provides an introduction to data science. Learn about data analysis, visualization, and basic machine learning concepts.","Explore data analysis and visualization using tools like Excel or Python.
Understand data cleaning and preprocessing techniques.
Learn about basic machine learning algorithms and their applications.
Get hands-on experience with data science projects.","['data science', 'beginner', 'data analysis', 'machine learning']",2.7,6,Low,data scienc beginn data analysi machin learn beginnerlevel cours provid introduct data scienc learn data analysi visual basic machin learn concept introduct data scienc
CAEH_45,Cybersecurity and Ethical Hacking,Advanced,"This advanced-level course covers cybersecurity and ethical hacking. Learn about advanced threat detection, penetration testing, and ethical hacking techniques.","Master advanced threat detection and incident response techniques.
Conduct penetration testing and vulnerability assessment.
Explore ethical hacking techniques for network and web application security.
Understand security auditing and compliance standards.","['cybersecurity', 'ethical hacking', 'advanced', 'penetration testing']",2.8,8,Medium,cybersecur ethic hack advanc penetr test advancedlevel cours cover cybersecur ethic hack learn advanc threat detect penetr test ethic hack techniqu cybersecur ethic hack
ITJP_15,Introduction to Java Programming,Beginner,"This beginner-level course introduces the Java programming language. You will learn Java syntax, object-oriented programming concepts, and how to write Java applications.","Familiarize yourself with Java syntax, including variables, classes, and methods.
Learn about object-oriented programming principles in Java.
Write Java programs to solve basic problems and tasks.
Explore the versatility of Java in various applications, including web development and mobile app development.","['Java', 'beginner', 'programming', 'object-oriented programming']",3.2,9,Medium,java beginn program objectori program beginnerlevel cours introduc java program languag learn java syntax objectori program concept write java applic introduct java program
ITE_197,Introduction to E-Commerce,Beginner,"This beginner-level course introduces the fundamentals of e-commerce. Learn about online shopping, payment systems, and e-commerce business models.","Understand the basics of e-commerce and its evolution.
Learn about online shopping platforms and payment gateways.
Explore e-commerce business models and strategies.
Start your journey into the world of online selling and entrepreneurship.","['e-commerce', 'beginner', 'online shopping', 'payment systems', 'entrepreneurship']",2.9,8,Medium,ecommerc beginn onlin shop payment system entrepreneurship beginnerlevel cours introduc fundament ecommerc learn onlin shop payment system ecommerc busi model introduct ecommerc
ACABT_139,Advanced Cryptocurrency and Blockchain Technologies,Advanced,"This advanced-level course delves into advanced cryptocurrency and blockchain technologies. Learn about smart contracts, consensus algorithms, and blockchain scaling.","Master advanced cryptocurrency and blockchain concepts.
Explore smart contracts and decentralized applications (DApps).
Understand blockchain consensus algorithms and scalability solutions.
Participate in advanced blockchain development and research.","['cryptocurrency', 'blockchain', 'advanced', 'smart contracts', 'consensus algorithms']",2.7,10,High,cryptocurr blockchain advanc smart contract consensu algorithm advancedlevel cours delv advanc cryptocurr blockchain technolog learn smart contract consensu algorithm blockchain scale advanc cryptocurr blockchain technolog
ACAD_210,Advanced Cloud Architecture Design,Intermediate,This intermediate-level course covers advanced cloud architecture design. Learn to design scalable and resilient cloud solutions.,"Master advanced cloud architecture concepts and principles.
Learn to design cloud solutions for high availability and performance.
Explore cloud security and compliance considerations.
Design and implement cloud architectures for diverse business needs.","['cloud architecture', 'intermediate', 'scalability', 'cloud security', 'compliance']",2.6,10,High,cloud architectur intermedi scalabl cloud secur complianc intermediatelevel cours cover advanc cloud architectur design learn design scalabl resili cloud solut advanc cloud architectur design
ITR_74,Introduction to Robotics,Beginner,"This beginner-level course introduces robotics concepts. Learn about robot components, sensors, and basic robot programming.","Understand the components and sensors commonly used in robots.
Learn basic robot programming and control techniques.
Explore real-world applications of robotics in various fields.
Get hands-on experience with robot building and programming.","['robotics', 'beginner', 'robot components', 'robot programming']",2.8,9,Medium,robot beginn robot compon robot program beginnerlevel cours introduc robot concept learn robot compon sensor basic robot program introduct robot
NLPFAA_142,Natural Language Processing for Advanced Applications,Advanced,"This advanced-level course focuses on natural language processing (NLP) for advanced applications. Learn about sentiment analysis, chatbots, and NLP in healthcare.","Master advanced NLP techniques for text analysis and understanding.
Learn about sentiment analysis, chatbot development, and NLP in healthcare.
Explore real-world NLP applications in various industries.
Develop advanced NLP projects and solutions.","['natural language processing', 'NLP', 'advanced', 'sentiment analysis', 'chatbots']",3.0,6,Low,natur languag process nlp advanc sentiment analysi chatbot advancedlevel cours focus natur languag process nlp advanc applic learn sentiment analysi chatbot nlp healthcar natur languag process advanc applic
