course_id,course_name,difficulty,description,learning,tags,Average rating,Number of reviews,Popularity,combined_text
CSAII_144,Cyber-Physical Systems and IoT Integration,Advanced,This advanced-level course focuses on cyber-physical systems (CPS) and their integration with the Internet of Things (IoT). Learn about CPS design and IoT connectivity.,"Master the principles of cyber-physical systems (CPS).
Learn about IoT integration and connectivity for CPS applications.
Explore real-world CPS and IoT use cases in industry.
Design and develop advanced CPS and IoT solutions.","['cyber-physical systems', 'IoT integration', 'advanced', 'CPS design']",3.0,11,High,cyberphys system iot integr advanc cp design advancedlevel cours focus cyberphys system cp integr internet thing iot learn cp design iot connect cyberphys system iot integr
WAS_33,Web Application Security,Intermediate,"This intermediate-level course focuses on web application security. Learn about common vulnerabilities, security protocols, and secure coding practices.","Identify and mitigate common web application vulnerabilities.
Implement security protocols like HTTPS and OAuth2.
Practice secure coding techniques to protect web applications.
Perform security assessments and penetration testing.","['web application security', 'intermediate', 'vulnerabilities', 'secure coding']",2.9,14,Very High,web applic secur intermedi vulner secur code intermediatelevel cours focus web applic secur learn common vulner secur protocol secur code practic web applic secur
WDWW_104,Web Development with WordPress,Beginner,This beginner-level course introduces web development with WordPress. Learn to create and customize websites using this popular content management system.,"Get started with web development using WordPress as a content management system.
Create and customize websites with themes and plugins.
Learn about web design principles and user-friendly website development.
Publish and maintain websites using WordPress.","['web development', 'beginner', 'WordPress', 'content management system']",2.9,9,Medium,web develop beginn wordpress content manag system beginnerlevel cours introduc web develop wordpress learn creat custom websit use popular content manag system web develop wordpress
ATICR_226,Advanced Topics in Cybersecurity Research,Advanced,This advanced-level course delves into advanced topics in cybersecurity research. Explore cutting-edge cybersecurity challenges and solutions.,"Master advanced concepts in cybersecurity research and innovation.
Learn to analyze and address emerging cyber threats and vulnerabilities.
Explore security testing, threat intelligence, and cyber defense strategies.
Contribute to the advancement of cybersecurity knowledge and practices.","['cybersecurity', 'research', 'advanced', 'cyber threats', 'security testing']",2.6,9,Medium,cybersecur research advanc cyber threat secur test advancedlevel cours delv advanc topic cybersecur research explor cuttingedg cybersecur challeng solut advanc topic cybersecur research
QML_177,Quantum Machine Learning,Advanced,This advanced-level course focuses on quantum machine learning. Learn to leverage quantum computing for advanced machine learning algorithms.,"Understand quantum computing and its applications in machine learning.
Learn to implement quantum algorithms for machine learning tasks.
Explore quantum machine learning libraries and frameworks.
Develop and optimize quantum machine learning models.","['quantum computing', 'machine learning', 'advanced', 'quantum algorithms', 'quantum machine learning']",2.5,14,Very High,quantum comput machin learn advanc quantum algorithm quantum machin learn advancedlevel cours focus quantum machin learn learn leverag quantum comput advanc machin learn algorithm quantum machin learn
ITSMS_191,Introduction to Social Media Security,Beginner,This beginner-level course covers social media security practices. Learn to protect your online presence and privacy on social platforms.,"Understand the importance of social media security.
Learn to set privacy settings and manage online profiles.
Explore common social media threats and scams.
Safeguard your personal information and digital identity on social media.","['social media security', 'beginner', 'online privacy', 'digital identity']",3.4,10,High,social media secur beginn onlin privaci digit ident beginnerlevel cours cover social media secur practic learn protect onlin presenc privaci social platform introduct social media secur
ADV_90,Advanced Data Visualization,Intermediate,This intermediate-level course focuses on advanced data visualization techniques. Learn about interactive visualizations and storytelling with data.,"Create advanced data visualizations using tools like D3.js and Tableau.
Understand principles of data storytelling and effective communication.
Develop interactive dashboards and data-driven narratives.
Visualize complex data sets for insights and decision-making.","['data visualization', 'intermediate', 'D3.js', 'Tableau', 'data storytelling']",3.1,15,Very High,data visual intermedi dj tableau data storytel intermediatelevel cours focus advanc data visual techniqu learn interact visual storytel data advanc data visual
AIAV_183,AI in Autonomous Vehicles,Advanced,This advanced-level course focuses on AI in autonomous vehicles. Learn to develop AI systems for self-driving cars and autonomous mobility.,"Understand AI technologies for autonomous vehicles.
Learn to build AI systems for self-driving cars and mobility solutions.
Explore perception, decision-making, and control in autonomous vehicles.
Contribute to the advancement of AI-driven autonomous mobility.","['AI', 'autonomous vehicles', 'advanced', 'self-driving cars', 'mobility solutions']",2.7,7,Low,ai autonom vehicl advanc selfdriv car mobil solut advancedlevel cours focus ai autonom vehicl learn develop ai system selfdriv car autonom mobil ai autonom vehicl
CSFN_20,Computer Science for Non-Majors,Beginner,This course is designed for individuals who are not computer science majors but want to gain a basic understanding of computer science concepts and applications.,"Gain a foundational understanding of computer science and its relevance in various fields.
Learn about key computer science topics, including algorithms and data structures.
Explore practical applications of computer science in everyday life and various industries.
Acquire problem-solving skills through hands-on exercises and projects.","['computer science', 'beginner', 'non-majors', 'algorithms', 'data structures']",3.4,11,High,comput scienc beginn nonmajor algorithm data structur cours design individu comput scienc major want gain basic understand comput scienc concept applic comput scienc nonmajor
BYFMA_203,Building Your First Mobile App,Beginner,This beginner-level course guides you in building your first mobile app. Learn app development basics and create your own mobile application.,"Understand the mobile app development process.
Learn to create a simple mobile app from scratch.
Explore app development tools and platforms.
Turn your app idea into a reality with hands-on development.","['mobile app development', 'beginner', 'app development basics', 'app creation']",2.8,6,Low,mobil app develop beginn app develop basic app creation beginnerlevel cours guid build first mobil app learn app develop basic creat mobil applic build first mobil app
IT3PAM_108,Introduction to 3D Printing and Modeling,Beginner,"This beginner-level course introduces 3D printing and modeling. Learn about 3D design, modeling software, and the 3D printing process.","Understand the basics of 3D printing and its applications.
Learn 3D modeling using software like Tinkercad or Blender.
Explore the 3D printing process from design to printing.
Create 3D-printable models and objects.","['3D printing', 'beginner', '3D modeling', 'Tinkercad', 'Blender']",3.0,8,Medium,print beginn model tinkercad blender beginnerlevel cours introduc print model learn design model softwar print process introduct print model
CBP_29,Cybersecurity Best Practices,Intermediate,"This intermediate-level course focuses on cybersecurity best practices. Learn about threat detection, risk assessment, and security measures to protect digital assets.","Identify common cybersecurity threats and vulnerabilities.
Perform risk assessments and develop security strategies.
Implement security measures to protect networks and data.
Stay updated with cybersecurity best practices and compliance standards.","['cybersecurity', 'security best practices', 'intermediate', 'threat detection']",3.2,12,Very High,cybersecur secur best practic intermedi threat detect intermediatelevel cours focus cybersecur best practic learn threat detect risk assess secur measur protect digit asset cybersecur best practic
CLFS_200,Computer Literacy for Seniors,Beginner,This beginner-level course is designed for seniors to learn computer literacy. Develop basic computer skills and navigate the digital world with confidence.,"Learn the basics of computer hardware and software.
Explore common computer applications and tools.
Develop essential computer skills for everyday tasks.
Become a confident and empowered digital user as a senior.","['computer literacy', 'beginner', 'senior citizens', 'digital skills', 'computer applications']",3.7,6,Low,comput literaci beginn senior citizen digit skill comput applic beginnerlevel cours design senior learn comput literaci develop basic comput skill navig digit world confid comput literaci senior
CHB_66,Computer Hardware Basics,Beginner,"This beginner-level course covers computer hardware fundamentals. Learn about components, peripherals, and basic troubleshooting techniques.","Understand computer hardware components like CPU, RAM, and storage devices.
Learn about input and output peripherals, including keyboards and monitors.
Troubleshoot common hardware issues and perform basic upgrades.
Explore computer hardware terminology and specifications.","['computer hardware', 'beginner', 'hardware components', 'troubleshooting']",2.8,12,Very High,comput hardwar beginn hardwar compon troubleshoot beginnerlevel cours cover comput hardwar fundament learn compon peripher basic troubleshoot techniqu comput hardwar basic
BWD_27,Back-End Web Development,Intermediate,"This intermediate-level course covers back-end web development. Learn server-side programming, API development, and database integration for building robust web applications.","Master server-side programming using languages like Python, Node.js, or Ruby.
Develop RESTful APIs for communication between front-end and back-end systems.
Integrate databases and perform CRUD operations on data.
Build scalable and secure web applications with back-end development skills.","['web development', 'back-end', 'intermediate', 'API development']",2.6,10,High,web develop backend intermedi api develop intermediatelevel cours cover backend web develop learn serversid program api develop databas integr build robust web applic backend web develop
ATISER_145,Advanced Topics in Software Engineering Research,Advanced,This advanced-level course delves into advanced topics in software engineering research. Explore cutting-edge research areas and contribute to the field.,"Explore advanced topics in software engineering research.
Stay updated with cutting-edge research areas and trends.
Contribute to ongoing software engineering research projects.
Publish research findings and advance the field of software engineering.","['software engineering', 'research', 'advanced topics', 'cutting-edge research']",2.2,8,Medium,softwar engin research advanc topic cuttingedg research advancedlevel cours delv advanc topic softwar engin research explor cuttingedg research area contribut field advanc topic softwar engin research
ARAA_140,Advanced Robotics and Automation,Advanced,"This advanced-level course explores advanced robotics and automation technologies. Learn about robot perception, control systems, and autonomous robots.","Master advanced robotics concepts and technologies.
Explore robot perception and sensor fusion techniques.
Understand advanced control systems for robotic applications.
Design and develop autonomous robots and robotic systems.","['robotics', 'automation', 'advanced', 'robot perception', 'autonomous robots']",2.8,9,Medium,robot autom advanc robot percept autonom robot advancedlevel cours explor advanc robot autom technolog learn robot percept control system autonom robot advanc robot autom
BACG_181,Bioinformatics and Computational Genomics,Advanced,This advanced-level course focuses on bioinformatics and computational genomics. Learn to analyze biological data and genomics using computational tools.,"Master bioinformatics techniques for analyzing biological data.
Learn about genomics, structural biology, and computational tools.
Apply computational methods to biological research and analysis.
Contribute to advancements in bioinformatics and genomics research.","['bioinformatics', 'computational genomics', 'advanced', 'biological data analysis', 'genomics research']",2.2,10,High,bioinformat comput genom advanc biolog data analysi genom research advancedlevel cours focus bioinformat comput genom learn analyz biolog data genom use comput tool bioinformat comput genom
ITGD_72,Introduction to Game Development,Beginner,"This beginner-level course provides an introduction to game development. Learn about game design, game engines, and creating simple games.","Understand the fundamentals of game design and game development.
Explore popular game engines like Unity and Godot.
Create simple 2D and 3D games with interactive gameplay.
Learn about the game development process from idea to playable game.","['game development', 'beginner', 'game design', 'game engines']",2.3,10,High,game develop beginn game design game engin beginnerlevel cours provid introduct game develop learn game design game engin creat simpl game introduct game develop
CBFB_3,Computer Basics for Beginners,Beginner,"This course is designed for individuals with little or no prior knowledge of computers. You will learn about computer hardware, software, operating systems, and basic computer usage.","Gain an understanding of computer hardware components and their functions.
Learn about different types of software and their applications.
Explore common operating systems and their features.
Acquire basic computer skills for tasks like file management and internet browsing.","['computer basics', 'beginner', 'computer hardware', 'software', 'operating systems']",3.1,12,Very High,comput basic beginn comput hardwar softwar oper system cours design individu littl prior knowledg comput learn comput hardwar softwar oper system basic comput usag comput basic beginn
CVADL_141,Computer Vision and Deep Learning,Advanced,"This advanced-level course focuses on computer vision and deep learning. Learn about image recognition, neural networks, and advanced vision applications.","Master computer vision techniques and deep learning models.
Learn about image recognition, object detection, and image segmentation.
Explore advanced vision applications in healthcare, robotics, and more.
Develop computer vision and deep learning projects.","['computer vision', 'deep learning', 'advanced', 'image recognition', 'neural networks']",3.4,8,Medium,comput vision deep learn advanc imag recognit neural network advancedlevel cours focus comput vision deep learn learn imag recognit neural network advanc vision applic comput vision deep learn
ITCC_39,Introduction to Cloud Computing,Intermediate,"This intermediate-level course provides an introduction to cloud computing. Learn about cloud service models, deployment models, and cloud security.","Understand cloud computing fundamentals and its benefits.
Learn about cloud service models like IaaS, PaaS, and SaaS.
Explore cloud deployment models and cloud security measures.
Migrate applications to the cloud and manage cloud resources.","['cloud computing', 'intermediate', 'cloud service models', 'cloud security']",2.4,13,Very High,cloud comput intermedi cloud servic model cloud secur intermediatelevel cours provid introduct cloud comput learn cloud servic model deploy model cloud secur introduct cloud comput
BDEAP_231,Big Data Ethics and Privacy,Advanced,This advanced-level course covers big data ethics and privacy. Learn to address ethical and privacy concerns in big data analytics.,"Master advanced big data ethics principles and privacy regulations.
Learn to implement privacy-preserving techniques in big data analytics.
Explore ethical considerations in data collection, storage, and analysis.
Contribute to responsible and ethical big data practices.","['big data ethics', 'privacy', 'advanced', 'data analytics', 'ethical considerations']",2.7,10,High,big data ethic privaci advanc data analyt ethic consider advancedlevel cours cover big data ethic privaci learn address ethic privaci concern big data analyt big data ethic privaci
HC_50,High-Performance Computing,Advanced,"This advanced-level course focuses on high-performance computing (HPC). Learn about parallel processing, cluster computing, and GPU acceleration.","Explore parallel computing architectures and distributed computing.
Learn about GPU acceleration and CUDA programming.
Optimize algorithms and applications for high-performance computing.
Apply HPC techniques in scientific and engineering simulations.","['high-performance computing', 'advanced', 'parallel computing', 'GPU acceleration']",4.0,8,Medium,highperform comput advanc parallel comput gpu acceler advancedlevel cours focus highperform comput hpc learn parallel process cluster comput gpu acceler highperform comput
ACP_32,Advanced C++ Programming,Intermediate,"This intermediate-level course builds on C++ fundamentals. Explore advanced C++ features, including templates, exception handling, and memory management.","Master advanced C++ concepts like templates and exception handling.
Understand memory management and smart pointers in C++.
Explore C++ libraries and advanced topics like multithreading.
Develop efficient and robust C++ applications.","['C++', 'intermediate', 'advanced', 'templates', 'exception handling']",3.7,12,Very High,c intermedi advanc templat except handl intermediatelevel cours build c fundament explor advanc c featur includ templat except handl memori manag advanc c program
CGARM_217,Cybersecurity Governance and Risk Management,Intermediate,This intermediate-level course covers cybersecurity governance and risk management. Learn to establish and maintain cybersecurity policies.,"Understand cybersecurity governance principles and frameworks.
Learn to assess and manage cybersecurity risks.
Explore compliance and regulatory requirements.
Implement effective governance and risk management practices.","['cybersecurity governance', 'risk management', 'intermediate', 'cybersecurity policies', 'compliance']",2.4,7,Low,cybersecur govern risk manag intermedi cybersecur polici complianc intermediatelevel cours cover cybersecur govern risk manag learn establish maintain cybersecur polici cybersecur govern risk manag
ATIMLE_186,Advanced Topics in Machine Learning Ethics,Advanced,This advanced-level course delves into advanced topics in machine learning ethics. Explore ethical considerations in AI and machine learning.,"Master advanced topics in machine learning ethics.
Learn to analyze and address ethical challenges in AI and machine learning.
Explore fairness, transparency, and accountability in AI models.
Contribute to ethical AI development and responsible AI research.","['machine learning ethics', 'advanced', 'ethical challenges', 'fairness', 'accountability']",2.8,8,Medium,machin learn ethic advanc ethic challeng fair account advancedlevel cours delv advanc topic machin learn ethic explor ethic consider ai machin learn advanc topic machin learn ethic
ISFP_194,Internet Safety for Parents,Beginner,This beginner-level course is designed for parents to learn about internet safety. Ensure your child's online safety and digital well-being.,"Understand the online risks and challenges children may face.
Learn to set up parental controls and monitor online activities.
Explore safe internet usage guidelines for kids.
Promote a secure and responsible online environment for your family.","['internet safety', 'parents', 'beginner', 'online risks', 'parental controls']",3.5,10,High,internet safeti parent beginn onlin risk parent control beginnerlevel cours design parent learn internet safeti ensur child onlin safeti digit wellb internet safeti parent
ITRP_201,Introduction to Robotics Programming,Beginner,This beginner-level course introduces robotics programming. Learn the fundamentals of coding and controlling robots.,"Understand the basics of robotics and programming.
Learn to code and control robots for various tasks.
Explore robotics programming languages and platforms.
Embark on your journey into the exciting world of robotics.","['robotics programming', 'beginner', 'robotics fundamentals', 'coding for robots']",2.8,10,High,robot program beginn robot fundament code robot beginnerlevel cours introduc robot program learn fundament code control robot introduct robot program
CNDP_164,Cloud Native DevOps Practices,Intermediate,This intermediate-level course covers cloud-native DevOps practices. Learn to deploy and manage applications in cloud-native environments.,"Understand cloud-native architecture and its benefits.
Learn DevOps practices for deploying and managing applications in the cloud.
Explore containerization and orchestration tools like Docker and Kubernetes.
Implement CI/CD pipelines for automated application deployment.","['cloud-native', 'DevOps', 'intermediate', 'containerization', 'CI/CD']",2.4,7,Low,cloudn devop intermedi container cicd intermediatelevel cours cover cloudn devop practic learn deploy manag applic cloudn environ cloud nativ devop practic
CVAIP_43,Computer Vision and Image Processing,Advanced,"This advanced-level course focuses on computer vision and image processing. Learn about image recognition, feature extraction, and computer vision applications.","Master image processing techniques like image filtering and segmentation.
Learn about feature extraction and object recognition in images.
Explore computer vision applications in autonomous vehicles and healthcare.
Develop computer vision projects and applications.","['computer vision', 'image processing', 'advanced', 'image recognition', 'feature extraction']",2.6,7,Low,comput vision imag process advanc imag recognit featur extract advancedlevel cours focus comput vision imag process learn imag recognit featur extract comput vision applic comput vision imag process
ITCS_70,Introduction to Cloud Services,Beginner,"This beginner-level course provides an introduction to cloud services. Learn about cloud computing models, cloud providers, and cloud-based applications.","Understand the basics of cloud computing and its advantages.
Learn about cloud service models like Infrastructure as a Service (IaaS) and Software as a Service (SaaS).
Explore popular cloud providers and their offerings.
Get hands-on experience with cloud-based applications.","['cloud services', 'beginner', 'cloud computing models', 'IaaS', 'SaaS']",1.9,7,Low,cloud servic beginn cloud comput model iaa saa beginnerlevel cours provid introduct cloud servic learn cloud comput model cloud provid cloudbas applic introduct cloud servic
BOMAD_196,Basics of Mobile App Design,Beginner,This beginner-level course covers the basics of mobile app design. Learn to create user-friendly and visually appealing mobile app interfaces.,"Understand the principles of mobile app design.
Learn about user interface (UI) and user experience (UX) design.
Explore mobile app design tools and best practices.
Design a basic mobile app interface for improved user engagement.","['mobile app design', 'beginner', 'UI/UX design', 'app interface', 'user engagement']",2.5,15,Very High,mobil app design beginn uiux design app interfac user engag beginnerlevel cours cover basic mobil app design learn creat userfriendli visual appeal mobil app interfac basic mobil app design
CPWS_192,Computer Programming with Scratch,Beginner,This beginner-level course introduces computer programming using Scratch. Learn the fundamentals of coding through visual programming.,"Learn the basics of computer programming concepts.
Explore visual programming with Scratch.
Create interactive animations and games using Scratch.
Build coding skills for beginners with hands-on projects.","['computer programming', 'beginner', 'Scratch', 'visual programming', 'coding for kids']",3.9,12,Very High,comput program beginn scratch visual program code kid beginnerlevel cours introduc comput program use scratch learn fundament code visual program comput program scratch
CFSB_193,Cybersecurity for Small Businesses,Beginner,This beginner-level course focuses on cybersecurity for small businesses. Learn to protect your business from online threats and attacks.,"Understand the importance of cybersecurity for small businesses.
Learn to identify and mitigate common cyber threats.
Explore best practices for securing business data and networks.
Implement cybersecurity measures for your small business.","['cybersecurity', 'small businesses', 'beginner', 'cyber threats', 'business data security']",3.1,12,Very High,cybersecur small busi beginn cyber threat busi data secur beginnerlevel cours focus cybersecur small busi learn protect busi onlin threat attack cybersecur small busi
