course_id,course_name,difficulty,description,learning,tags,Average rating,Number of reviews,Popularity
CSAII_144,Cyber-Physical Systems and IoT Integration,Advanced,This advanced-level course focuses on cyber-physical systems (CPS) and their integration with the Internet of Things (IoT). Learn about CPS design and IoT connectivity.,"Master the principles of cyber-physical systems (CPS).
Learn about IoT integration and connectivity for CPS applications.
Explore real-world CPS and IoT use cases in industry.
Design and develop advanced CPS and IoT solutions.","['cyber-physical systems', 'IoT integration', 'advanced', 'CPS design']",3.0,11,High
WAS_33,Web Application Security,Intermediate,"This intermediate-level course focuses on web application security. Learn about common vulnerabilities, security protocols, and secure coding practices.","Identify and mitigate common web application vulnerabilities.
Implement security protocols like HTTPS and OAuth2.
Practice secure coding techniques to protect web applications.
Perform security assessments and penetration testing.","['web application security', 'intermediate', 'vulnerabilities', 'secure coding']",2.9,14,Very High
WDWW_104,Web Development with WordPress,Beginner,This beginner-level course introduces web development with WordPress. Learn to create and customize websites using this popular content management system.,"Get started with web development using WordPress as a content management system.
Create and customize websites with themes and plugins.
Learn about web design principles and user-friendly website development.
Publish and maintain websites using WordPress.","['web development', 'beginner', 'WordPress', 'content management system']",2.9,9,Medium
ATICR_226,Advanced Topics in Cybersecurity Research,Advanced,This advanced-level course delves into advanced topics in cybersecurity research. Explore cutting-edge cybersecurity challenges and solutions.,"Master advanced concepts in cybersecurity research and innovation.
Learn to analyze and address emerging cyber threats and vulnerabilities.
Explore security testing, threat intelligence, and cyber defense strategies.
Contribute to the advancement of cybersecurity knowledge and practices.","['cybersecurity', 'research', 'advanced', 'cyber threats', 'security testing']",2.6,9,Medium
QML_177,Quantum Machine Learning,Advanced,This advanced-level course focuses on quantum machine learning. Learn to leverage quantum computing for advanced machine learning algorithms.,"Understand quantum computing and its applications in machine learning.
Learn to implement quantum algorithms for machine learning tasks.
Explore quantum machine learning libraries and frameworks.
Develop and optimize quantum machine learning models.","['quantum computing', 'machine learning', 'advanced', 'quantum algorithms', 'quantum machine learning']",2.5,14,Very High
ITSMS_191,Introduction to Social Media Security,Beginner,This beginner-level course covers social media security practices. Learn to protect your online presence and privacy on social platforms.,"Understand the importance of social media security.
Learn to set privacy settings and manage online profiles.
Explore common social media threats and scams.
Safeguard your personal information and digital identity on social media.","['social media security', 'beginner', 'online privacy', 'digital identity']",3.4,10,High
ADV_90,Advanced Data Visualization,Intermediate,This intermediate-level course focuses on advanced data visualization techniques. Learn about interactive visualizations and storytelling with data.,"Create advanced data visualizations using tools like D3.js and Tableau.
Understand principles of data storytelling and effective communication.
Develop interactive dashboards and data-driven narratives.
Visualize complex data sets for insights and decision-making.","['data visualization', 'intermediate', 'D3.js', 'Tableau', 'data storytelling']",3.1,15,Very High
AIAV_183,AI in Autonomous Vehicles,Advanced,This advanced-level course focuses on AI in autonomous vehicles. Learn to develop AI systems for self-driving cars and autonomous mobility.,"Understand AI technologies for autonomous vehicles.
Learn to build AI systems for self-driving cars and mobility solutions.
Explore perception, decision-making, and control in autonomous vehicles.
Contribute to the advancement of AI-driven autonomous mobility.","['AI', 'autonomous vehicles', 'advanced', 'self-driving cars', 'mobility solutions']",2.7,7,Low
CSFN_20,Computer Science for Non-Majors,Beginner,This course is designed for individuals who are not computer science majors but want to gain a basic understanding of computer science concepts and applications.,"Gain a foundational understanding of computer science and its relevance in various fields.
Learn about key computer science topics, including algorithms and data structures.
Explore practical applications of computer science in everyday life and various industries.
Acquire problem-solving skills through hands-on exercises and projects.","['computer science', 'beginner', 'non-majors', 'algorithms', 'data structures']",3.4,11,High
BYFMA_203,Building Your First Mobile App,Beginner,This beginner-level course guides you in building your first mobile app. Learn app development basics and create your own mobile application.,"Understand the mobile app development process.
Learn to create a simple mobile app from scratch.
Explore app development tools and platforms.
Turn your app idea into a reality with hands-on development.","['mobile app development', 'beginner', 'app development basics', 'app creation']",2.8,6,Low
IT3PAM_108,Introduction to 3D Printing and Modeling,Beginner,"This beginner-level course introduces 3D printing and modeling. Learn about 3D design, modeling software, and the 3D printing process.","Understand the basics of 3D printing and its applications.
Learn 3D modeling using software like Tinkercad or Blender.
Explore the 3D printing process from design to printing.
Create 3D-printable models and objects.","['3D printing', 'beginner', '3D modeling', 'Tinkercad', 'Blender']",3.0,8,Medium
CBP_29,Cybersecurity Best Practices,Intermediate,"This intermediate-level course focuses on cybersecurity best practices. Learn about threat detection, risk assessment, and security measures to protect digital assets.","Identify common cybersecurity threats and vulnerabilities.
Perform risk assessments and develop security strategies.
Implement security measures to protect networks and data.
Stay updated with cybersecurity best practices and compliance standards.","['cybersecurity', 'security best practices', 'intermediate', 'threat detection']",3.2,12,Very High
CLFS_200,Computer Literacy for Seniors,Beginner,This beginner-level course is designed for seniors to learn computer literacy. Develop basic computer skills and navigate the digital world with confidence.,"Learn the basics of computer hardware and software.
Explore common computer applications and tools.
Develop essential computer skills for everyday tasks.
Become a confident and empowered digital user as a senior.","['computer literacy', 'beginner', 'senior citizens', 'digital skills', 'computer applications']",3.7,6,Low
CHB_66,Computer Hardware Basics,Beginner,"This beginner-level course covers computer hardware fundamentals. Learn about components, peripherals, and basic troubleshooting techniques.","Understand computer hardware components like CPU, RAM, and storage devices.
Learn about input and output peripherals, including keyboards and monitors.
Troubleshoot common hardware issues and perform basic upgrades.
Explore computer hardware terminology and specifications.","['computer hardware', 'beginner', 'hardware components', 'troubleshooting']",2.8,12,Very High
BWD_27,Back-End Web Development,Intermediate,"This intermediate-level course covers back-end web development. Learn server-side programming, API development, and database integration for building robust web applications.","Master server-side programming using languages like Python, Node.js, or Ruby.
Develop RESTful APIs for communication between front-end and back-end systems.
Integrate databases and perform CRUD operations on data.
Build scalable and secure web applications with back-end development skills.","['web development', 'back-end', 'intermediate', 'API development']",2.6,10,High
ATISER_145,Advanced Topics in Software Engineering Research,Advanced,This advanced-level course delves into advanced topics in software engineering research. Explore cutting-edge research areas and contribute to the field.,"Explore advanced topics in software engineering research.
Stay updated with cutting-edge research areas and trends.
Contribute to ongoing software engineering research projects.
Publish research findings and advance the field of software engineering.","['software engineering', 'research', 'advanced topics', 'cutting-edge research']",2.2,8,Medium
ARAA_140,Advanced Robotics and Automation,Advanced,"This advanced-level course explores advanced robotics and automation technologies. Learn about robot perception, control systems, and autonomous robots.","Master advanced robotics concepts and technologies.
Explore robot perception and sensor fusion techniques.
Understand advanced control systems for robotic applications.
Design and develop autonomous robots and robotic systems.","['robotics', 'automation', 'advanced', 'robot perception', 'autonomous robots']",2.8,9,Medium
BACG_181,Bioinformatics and Computational Genomics,Advanced,This advanced-level course focuses on bioinformatics and computational genomics. Learn to analyze biological data and genomics using computational tools.,"Master bioinformatics techniques for analyzing biological data.
Learn about genomics, structural biology, and computational tools.
Apply computational methods to biological research and analysis.
Contribute to advancements in bioinformatics and genomics research.","['bioinformatics', 'computational genomics', 'advanced', 'biological data analysis', 'genomics research']",2.2,10,High
ITGD_72,Introduction to Game Development,Beginner,"This beginner-level course provides an introduction to game development. Learn about game design, game engines, and creating simple games.","Understand the fundamentals of game design and game development.
Explore popular game engines like Unity and Godot.
Create simple 2D and 3D games with interactive gameplay.
Learn about the game development process from idea to playable game.","['game development', 'beginner', 'game design', 'game engines']",2.3,10,High
CBFB_3,Computer Basics for Beginners,Beginner,"This course is designed for individuals with little or no prior knowledge of computers. You will learn about computer hardware, software, operating systems, and basic computer usage.","Gain an understanding of computer hardware components and their functions.
Learn about different types of software and their applications.
Explore common operating systems and their features.
Acquire basic computer skills for tasks like file management and internet browsing.","['computer basics', 'beginner', 'computer hardware', 'software', 'operating systems']",3.1,12,Very High
CVADL_141,Computer Vision and Deep Learning,Advanced,"This advanced-level course focuses on computer vision and deep learning. Learn about image recognition, neural networks, and advanced vision applications.","Master computer vision techniques and deep learning models.
Learn about image recognition, object detection, and image segmentation.
Explore advanced vision applications in healthcare, robotics, and more.
Develop computer vision and deep learning projects.","['computer vision', 'deep learning', 'advanced', 'image recognition', 'neural networks']",3.4,8,Medium
ITCC_39,Introduction to Cloud Computing,Intermediate,"This intermediate-level course provides an introduction to cloud computing. Learn about cloud service models, deployment models, and cloud security.","Understand cloud computing fundamentals and its benefits.
Learn about cloud service models like IaaS, PaaS, and SaaS.
Explore cloud deployment models and cloud security measures.
Migrate applications to the cloud and manage cloud resources.","['cloud computing', 'intermediate', 'cloud service models', 'cloud security']",2.4,13,Very High
BDEAP_231,Big Data Ethics and Privacy,Advanced,This advanced-level course covers big data ethics and privacy. Learn to address ethical and privacy concerns in big data analytics.,"Master advanced big data ethics principles and privacy regulations.
Learn to implement privacy-preserving techniques in big data analytics.
Explore ethical considerations in data collection, storage, and analysis.
Contribute to responsible and ethical big data practices.","['big data ethics', 'privacy', 'advanced', 'data analytics', 'ethical considerations']",2.7,10,High
HC_50,High-Performance Computing,Advanced,"This advanced-level course focuses on high-performance computing (HPC). Learn about parallel processing, cluster computing, and GPU acceleration.","Explore parallel computing architectures and distributed computing.
Learn about GPU acceleration and CUDA programming.
Optimize algorithms and applications for high-performance computing.
Apply HPC techniques in scientific and engineering simulations.","['high-performance computing', 'advanced', 'parallel computing', 'GPU acceleration']",4.0,8,Medium
ACP_32,Advanced C++ Programming,Intermediate,"This intermediate-level course builds on C++ fundamentals. Explore advanced C++ features, including templates, exception handling, and memory management.","Master advanced C++ concepts like templates and exception handling.
Understand memory management and smart pointers in C++.
Explore C++ libraries and advanced topics like multithreading.
Develop efficient and robust C++ applications.","['C++', 'intermediate', 'advanced', 'templates', 'exception handling']",3.7,12,Very High
CGARM_217,Cybersecurity Governance and Risk Management,Intermediate,This intermediate-level course covers cybersecurity governance and risk management. Learn to establish and maintain cybersecurity policies.,"Understand cybersecurity governance principles and frameworks.
Learn to assess and manage cybersecurity risks.
Explore compliance and regulatory requirements.
Implement effective governance and risk management practices.","['cybersecurity governance', 'risk management', 'intermediate', 'cybersecurity policies', 'compliance']",2.4,7,Low
ATIMLE_186,Advanced Topics in Machine Learning Ethics,Advanced,This advanced-level course delves into advanced topics in machine learning ethics. Explore ethical considerations in AI and machine learning.,"Master advanced topics in machine learning ethics.
Learn to analyze and address ethical challenges in AI and machine learning.
Explore fairness, transparency, and accountability in AI models.
Contribute to ethical AI development and responsible AI research.","['machine learning ethics', 'advanced', 'ethical challenges', 'fairness', 'accountability']",2.8,8,Medium
ISFP_194,Internet Safety for Parents,Beginner,This beginner-level course is designed for parents to learn about internet safety. Ensure your child's online safety and digital well-being.,"Understand the online risks and challenges children may face.
Learn to set up parental controls and monitor online activities.
Explore safe internet usage guidelines for kids.
Promote a secure and responsible online environment for your family.","['internet safety', 'parents', 'beginner', 'online risks', 'parental controls']",3.5,10,High
ITRP_201,Introduction to Robotics Programming,Beginner,This beginner-level course introduces robotics programming. Learn the fundamentals of coding and controlling robots.,"Understand the basics of robotics and programming.
Learn to code and control robots for various tasks.
Explore robotics programming languages and platforms.
Embark on your journey into the exciting world of robotics.","['robotics programming', 'beginner', 'robotics fundamentals', 'coding for robots']",2.8,10,High
CNDP_164,Cloud Native DevOps Practices,Intermediate,This intermediate-level course covers cloud-native DevOps practices. Learn to deploy and manage applications in cloud-native environments.,"Understand cloud-native architecture and its benefits.
Learn DevOps practices for deploying and managing applications in the cloud.
Explore containerization and orchestration tools like Docker and Kubernetes.
Implement CI/CD pipelines for automated application deployment.","['cloud-native', 'DevOps', 'intermediate', 'containerization', 'CI/CD']",2.4,7,Low
CVAIP_43,Computer Vision and Image Processing,Advanced,"This advanced-level course focuses on computer vision and image processing. Learn about image recognition, feature extraction, and computer vision applications.","Master image processing techniques like image filtering and segmentation.
Learn about feature extraction and object recognition in images.
Explore computer vision applications in autonomous vehicles and healthcare.
Develop computer vision projects and applications.","['computer vision', 'image processing', 'advanced', 'image recognition', 'feature extraction']",2.6,7,Low
ITCS_70,Introduction to Cloud Services,Beginner,"This beginner-level course provides an introduction to cloud services. Learn about cloud computing models, cloud providers, and cloud-based applications.","Understand the basics of cloud computing and its advantages.
Learn about cloud service models like Infrastructure as a Service (IaaS) and Software as a Service (SaaS).
Explore popular cloud providers and their offerings.
Get hands-on experience with cloud-based applications.","['cloud services', 'beginner', 'cloud computing models', 'IaaS', 'SaaS']",1.9,7,Low
BOMAD_196,Basics of Mobile App Design,Beginner,This beginner-level course covers the basics of mobile app design. Learn to create user-friendly and visually appealing mobile app interfaces.,"Understand the principles of mobile app design.
Learn about user interface (UI) and user experience (UX) design.
Explore mobile app design tools and best practices.
Design a basic mobile app interface for improved user engagement.","['mobile app design', 'beginner', 'UI/UX design', 'app interface', 'user engagement']",2.5,15,Very High
CPWS_192,Computer Programming with Scratch,Beginner,This beginner-level course introduces computer programming using Scratch. Learn the fundamentals of coding through visual programming.,"Learn the basics of computer programming concepts.
Explore visual programming with Scratch.
Create interactive animations and games using Scratch.
Build coding skills for beginners with hands-on projects.","['computer programming', 'beginner', 'Scratch', 'visual programming', 'coding for kids']",3.9,12,Very High
CFSB_193,Cybersecurity for Small Businesses,Beginner,This beginner-level course focuses on cybersecurity for small businesses. Learn to protect your business from online threats and attacks.,"Understand the importance of cybersecurity for small businesses.
Learn to identify and mitigate common cyber threats.
Explore best practices for securing business data and networks.
Implement cybersecurity measures for your small business.","['cybersecurity', 'small businesses', 'beginner', 'cyber threats', 'business data security']",3.1,12,Very High
ANS_46,Advanced Network Security,Advanced,"This advanced-level course focuses on advanced network security. Learn about intrusion detection systems, secure network design, and security protocols.","Master intrusion detection and prevention techniques.
Design and implement secure network architectures.
Explore advanced security protocols and encryption methods.
Analyze network traffic for security threats and anomalies.","['network security', 'advanced', 'intrusion detection', 'security protocols']",2.6,14,Very High
PWS_73,Programming with Scratch,Beginner,"This beginner-level course teaches programming concepts using Scratch, a visual programming language. Learn coding basics through interactive projects.","Get started with coding using the Scratch visual programming language.
Learn programming concepts like loops, conditionals, and variables.
Create interactive stories, animations, and games in Scratch.
Develop computational thinking and problem-solving skills.","['programming', 'beginner', 'Scratch', 'visual programming']",3.0,8,Medium
DLFB_109,Digital Literacy for Beginners,Beginner,"This beginner-level course focuses on digital literacy basics. Learn about internet safety, online communication, and digital tools for everyday life.","Understand the importance of digital literacy in the modern world.
Learn about internet safety, online etiquette, and privacy.
Explore digital tools for communication, productivity, and information.
Build digital skills for daily life and online interactions.","['digital literacy', 'beginner', 'internet safety', 'online communication']",3.4,12,Very High
AWDAUE_205,Advanced Web Design and User Experience ,Intermediate,This intermediate-level course covers advanced web design and user experience (UX) principles. Enhance your web design skills.,"Master advanced web design techniques and principles.
Learn to create user-centered web interfaces.
Explore advanced UX design methodologies.
Design and prototype responsive and engaging web experiences.","['web design', 'UX', 'intermediate', 'responsive design', 'user-centered design']",2.9,10,High
NFB_11,Networking for Beginners,Beginner,"This beginner-level course covers the basics of computer networking. You will learn about network components, protocols, and how data is transmitted over networks.","Understand the key components of computer networks, including routers, switches, and cables.
Learn about network protocols and their role in data transmission.
Explore the fundamentals of IP addressing and subnetting.
Gain knowledge about network security and troubleshooting.","['networking', 'beginner', 'network protocols', 'IP addressing', 'network security']",2.6,8,Medium
HID_172,Human-AI Interaction Design,Intermediate,This intermediate-level course focuses on human-AI interaction design. Learn to create intuitive and user-friendly AI-driven interfaces and experiences.,"Understand the principles of human-AI interaction design.
Learn to design user-friendly AI-driven interfaces and applications.
Explore AI ethics and responsible AI design.
Design and prototype AI-powered user interfaces.","['human-AI interaction', 'interaction design', 'intermediate', 'user-friendly design', 'AI ethics']",2.5,13,Very High
ATICSR_60,Advanced Topics in Computer Science Research,Advanced,This advanced-level course explores cutting-edge topics in computer science research. Learn about emerging technologies and research trends.,"Explore cutting-edge topics in computer science research.
Learn about emerging technologies like quantum computing and AI advancements.
Understand research methodologies and scholarly writing in computer science.
Contribute to ongoing research projects.","['computer science', 'research', 'advanced', 'emerging technologies', 'research methodologies']",3.1,13,Very High
RAAS_56,Robotics and Autonomous Systems,Advanced,"This advanced-level course focuses on robotics and autonomous systems. Learn about robot kinematics, control systems, and autonomous navigation.","Explore robot kinematics and dynamics for robotic arm control.
Learn about control systems and sensors in robotics.
Understand autonomous navigation and path planning algorithms.
Develop autonomous robotic systems for various applications.","['robotics', 'autonomous systems', 'advanced', 'kinematics', 'control systems']",3.4,11,High
BOOS_18,Basics of Operating Systems,Beginner,"This beginner-level course covers the basics of operating systems, including their functions, components, and management.","Understand the role of operating systems in managing computer hardware.
Learn about key components of operating systems, such as file systems and memory management.
Explore process management and multitasking in operating systems.
Gain insights into operating system security and maintenance.","['operating systems', 'beginner', 'file systems', 'memory management', 'security']",2.3,3,Low
ITVRD_75,Introduction to Virtual Reality  Development,Beginner,"This beginner-level course introduces virtual reality (VR) development. Learn about VR hardware, 3D modeling, and creating VR experiences.","Understand the basics of virtual reality (VR) and its applications.
Explore VR hardware and devices like VR headsets.
Learn 3D modeling for creating VR environments and objects.
Create immersive VR experiences and applications.","['virtual reality', 'beginner', 'VR hardware', '3D modeling']",2.4,9,Medium
ITD_13,Introduction to Databases,Beginner,"This beginner-level course introduces the fundamentals of databases. You will learn about data modeling, SQL queries, and database management systems.","Understand the importance of databases in data storage and retrieval.
Learn about data modeling techniques and database design principles.
Write SQL queries to retrieve and manipulate data in databases.
Explore different database management systems and their features.","['databases', 'beginner', 'data modeling', 'SQL queries', 'database management']",3.1,15,Very High
CRA_162,Cybersecurity Risk Assessment,Intermediate,"This intermediate-level course covers cybersecurity risk assessment. Learn to identify, assess, and mitigate security risks in various contexts.","Understand the principles of cybersecurity risk assessment.
Learn to identify and analyze security threats and vulnerabilities.
Explore risk mitigation strategies and security controls.
Conduct practical risk assessments in real-world scenarios.","['cybersecurity', 'risk assessment', 'intermediate', 'security threats', 'risk mitigation']",3.5,11,High
