course_id,course_name,difficulty,description,learning,tags,Average rating,Number of reviews,Popularity
QAAQCA_95,Quantum Algorithms and Quantum Computing Applications,Advanced,This advanced-level course covers quantum algorithms and applications in quantum computing. Learn about quantum programming and quantum simulations.,"Understand quantum algorithms and their advantages over classical algorithms.
Learn about quantum programming languages and quantum simulators.
Explore real-world applications of quantum computing in various fields.
Develop and optimize quantum algorithms for specific tasks.","['quantum computing', 'advanced', 'quantum algorithms', 'quantum programming']",3.4,10,High
CNSAD_137,Cloud Native Security and DevSecOps,Advanced,This advanced-level course covers cloud native security and DevSecOps practices. Learn to secure cloud-native applications and adopt a DevSecOps culture.,"Master cloud native security practices and tools.
Implement security measures for cloud-native applications.
Integrate security into the DevOps process with DevSecOps practices.
Adopt a culture of security and automation in cloud environments.","['cloud security', 'advanced', 'DevSecOps', 'cloud-native applications']",2.7,6,Low
ADP_215,Advanced DevOps Practices,Intermediate,This intermediate-level course delves into advanced DevOps practices. Learn to automate software development and deployment pipelines.,"Master advanced DevOps principles and practices.
Learn to set up continuous integration and continuous deployment (CI/CD) pipelines.
Explore containerization, orchestration, and infrastructure as code (IaC).
Improve software delivery and deployment with DevOps expertise.","['DevOps', 'intermediate', 'CI/CD', 'containerization', 'IaC']",2.2,8,Medium
ITVGD_158,Introduction to Video Game Design,Beginner,"This beginner-level course introduces video game design concepts. Learn about game development, mechanics, and creating interactive gameplay.","Understand the fundamentals of video game design and development.
Learn about game mechanics, storyboarding, and level design.
Explore interactive gameplay and user engagement strategies.
Create basic video game prototypes and projects.","['video game design', 'beginner', 'game development', 'game mechanics', 'interactive gameplay']",3.3,10,High
SQA_89,Software Quality Assurance,Intermediate,This intermediate-level course covers software quality assurance (QA) principles and practices. Learn about testing methodologies and QA processes.,"Understand the importance of software quality assurance in the development cycle.
Learn about different testing methodologies, including manual and automated testing.
Perform test planning, test case design, and test execution.
Implement QA processes and strategies for delivering high-quality software.","['software quality assurance', 'intermediate', 'testing methodologies', 'QA processes']",2.9,10,High
CGAV_36,Computer Graphics and Visualization,Intermediate,"This intermediate-level course covers computer graphics and data visualization. Learn about rendering techniques, 3D graphics, and interactive visualization.","Explore computer graphics principles, including rendering and shading.
Learn about 3D graphics and modeling techniques.
Create interactive visualizations and simulations.
Apply computer graphics and visualization in multimedia and gaming.","['computer graphics', 'visualization', 'intermediate', '3D graphics']",2.4,10,High
ITAI_17,Introduction to Artificial Intelligence,Beginner,"This beginner-level course introduces the field of artificial intelligence (AI). You will learn about AI concepts, machine learning, and practical AI applications.","Understand the basics of artificial intelligence and its applications.
Learn about machine learning and its role in AI.
Explore practical AI applications in areas like image recognition and natural language processing.
Get an overview of ethical considerations in AI development.","['artificial intelligence', 'beginner', 'machine learning', 'AI applications', 'ethics']",2.9,13,Very High
ITCPT_159,Introduction to Cloud-Based Productivity Tools,Beginner,"This beginner-level course introduces cloud-based productivity tools. Learn about cloud applications for collaboration, document management, and more.","Understand the benefits of cloud-based productivity tools.
Learn to use cloud applications for collaboration and document management.
Explore productivity-enhancing features and functionalities.
Integrate cloud-based tools into daily tasks for improved efficiency.","['cloud-based tools', 'beginner', 'productivity', 'cloud applications', 'collaboration']",2.8,6,Low
ISAP_211,IoT Security and Protocols,Intermediate,This intermediate-level course focuses on IoT security and protocols. Learn to secure Internet of Things (IoT) devices and networks.,"Understand the importance of IoT security and protocols.
Learn about IoT device authentication and encryption.
Explore common IoT security threats and mitigation strategies.
Secure IoT ecosystems and protect against cyber threats.","['IoT security', 'protocols', 'intermediate', 'device authentication', 'cyber threats']",3.8,8,Medium
DMS_25,Database Management Systems,Intermediate,"This intermediate-level course covers database management systems (DBMS). Learn about relational databases, SQL, normalization, and database design.","Understand relational databases and DBMS architecture.
Learn SQL for data retrieval and manipulation.
Explore database normalization and design principles.
Design and implement databases for various applications.","['database management', 'DBMS', 'intermediate', 'SQL', 'normalization']",3.1,8,Medium
AIAAC_234,AI in Art and Creativity,Advanced,This advanced-level course explores AI in art and creativity. Learn to create AI-generated art and innovative creative applications.,"Master AI techniques for generative art and creative content creation.
Learn to build AI-driven creative tools and applications.
Explore applications in music composition, visual arts, and design.
Contribute to the intersection of AI and art for creative innovations.","['AI', 'art', 'creativity', 'advanced', 'generative art']",2.4,14,Very High
HCC_94,High-Performance Computing Clusters,Advanced,"This advanced-level course focuses on high-performance computing clusters. Learn about cluster architecture, parallel processing, and HPC applications.","Explore high-performance computing (HPC) cluster architecture.
Learn about parallel processing and distributed computing.
Develop and optimize applications for HPC clusters.
Apply HPC techniques in scientific simulations and data analysis.","['high-performance computing', 'advanced', 'HPC clusters', 'parallel processing']",2.4,9,Medium
ITHAC_8,Introduction to HTML and CSS,Beginner,"This beginner-level course focuses on the fundamentals of web development, covering HTML for content structure and CSS for styling web pages.","Learn the basics of HTML for creating structured web content.
Understand how CSS is used to style and format web pages.
Create simple web pages using HTML and CSS.
Explore web development best practices and standards.","['HTML', 'CSS', 'web development', 'beginner']",3.0,10,High
ITCS_1,Introduction to Computer Science,Beginner,"This course provides an introduction to the field of computer science. You will learn about the fundamental concepts, history, and various areas within computer science. Topics covered include algorithms, data structures, programming, and problem-solving.","Understand the basics of computer science and its importance in today's world.
Learn about algorithms and their role in solving problems efficiently.
Explore data structures and their applications in software development.
Get an overview of programming languages and their usage in computer science.","['computer science', 'beginner', 'programming', 'algorithms', 'data structures']",2.9,7,Low
CPFB_14,C++ Programming for Beginners,Beginner,"This course is designed for beginners and covers the fundamentals of the C++ programming language. You will learn about C++ syntax, data types, and basic programming concepts.","Familiarize yourself with C++ syntax, including variables, loops, and functions.
Learn about C++ data types and their usage.
Write C++ programs to solve basic problems and tasks.
Understand how C++ can be used in various applications, including game development and system programming.","['C++', 'beginner', 'programming', 'data types']",2.9,9,Medium
ABD_176,Advanced Blockchain Development,Advanced,This advanced-level course delves into advanced blockchain development. Learn to build decentralized applications (DApps) and smart contracts.,"Master advanced blockchain development techniques.
Learn to build decentralized applications (DApps) on blockchain platforms.
Explore smart contract development and blockchain security.
Implement blockchain solutions for various industries.","['blockchain development', 'advanced', 'DApps', 'smart contracts', 'blockchain security']",2.8,20,Very High
EHFCE_184,Ethical Hacking for Cybersecurity Experts,Advanced,This advanced-level course covers ethical hacking for cybersecurity experts. Learn advanced penetration testing and security assessment techniques.,"Master advanced ethical hacking techniques and methodologies.
Learn to conduct in-depth penetration tests and security assessments.
Explore advanced hacking tools and vulnerability exploitation.
Enhance cybersecurity defenses through ethical hacking expertise.","['ethical hacking', 'advanced', 'penetration testing', 'security assessment', 'cybersecurity experts']",3.0,11,High
CRM_92,Cybersecurity Risk Management,Advanced,"This advanced-level course focuses on cybersecurity risk management. Learn about risk assessment, threat modeling, and risk mitigation strategies.","Conduct cybersecurity risk assessments for organizations.
Perform threat modeling and vulnerability assessments.
Develop risk mitigation strategies and incident response plans.
Manage cybersecurity risks in complex environments.","['cybersecurity', 'advanced', 'risk management', 'threat modeling']",2.7,6,Low
BOGAGD_202,Basics of Gaming and Game Development,Beginner,"This beginner-level course covers the basics of gaming and game development. Learn about game design, development tools, and game industry insights.","Understand the fundamentals of gaming and the game development process.
Learn about game design principles and game mechanics.
Explore game development tools and platforms.
Begin your journey into the world of game creation and design.","['gaming', 'game development', 'beginner', 'game design', 'game mechanics']",2.6,9,Medium
FO3P_154,Fundamentals of 3D Printing,Beginner,"This beginner-level course covers the fundamentals of 3D printing technology. Learn about 3D modeling, printing processes, and applications of 3D printing.","Understand the basics of 3D printing technology and its applications.
Learn about 3D modeling and design for 3D printing.
Explore different 3D printing processes and materials.
Gain hands-on experience in 3D printing projects.","['3D printing', 'beginner', '3D modeling', 'printing processes', 'technology']",3.6,11,High
HC_143,Human-AI Collaboration,Advanced,This advanced-level course explores human-AI collaboration. Learn how humans and artificial intelligence can work together in various domains.,"Understand the principles of human-AI collaboration.
Explore case studies of AI-human collaboration in healthcare, finance, and more.
Learn about AI augmentation of human capabilities.
Develop strategies for effective human-AI collaboration.","['human-AI collaboration', 'advanced', 'AI augmentation', 'collaboration strategies']",2.5,10,High
ATIMLR_97,Advanced Topics in Machine Learning Research,Advanced,This advanced-level course explores advanced topics in machine learning research. Learn about cutting-edge algorithms and research trends.,"Explore advanced machine learning algorithms and models.
Understand recent research developments in machine learning.
Contribute to ongoing machine learning research projects.
Publish and present research findings in machine learning.","['machine learning', 'advanced', 'research', 'algorithms']",2.8,8,Medium
ITVPN_199,Introduction to Virtual Private Networks ,Beginner,This beginner-level course introduces virtual private networks (VPNs). Learn how VPNs work and how to use them for online security and privacy.,"Understand the concept of virtual private networks (VPNs).
Learn how VPNs enhance online security and privacy.
Explore VPN setup and configuration on different devices.
Use VPNs to protect your online activities and sensitive data.","['VPN', 'beginner', 'online security', 'privacy protection']",2.6,5,Low
AWD_76,Advanced Web Development,Intermediate,"This intermediate-level course delves deeper into web development. Learn about advanced web technologies, frameworks, and web application deployment.","Explore advanced web technologies like Node.js and Django.
Learn about web application frameworks and RESTful APIs.
Deploy web applications to production servers and cloud platforms.
Develop feature-rich web applications with modern UI/UX design.","['web development', 'intermediate', 'Node.js', 'Django', 'web application']",2.8,13,Very High
WHADM_67,Web Hosting and Domain Management,Beginner,"This beginner-level course covers web hosting and domain management basics. Learn how to register domains, choose hosting providers, and manage websites.","Register and manage domain names for websites.
Choose appropriate web hosting providers and plans.
Set up and configure websites on web hosting servers.
Understand DNS and domain-related terminology.","['web hosting', 'domain management', 'beginner', 'DNS']",3.3,6,Low
CSFE_156,Computer Science for Educators,Beginner,"This beginner-level course is designed for educators. Learn about computer science concepts, programming basics, and integrating CS into education.","Understand fundamental computer science concepts and principles.
Learn the basics of programming and algorithmic thinking.
Explore strategies for integrating computer science into educational curricula.
Develop teaching approaches to enhance computer science education.","['computer science', 'beginner', 'programming basics', 'educational integration', 'teaching']",2.3,6,Low
AIBS_174,AI in Business Strategy,Intermediate,This intermediate-level course focuses on the strategic use of AI in business. Learn to develop AI-driven business strategies and solutions.,"Understand the strategic implications of AI in business.
Learn to develop AI-driven business strategies and use cases.
Explore AI implementation in various business domains.
Leverage AI for competitive advantage and business growth.","['AI', 'business strategy', 'intermediate', 'AI implementation', 'competitive advantage']",2.0,8,Medium
CGAC_175,Cybersecurity Governance and Compliance,Advanced,This advanced-level course covers cybersecurity governance and compliance. Learn to establish robust cybersecurity frameworks and compliance measures.,"Master cybersecurity governance principles and best practices.
Learn to establish cybersecurity compliance measures.
Explore regulatory frameworks and cybersecurity audits.
Develop and implement cybersecurity policies and procedures.","['cybersecurity', 'governance', 'compliance', 'advanced', 'cybersecurity policies']",2.1,7,Low
AUER_173,Advanced User Experience  Research,Intermediate,This intermediate-level course delves into advanced user experience (UX) research. Learn to conduct in-depth UX research and usability studies.,"Master advanced UX research methodologies and techniques.
Learn to conduct usability studies and user testing.
Explore user journey mapping and persona development.
Apply advanced UX research skills to improve product design.","['user experience', 'UX research', 'intermediate', 'usability studies', 'user testing']",3.9,12,Very High
AFF_214,Advanced Front-End Frameworks,Intermediate,This intermediate-level course covers advanced front-end frameworks. Learn to build dynamic and responsive web interfaces.,"Master advanced front-end frameworks, such as React and Angular.
Learn to create interactive and responsive web applications.
Explore state management, routing, and component-based development.
Build advanced web interfaces with modern front-end technologies.","['front-end frameworks', 'intermediate', 'React', 'Angular', 'web applications']",3.2,6,Low
ACSM_185,Advanced Cloud Security Management,Advanced,This advanced-level course focuses on advanced cloud security management. Learn to secure cloud environments and protect cloud-based assets.,"Master advanced cloud security concepts and best practices.
Learn to secure cloud infrastructure and data in diverse cloud environments.
Explore identity and access management (IAM) in cloud security.
Implement advanced cloud security strategies and incident response.","['cloud security', 'advanced', 'cloud infrastructure', 'IAM', 'incident response']",2.5,8,Medium
NSAPT_79,Network Security and Penetration Testing,Intermediate,This intermediate-level course focuses on network security and penetration testing. Learn about securing networks and ethical hacking techniques.,"Master network security principles and secure network design.
Conduct penetration testing and vulnerability assessment.
Explore ethical hacking techniques for network security.
Analyze network traffic for security threats and anomalies.","['network security', 'intermediate', 'penetration testing', 'ethical hacking']",3.4,10,High
ITCFS_190,Introduction to Cloud File Storage,Beginner,This beginner-level course introduces cloud file storage services. Learn to store and manage files in the cloud.,"Understand the basics of cloud file storage services.
Learn to upload, download, and organize files in the cloud.
Explore file sharing and collaboration features in cloud storage.
Securely manage your digital files using cloud storage solutions.","['cloud file storage', 'beginner', 'file management', 'cloud security']",2.0,5,Low
ATICG_100,Advanced Topics in Computer Graphics,Advanced,"This advanced-level course explores advanced topics in computer graphics. Learn about real-time rendering, 3D modeling, and graphics programming.","Explore advanced techniques in real-time rendering and computer graphics.
Learn about 3D modeling, animation, and visualization.
Develop graphics applications and games using modern graphics APIs.
Apply computer graphics concepts in virtual reality and augmented reality.","['computer graphics', 'advanced', 'real-time rendering', '3D modeling']",3.1,8,Medium
ITCSAB_113,Introduction to Cloud Storage and Backup,Beginner,"This beginner-level course introduces cloud storage and backup solutions. Learn about cloud storage providers, data backup strategies, and cloud data management.","Understand the advantages of cloud storage and backup solutions.
Learn about popular cloud storage providers and their offerings.
Implement data backup strategies in cloud environments.
Manage cloud-based data and ensure data security.","['cloud storage', 'beginner', 'data backup', 'cloud data management']",3.3,12,Very High
QCFC_235,Quantum Computing for Cryptanalysis,Advanced,This advanced-level course focuses on quantum computing for cryptanalysis. Learn to analyze and strengthen cryptographic systems against quantum attacks.,"Master advanced quantum computing concepts and cryptographic principles.
Learn to assess the vulnerability of cryptographic systems to quantum attacks.
Explore post-quantum cryptography and quantum-resistant algorithms.
Contribute to the security of digital communications in the quantum era.","['quantum computing', 'cryptanalysis', 'advanced', 'post-quantum cryptography', 'quantum-resistant algorithms']",2.2,8,Medium
ITDA_105,Introduction to Data Analysis,Beginner,"This beginner-level course focuses on data analysis basics. Learn about data exploration, visualization, and basic statistical analysis techniques.","Understand the fundamentals of data analysis and its applications.
Learn data exploration techniques and data cleaning.
Create data visualizations using tools like Excel and basic statistical analysis.
Analyze real-world data sets to gain data analysis skills.","['data analysis', 'beginner', 'data exploration', 'data visualization']",3.6,10,High
DSFB_7,Data Structures for Beginners,Beginner,"This beginner-level course introduces data structures and their importance in computer science. You will learn about arrays, linked lists, stacks, and queues.","Understand the concept of data structures and their significance.
Learn about commonly used data structures like arrays and linked lists.
Explore the principles of stack and queue data structures.
Implement and use data structures in practical programming scenarios.","['data structures', 'beginner', 'arrays', 'linked lists', 'stacks', 'queues']",3.6,5,Low
MAD_28,Mobile App Development,Intermediate,"This intermediate-level course covers mobile app development for iOS and Android platforms. Learn about app design, development frameworks, and deployment.","Explore mobile app design principles and user interfaces.
Learn mobile app development using platforms like Swift (iOS) or Java/Kotlin (Android).
Understand app testing, debugging, and deployment.
Develop and publish mobile apps for real-world use.","['mobile app development', 'iOS', 'Android', 'intermediate', 'app deployment']",2.8,11,High
ITDS_65,Introduction to Data Science,Beginner,"This beginner-level course provides an introduction to data science. Learn about data analysis, visualization, and basic machine learning concepts.","Explore data analysis and visualization using tools like Excel or Python.
Understand data cleaning and preprocessing techniques.
Learn about basic machine learning algorithms and their applications.
Get hands-on experience with data science projects.","['data science', 'beginner', 'data analysis', 'machine learning']",2.7,6,Low
CAEH_45,Cybersecurity and Ethical Hacking,Advanced,"This advanced-level course covers cybersecurity and ethical hacking. Learn about advanced threat detection, penetration testing, and ethical hacking techniques.","Master advanced threat detection and incident response techniques.
Conduct penetration testing and vulnerability assessment.
Explore ethical hacking techniques for network and web application security.
Understand security auditing and compliance standards.","['cybersecurity', 'ethical hacking', 'advanced', 'penetration testing']",2.8,8,Medium
ITJP_15,Introduction to Java Programming,Beginner,"This beginner-level course introduces the Java programming language. You will learn Java syntax, object-oriented programming concepts, and how to write Java applications.","Familiarize yourself with Java syntax, including variables, classes, and methods.
Learn about object-oriented programming principles in Java.
Write Java programs to solve basic problems and tasks.
Explore the versatility of Java in various applications, including web development and mobile app development.","['Java', 'beginner', 'programming', 'object-oriented programming']",3.2,9,Medium
ITE_197,Introduction to E-Commerce,Beginner,"This beginner-level course introduces the fundamentals of e-commerce. Learn about online shopping, payment systems, and e-commerce business models.","Understand the basics of e-commerce and its evolution.
Learn about online shopping platforms and payment gateways.
Explore e-commerce business models and strategies.
Start your journey into the world of online selling and entrepreneurship.","['e-commerce', 'beginner', 'online shopping', 'payment systems', 'entrepreneurship']",2.9,8,Medium
ACABT_139,Advanced Cryptocurrency and Blockchain Technologies,Advanced,"This advanced-level course delves into advanced cryptocurrency and blockchain technologies. Learn about smart contracts, consensus algorithms, and blockchain scaling.","Master advanced cryptocurrency and blockchain concepts.
Explore smart contracts and decentralized applications (DApps).
Understand blockchain consensus algorithms and scalability solutions.
Participate in advanced blockchain development and research.","['cryptocurrency', 'blockchain', 'advanced', 'smart contracts', 'consensus algorithms']",2.7,10,High
ACAD_210,Advanced Cloud Architecture Design,Intermediate,This intermediate-level course covers advanced cloud architecture design. Learn to design scalable and resilient cloud solutions.,"Master advanced cloud architecture concepts and principles.
Learn to design cloud solutions for high availability and performance.
Explore cloud security and compliance considerations.
Design and implement cloud architectures for diverse business needs.","['cloud architecture', 'intermediate', 'scalability', 'cloud security', 'compliance']",2.6,10,High
ITR_74,Introduction to Robotics,Beginner,"This beginner-level course introduces robotics concepts. Learn about robot components, sensors, and basic robot programming.","Understand the components and sensors commonly used in robots.
Learn basic robot programming and control techniques.
Explore real-world applications of robotics in various fields.
Get hands-on experience with robot building and programming.","['robotics', 'beginner', 'robot components', 'robot programming']",2.8,9,Medium
NLPFAA_142,Natural Language Processing for Advanced Applications,Advanced,"This advanced-level course focuses on natural language processing (NLP) for advanced applications. Learn about sentiment analysis, chatbots, and NLP in healthcare.","Master advanced NLP techniques for text analysis and understanding.
Learn about sentiment analysis, chatbot development, and NLP in healthcare.
Explore real-world NLP applications in various industries.
Develop advanced NLP projects and solutions.","['natural language processing', 'NLP', 'advanced', 'sentiment analysis', 'chatbots']",3.0,6,Low
