course_id,course_name,difficulty,description,learning,tags,Average rating,Number of reviews,Popularity
QC_51,Quantum Computing,Advanced,"This advanced-level course covers quantum computing. Learn about quantum algorithms, quantum gates, and quantum hardware.","Explore quantum computing principles and quantum bits (qubits).
Learn about quantum algorithms like Shor's algorithm and Grover's algorithm.
Understand quantum gates and quantum circuit design.
Experiment with quantum computing using simulators and real quantum hardware.","['quantum computing', 'advanced', 'quantum algorithms', 'quantum gates']",3.0,11,High
ITCFK_153,Introduction to Cybersecurity for Kids,Beginner,"This beginner-level course introduces cybersecurity concepts to kids. Learn about online safety, cyber threats, and safe internet practices.","Understand the importance of online safety and cybersecurity.
Learn about common cyber threats and how to protect against them.
Explore safe internet practices and responsible online behavior.
Develop foundational knowledge of cybersecurity for a safe digital experience.","['cybersecurity', 'beginner', 'online safety', 'cyber threats', 'safe internet']",2.5,11,High
CSAS_110,Computer Science and Society,Beginner,"This beginner-level course explores the impact of computer science on society. Learn about ethical considerations, digital citizenship, and societal challenges.","Understand the role of computer science in shaping modern society.
Explore ethical issues related to technology and data privacy.
Learn about digital citizenship and responsible technology use.
Discuss societal challenges and opportunities in the digital age.","['computer science', 'beginner', 'ethics', 'digital citizenship']",1.8,6,Low
ADMAA_209,Advanced Data Mining and Analytics,Intermediate,This intermediate-level course focuses on advanced data mining and analytics. Learn to extract valuable insights from large datasets.,"Master advanced data mining techniques and algorithms.
Learn to analyze and interpret complex data patterns.
Explore predictive analytics and machine learning for data-driven insights.
Apply advanced data mining skills to real-world analytics projects.","['data mining', 'analytics', 'intermediate', 'machine learning', 'predictive analytics']",3.1,7,Low
AMAA_168,Advanced Mobile App Architecture,Intermediate,This intermediate-level course covers advanced mobile app architecture. Learn to design and build scalable and maintainable mobile applications.,"Master advanced mobile app architecture patterns and principles.
Learn to design scalable and maintainable mobile applications.
Explore architectural best practices for mobile app development.
Build advanced mobile apps with a focus on performance and reliability.","['mobile app architecture', 'intermediate', 'scalability', 'maintainability', 'performance']",3.6,8,Medium
ITAR_155,Introduction to Augmented Reality ,Beginner,"This beginner-level course introduces augmented reality (AR) technology. Learn about AR applications, development, and creating interactive AR experiences.","Understand the basics of augmented reality (AR) technology.
Learn about AR applications and its potential uses.
Explore AR development and tools for creating AR experiences.
Create interactive AR projects and applications.","['augmented reality', 'beginner', 'AR applications', 'AR development', 'interactive experiences']",2.4,7,Low
CABA_99,Cryptocurrency and Blockchain Applications,Advanced,"This advanced-level course covers cryptocurrency and blockchain applications. Learn about blockchain technology, cryptocurrencies, and decentralized applications (DApps).","Understand the fundamentals of blockchain technology and its applications.
Learn about cryptocurrencies, smart contracts, and tokenomics.
Develop decentralized applications (DApps) on blockchain platforms.
Explore real-world use cases of blockchain in finance, supply chain, and more.","['cryptocurrency', 'blockchain', 'advanced', 'smart contracts', 'DApps']",3.5,19,Very High
WADF_80,Web Application Development Frameworks,Intermediate,This intermediate-level course covers web application development frameworks. Learn about popular frameworks for building robust web applications.,"Explore web application frameworks like Ruby on Rails and Angular.
Learn to build RESTful APIs and single-page applications (SPAs).
Develop full-stack web applications using modern frameworks.
Collaborate on web development projects with best practices.","['web application development', 'intermediate', 'Ruby on Rails', 'Angular', 'RESTful APIs']",2.4,10,High
MLADL_35,Machine Learning and Deep Learning,Intermediate,"This intermediate-level course explores machine learning and deep learning techniques. Learn about neural networks, deep learning frameworks, and model training.","Understand machine learning algorithms and techniques.
Explore neural networks and deep learning frameworks like TensorFlow and PyTorch.
Train machine learning and deep learning models for various tasks.
Apply machine learning and deep learning in real-world projects.","['machine learning', 'deep learning', 'intermediate', 'neural networks', 'model training']",3.2,5,Low
DAWP_77,Data Analysis with Python,Intermediate,"This intermediate-level course focuses on data analysis with Python. Learn about data manipulation, visualization, and statistical analysis.","Master data manipulation with Python libraries like pandas.
Create data visualizations using tools like Matplotlib and Seaborn.
Perform statistical analysis and hypothesis testing on data.
Work with real-world datasets to gain data analysis skills.","['data analysis', 'Python', 'intermediate', 'data manipulation', 'data visualization']",2.6,7,Low
ACVAOR_222,Advanced Computer Vision and Object Recognition,Advanced,This advanced-level course covers advanced computer vision and object recognition. Learn to develop AI systems for visual perception.,"Master advanced computer vision techniques and deep learning models.
Learn to build AI systems for object detection and recognition.
Explore image segmentation, tracking, and visual scene understanding.
Contribute to the field of advanced computer vision and AI.","['computer vision', 'object recognition', 'advanced', 'deep learning', 'image segmentation']",3.0,12,Very High
ITUED_71,Introduction to User Experience  Design,Beginner,"This beginner-level course introduces the fundamentals of User Experience (UX) design. Learn about user research, prototyping, and usability testing.","Understand the importance of user-centered design in product development.
Conduct user research to gather insights and requirements.
Create interactive prototypes and design user interfaces.
Perform usability testing to improve product usability.","['UX design', 'beginner', 'user research', 'prototyping']",3.1,9,Medium
SSDP_206,Secure Software Development Principles,Intermediate,This intermediate-level course focuses on secure software development principles. Learn to code with security in mind.,"Understand the importance of secure software development.
Learn secure coding practices and techniques.
Explore threat modeling and vulnerability assessment.
Develop secure software applications and protect against cyber threats.","['secure software development', 'intermediate', 'secure coding', 'threat modeling', 'cyber threats']",2.5,11,High
SDWR_88,Software Development with React,Intermediate,"This intermediate-level course focuses on software development with React, a popular JavaScript library for building user interfaces.","Master React concepts and component-based development.
Build interactive and dynamic web applications using React.
Learn about state management with Redux and React Router for routing.
Develop modern web applications with React and associated tools.","['React', 'intermediate', 'component-based development', 'state management']",3.5,12,Very High
CSFAB_114,Computer Science for Absolute Beginners,Beginner,"This course is designed for absolute beginners in computer science. Learn the very basics of programming, algorithms, and computer hardware.","Get started with the absolute basics of computer science.
Learn introductory programming concepts using a beginner-friendly language.
Understand fundamental algorithms and problem-solving techniques.
Explore the basics of computer hardware and how it works.","['computer science', 'beginner', 'programming basics', 'algorithms', 'computer hardware']",3.1,12,Very High
NLP_44,Natural Language Processing,Advanced,"This advanced-level course covers natural language processing (NLP). Learn about text analysis, sentiment analysis, and machine translation.","Explore text analysis techniques for NLP tasks.
Learn about sentiment analysis and opinion mining.
Understand machine translation and language generation in NLP.
Develop NLP applications for chatbots and language processing tasks.","['natural language processing', 'advanced', 'text analysis', 'sentiment analysis']",2.3,10,High
DCFB_157,Digital Citizenship for Beginners,Beginner,"This beginner-level course focuses on digital citizenship. Learn about responsible online behavior, ethical internet use, and digital rights.","Understand the principles of digital citizenship.
Learn about responsible online behavior and digital ethics.
Explore digital rights and responsibilities.
Develop good practices for a positive digital presence.","['digital citizenship', 'beginner', 'online behavior', 'digital ethics', 'internet use']",2.4,15,Very High
CDAO_57,Compiler Design and Optimization,Advanced,"This advanced-level course covers compiler design and optimization. Learn about lexical analysis, parsing, code generation, and optimization techniques.","Explore lexical analysis and parsing techniques for language processing.
Learn about intermediate code generation and code optimization.
Understand compiler frontends and backends.
Develop a complete compiler for a programming language.","['compiler design', 'optimization', 'advanced', 'lexical analysis', 'code generation']",3.0,11,High
BDAFB_96,Big Data Analytics for Business,Advanced,"This advanced-level course focuses on big data analytics for business. Learn about data-driven decision-making, predictive analytics, and business intelligence.","Apply big data analytics to make data-driven business decisions.
Learn about predictive analytics and machine learning for business applications.
Develop business intelligence dashboards for reporting and visualization.
Analyze large-scale data sets for strategic insights.","['big data analytics', 'advanced', 'business analytics', 'predictive analytics']",3.1,11,High
CAD_54,Cloud-Native Application Development,Advanced,"This advanced-level course focuses on cloud-native application development. Learn about containerization, Kubernetes, and microservices architecture.","Explore containerization technologies like Docker and container orchestration with Kubernetes.
Learn about microservices architecture and cloud-native design principles.
Develop cloud-native applications and deploy them in cloud environments.
Manage and scale cloud-native applications with modern DevOps practices.","['cloud-native development', 'advanced', 'containerization', 'Kubernetes']",3.0,14,Very High
PFB_5,Python for Beginners,Beginner,"This course is an introduction to the Python programming language. You will learn Python syntax, data structures, and how to write simple programs.","Familiarize yourself with Python syntax, including variables, loops, and conditionals.
Learn about common data structures in Python, such as lists and dictionaries.
Write Python programs to solve basic problems and tasks.
Understand how Python can be used in various applications, including web development and data analysis.","['Python', 'beginner', 'programming', 'data structures']",2.4,13,Very High
ITCA_101,Introduction to Cybersecurity Awareness,Beginner,"This beginner-level course introduces the basics of cybersecurity awareness. Learn about common threats, online safety, and best practices for staying secure.","Understand the importance of cybersecurity in the digital world.
Learn about common cyber threats and how to protect yourself online.
Practice good online safety habits and recognize phishing attempts.
Implement best practices for password security and data protection.","['cybersecurity', 'beginner', 'cyber threats', 'online safety']",2.9,11,High
NA_30,Network Administration,Intermediate,"This intermediate-level course covers network administration. Learn about network configuration, maintenance, and troubleshooting in a corporate environment.","Configure and manage network devices, including routers and switches.
Monitor network performance and troubleshoot connectivity issues.
Implement security measures to protect corporate networks.
Manage user access and permissions in a networked environment.","['network administration', 'intermediate', 'network configuration', 'troubleshooting']",3.3,7,Low
HCCAG_138,High-Performance Computing Clusters and Grids,Advanced,This advanced-level course explores high-performance computing clusters and grid computing. Learn to design and manage high-performance computing environments.,"Master the principles of high-performance computing clusters and grids.
Design and deploy high-performance computing environments.
Optimize cluster and grid performance for scientific and research applications.
Manage and troubleshoot complex computing clusters.","['high-performance computing', 'advanced', 'cluster computing', 'grid computing']",3.9,12,Very High
JB_9,JavaScript Basics,Beginner,"This beginner-level course introduces JavaScript, a popular programming language used for web development. You will learn the basics of JavaScript syntax and its usage in web development.","Familiarize yourself with JavaScript syntax, variables, and data types.
Learn how to use JavaScript to manipulate web page elements and respond to user interactions.
Write JavaScript code to create interactive web applications.
Explore the role of JavaScript in modern web development.","['JavaScript', 'web development', 'beginner', 'programming']",2.9,12,Very High
ADVWT_163,Advanced Data Visualization with Tableau,Intermediate,This intermediate-level course explores advanced data visualization techniques using Tableau. Learn to create interactive and informative data dashboards.,"Master advanced data visualization techniques with Tableau.
Learn to design and create interactive data dashboards.
Explore data storytelling and visualization best practices.
Communicate insights effectively through data visualizations.","['data visualization', 'intermediate', 'Tableau', 'data dashboards', 'data storytelling']",3.1,16,Very High
ITA_6,Introduction to Algorithms,Intermediate,"This intermediate-level course explores algorithms and their role in computer science. You will learn about algorithm design, analysis, and their practical applications.","Understand the fundamentals of algorithm design and analysis.
Explore various algorithmic techniques, such as sorting and searching algorithms.
Learn how to analyze the time and space complexity of algorithms.
Apply algorithms to solve real-world problems and computational challenges.","['algorithms', 'intermediate', 'algorithm design', 'algorithm analysis']",3.0,6,Low
FWD_26,Front-End Web Development,Intermediate,"This intermediate-level course focuses on front-end web development. Learn about HTML5, CSS3, and JavaScript frameworks for building modern and responsive web interfaces.","Master HTML5, CSS3, and responsive web design techniques.
Learn popular front-end frameworks like React or Angular.
Explore web accessibility and cross-browser compatibility.
Build interactive and visually appealing web interfaces.","['web development', 'front-end', 'intermediate', 'HTML5', 'CSS3']",2.8,6,Low
ITSDT_107,Introduction to Software Development Tools,Beginner,"This beginner-level course introduces software development tools and best practices. Learn about version control, integrated development environments (IDEs), and more.","Understand the essential software development tools and their roles.
Learn about version control systems like Git and GitHub.
Explore integrated development environments (IDEs) for coding efficiency.
Practice software development best practices and collaboration tools.","['software development', 'beginner', 'version control', 'IDEs', 'collaboration tools']",3.0,8,Medium
WDFB_62,Web Design for Beginners,Beginner,"This beginner-level course covers the fundamentals of web design. Learn HTML and CSS basics, layout design, and creating responsive web pages.","Master HTML and CSS fundamentals for web design.
Understand web layout design and responsive web development.
Create basic web pages and simple interactive elements.
Design visually appealing and user-friendly websites.","['web design', 'beginner', 'HTML', 'CSS']",2.6,10,High
ARP_178,Advanced Robotics Perception,Advanced,This advanced-level course covers advanced robotics perception techniques. Learn to enhance robot perception and decision-making capabilities.,"Master advanced robotics perception methods and algorithms.
Learn to integrate sensors and perception modules into robotic systems.
Explore computer vision and sensor fusion for robotics.
Enhance robot perception for autonomous navigation and interaction.","['robotics perception', 'advanced', 'robot perception', 'sensor fusion', 'autonomous navigation']",2.8,12,Very High
APP_21,Advanced Python Programming,Intermediate,"This intermediate-level course builds upon the fundamentals of Python. You will learn advanced Python concepts, including decorators, generators, and metaclasses. Explore real-world applications and best practices in Python programming.","Master advanced Python concepts like decorators and metaclasses.
Explore Python libraries and frameworks for various applications.
Understand best practices for Python code organization and optimization.
Apply Python programming skills to develop real-world applications.","['Python', 'intermediate', 'advanced', 'decorators', 'generators']",3.0,9,Medium
ACCS_170,Advanced Cloud Computing Services,Intermediate,"This intermediate-level course explores advanced cloud computing services. Learn about cloud architecture, service models, and advanced cloud solutions.","Master advanced cloud computing concepts and architectures.
Learn about cloud service models and their applications.
Explore advanced cloud solutions for specific business needs.
Design and implement advanced cloud projects.","['cloud computing', 'intermediate', 'cloud architecture', 'service models', 'cloud solutions']",3.2,9,Medium
PLAD_63,Programming Logic and Design,Beginner,"This beginner-level course focuses on programming logic and design principles. Learn algorithmic thinking, flowcharting, and problem-solving techniques.","Develop algorithmic thinking and problem-solving skills.
Create flowcharts to represent program logic.
Understand basic programming constructs like loops and conditionals.
Apply programming logic to solve simple computational problems.","['programming logic', 'beginner', 'algorithmic thinking', 'flowcharting']",3.1,11,High
WDWJ_22,Web Development with JavaScript,Intermediate,"This intermediate-level course focuses on web development using JavaScript. You will learn client-side scripting, DOM manipulation, and asynchronous programming. Build interactive web applications.","Master JavaScript for client-side web development.
Learn about Document Object Model (DOM) manipulation.
Explore asynchronous programming and AJAX for web applications.
Build interactive and dynamic web applications with JavaScript.","['JavaScript', 'web development', 'intermediate', 'DOM manipulation', 'asynchronous programming']",2.8,9,Medium
AHIR_188,Advanced Human-Computer Interaction Research,Advanced,This advanced-level course delves into advanced human-computer interaction (HCI) research. Explore HCI methodologies and user-centered design.,"Master advanced HCI research methodologies and techniques.
Learn to conduct user-centered design studies and evaluations.
Explore advanced HCI topics, including augmented reality and wearables.
Contribute to the advancement of HCI research and interactive technology.","['human-computer interaction', 'HCI research', 'advanced', 'user-centered design', 'interactive technology']",2.5,10,High
ACGAA_146,Advanced Computer Graphics and Animation,Advanced,"This advanced-level course focuses on advanced computer graphics and animation techniques. Learn about 3D rendering, animation pipelines, and visual effects.","Master advanced computer graphics techniques for realistic 3D rendering.
Learn about animation pipelines, rigging, and character animation.
Explore visual effects (VFX) and simulations in computer graphics.
Create advanced graphics and animation projects.","['computer graphics', 'animation', 'advanced', '3D rendering', 'visual effects']",2.9,12,Very High
APS_213,Advanced Python Scripting,Intermediate,This intermediate-level course focuses on advanced Python scripting. Learn to automate tasks and build Python applications.,"Master advanced Python scripting techniques and libraries.
Learn to automate repetitive tasks with Python scripts.
Explore web scraping, data manipulation, and scripting best practices.
Develop Python applications for various purposes.","['Python scripting', 'intermediate', 'automation', 'web scraping', 'data manipulation']",3.6,16,Very High
IML_19,Introductory Machine Learning,Intermediate,"This intermediate-level course provides an introduction to machine learning techniques and algorithms. You will learn about supervised and unsupervised learning, as well as model evaluation and selection.","Understand the fundamentals of machine learning, including supervised and unsupervised learning.
Explore machine learning algorithms and their applications.
Learn how to evaluate and select machine learning models for different tasks.
Apply machine learning techniques to real-world datasets and problems.","['machine learning', 'intermediate', 'supervised learning', 'unsupervised learning', 'model evaluation']",3.2,4,Low
CSFK_69,Computer Science for Kids,Beginner,"This beginner-level course is designed for kids and introduces computer science concepts in a fun and engaging way. Learn about coding, problem-solving, and digital creativity.","Get started with coding using block-based programming languages.
Develop problem-solving skills through interactive projects and games.
Learn about digital creativity and basic computer science principles.
Explore the world of technology and its impact on society.","['computer science', 'beginner', 'kids', 'coding']",3.1,9,Medium
DS_47,Distributed Systems,Advanced,"This advanced-level course covers distributed systems. Learn about distributed architectures, consensus algorithms, and fault tolerance.","Explore distributed system architectures like microservices and containers.
Learn about consensus algorithms like Raft and Paxos.
Understand fault tolerance and replication in distributed systems.
Develop distributed applications and services.","['distributed systems', 'advanced', 'microservices', 'consensus algorithms']",3.2,19,Very High
ANLUAG_223,Advanced Natural Language Understanding and Generation,Advanced,This advanced-level course focuses on advanced natural language understanding and generation. Explore advanced NLP and language models.,"Master advanced NLP techniques and state-of-the-art language models.
Learn to build AI systems for natural language understanding and generation.
Explore language translation, text summarization, and conversational AI.
Contribute to the development of advanced NLP applications.","['natural language understanding', 'generation', 'advanced', 'NLP', 'language models']",3.1,10,High
ITC_61,Introduction to Cybersecurity,Beginner,"This beginner-level course introduces the basics of cybersecurity. Learn about common threats, security measures, and best practices to protect digital assets.","Understand common cybersecurity threats and vulnerabilities.
Learn security measures to protect personal and organizational data.
Explore best practices for safe online behavior and secure communication.
Apply basic cybersecurity principles to safeguard digital assets.","['cybersecurity', 'beginner', 'security measures', 'online safety']",2.8,10,High
DSWP_34,Data Science with Python,Intermediate,"This intermediate-level course focuses on data science using Python. Learn data analysis, visualization, and machine learning techniques for data-driven insights.","Explore data preprocessing, analysis, and visualization using Python libraries.
Learn machine learning techniques for predictive modeling.
Work with real-world datasets and solve data science problems.
Communicate data-driven insights effectively.","['data science', 'Python', 'intermediate', 'data analysis', 'machine learning']",3.1,7,Low
WADWV_161,Web Application Development with Vue.js,Intermediate,This intermediate-level course focuses on web application development with Vue.js. Learn to build interactive and responsive web apps.,"Master Vue.js, a popular JavaScript framework for web development.
Learn to create interactive and responsive web applications.
Explore component-based development and state management in Vue.js.
Build advanced web apps with Vue.js and Vue Router.","['web application development', 'intermediate', 'Vue.js', 'JavaScript', 'responsive web apps']",2.0,8,Medium
