course_name,description,learning,difficulty,Average rating,Popularity
DevOps and Continuous Integration/Continuous Deployment ,"This advanced-level course covers DevOps and CI/CD practices. Learn about automation, infrastructure as code, and continuous delivery pipelines.","Master DevOps principles and practices for software development and deployment.
Learn about infrastructure as code (IaC) and configuration management.
Set up CI/CD pipelines for automated testing and deployment.
Implement monitoring and observability in DevOps environments.",Advanced,2.6,Low
Software Development Basics,"This course covers the basics of software development, including software development methodologies, version control, and debugging techniques.","Understand the software development life cycle and methodologies.
Learn about version control systems and their importance in collaborative coding.
Explore debugging techniques to identify and fix software errors.
Apply software development principles in practical coding scenarios.",Beginner,3.2,Medium
Intermediate Level :,Explore intermediate-level courses in computer science and related fields.,"Discover intermediate-level topics and skills in computer science.
Choose from a variety of courses to continue your learning journey.
Expand your knowledge and practical skills in the field of your choice.
Prepare for more advanced coursework and career opportunities.",Beginner,3.7,Medium
Introduction to Computer Networks,"This beginner-level course provides an introduction to computer networks. Learn about network architecture, protocols, and basic troubleshooting.","Understand the fundamentals of computer networks and their importance.
Learn about network topologies, protocols, and addressing schemes.
Configure and troubleshoot basic network connections.
Explore real-world applications of computer networks.",Beginner,3.2,Medium
Introduction to Coding with Scratch,"This beginner-level course introduces coding using Scratch, a visual programming language. Learn the basics of programming and create interactive projects.","Understand the fundamentals of programming and algorithms.
Learn to code using Scratch, a visual programming language.
Create interactive animations, games, and stories.
Develop problem-solving skills through coding projects.",Beginner,3.0,Low
Advanced Database Design,"This intermediate-level course covers advanced database design topics. Learn about normalization, indexing, and designing complex database systems.","Understand advanced database normalization techniques.
Design and optimize database schemas for performance.
Explore indexing strategies and query optimization.
Design complex database systems for specific application requirements.",Intermediate,3.4,Low
Advanced Data Analysis with Pandas,"This intermediate-level course focuses on advanced data analysis using the Pandas library. Learn to manipulate, analyze, and visualize complex datasets.","Master advanced data manipulation techniques with Pandas.
Learn to perform complex data analysis tasks using Pandas.
Explore data visualization with Pandas and other Python libraries.
Apply advanced data analysis skills to real-world datasets.",Intermediate,2.6,Low
Software Architecture and Design Patterns,"This advanced-level course focuses on software architecture and design patterns. Learn about architectural styles, design principles, and patterns for software development.","Explore software architectural styles like microservices and monolithic architecture.
Learn design principles like SOLID and DRY.
Master common design patterns like Singleton and Observer.
Apply software architecture and design patterns in software projects.",Advanced,2.8,Medium
Advanced Topics in Web Security,"This intermediate-level course explores advanced topics in web security. Learn about web vulnerabilities, secure coding practices, and threat mitigation.","Master advanced web security concepts and vulnerabilities.
Learn secure coding practices and techniques.
Explore threat detection and mitigation strategies.
Apply security measures to protect web applications and data.",Intermediate,3.1,High
Data Engineering and ETL,"This intermediate-level course focuses on data engineering and ETL (Extract, Transform, Load) processes. Learn about data pipelines, data integration, and data warehousing.","Understand data engineering concepts and data pipeline design.
Learn about ETL processes for data integration and transformation.
Explore data warehousing solutions and architectures.
Develop data engineering projects for real-world scenarios.",Intermediate,2.5,Medium
Big Data Analytics,"This advanced-level course focuses on big data analytics. Learn about data processing frameworks, distributed storage, and data analysis at scale.","Explore big data processing frameworks like Apache Hadoop and Spark.
Learn about distributed storage solutions like HDFS and NoSQL databases.
Analyze and visualize large datasets for data-driven insights.
Apply big data analytics in business intelligence and decision-making.",Advanced,3.7,Low
Advanced Cloud Security and Compliance,This advanced-level course covers advanced cloud security and compliance. Learn to secure and govern cloud environments effectively.,"Master advanced cloud security principles and practices.
Learn to ensure compliance with industry standards and regulations.
Explore cloud security architecture, monitoring, and incident response.
Enhance cloud security and compliance for diverse business needs.",Advanced,3.6,Medium
Advanced Human-Computer Interaction,"This advanced-level course delves into advanced human-computer interaction (HCI) principles. Explore user-centered design, usability testing, and HCI research.","Master advanced HCI principles for user-centered design.
Learn about usability testing, user research, and HCI evaluation.
Explore HCI design methodologies and emerging HCI trends.
Contribute to HCI research and design innovative user interfaces.",Advanced,2.7,Very High
Advanced Topics in Quantum Computing,"This advanced-level course delves into advanced topics in quantum computing. Explore quantum algorithms, quantum hardware, and quantum software.","Master advanced quantum computing concepts and principles.
Learn about quantum algorithms and quantum hardware architectures.
Explore quantum software development and optimization.
Contribute to advancements in quantum computing research and applications.",Advanced,1.9,Low
Advanced Topics in Quantum Cryptography,This advanced-level course delves into advanced topics in quantum cryptography. Explore cutting-edge cryptographic techniques and quantum security.,"Master advanced quantum cryptographic concepts and protocols.
Learn to design and analyze quantum-resistant encryption schemes.
Explore quantum key distribution and post-quantum cryptography.
Contribute to the development of quantum-secure cryptographic solutions.",Advanced,3.0,High
Computer Systems Architecture,"This intermediate-level course focuses on computer systems architecture. Learn about CPU design, memory systems, and computer organization.","Understand computer systems architecture and its components.
Learn about CPU design, instruction set architecture, and microarchitecture.
Explore memory systems, storage technologies, and input/output systems.
Design and optimize computer systems for specific applications.",Intermediate,3.3,Medium
Blockchain Technology,"This intermediate-level course covers blockchain technology. Learn about blockchain architecture, cryptocurrencies, and smart contracts.","Understand the fundamentals of blockchain technology.
Explore blockchain architecture and distributed ledger concepts.
Learn about cryptocurrencies and digital wallets.
Develop and deploy smart contracts on blockchain platforms.",Intermediate,2.3,Low
Basics of Internet of Things ,"This beginner-level course covers the basics of the Internet of Things (IoT). Learn about IoT devices, connectivity, and IoT applications.","Understand the concept and significance of the Internet of Things (IoT).
Learn about IoT devices, sensors, and connectivity technologies.
Explore real-world IoT applications across various industries.
Get hands-on experience with IoT projects and experiments.",Beginner,3.3,Very High
Artificial Intelligence and Ethics,"This intermediate-level course explores the ethical aspects of artificial intelligence (AI). Learn about AI ethics, bias, and responsible AI development.","Understand the ethical considerations in AI development and deployment.
Explore AI bias and fairness issues in machine learning models.
Learn about responsible AI practices and ethical AI design.
Discuss real-world AI ethics case studies and challenges.",Intermediate,3.4,Low
Data Structures and Algorithms,"This intermediate-level course dives deeper into data structures and algorithms. Explore advanced data structures like trees and graphs, and learn about algorithm analysis and design techniques.","Explore advanced data structures like trees, graphs, and heaps.
Learn advanced algorithms for sorting, searching, and optimization.
Understand algorithm analysis and time complexity.
Apply data structures and algorithms to solve complex computational problems.",Intermediate,3.3,Low
Software Engineering Principles,"This intermediate-level course explores software engineering principles and methodologies. Learn about software development life cycles, project management, and quality assurance.","Understand software development methodologies like Agile and Waterfall.
Learn about software project management and planning.
Implement quality assurance and testing practices.
Collaborate effectively in software development teams.",Intermediate,3.1,Very High
Introduction to Cloud Computing with AWS,This beginner-level course provides an introduction to cloud computing with Amazon Web Services (AWS). Learn about cloud services and deployment.,"Understand the basics of cloud computing and its advantages.
Learn about cloud service models and AWS offerings.
Explore AWS cloud services and deploy simple applications.
Get hands-on experience with cloud computing using AWS.",Beginner,3.8,Low
Web Development for Beginners,"This course introduces the basics of web development. You will learn about HTML, CSS, and how to create simple web pages. No prior coding experience is required.","Understand the structure and purpose of HTML for creating web content.
Learn how to style web pages using CSS for design.
Create simple web pages and understand the basics of web development.
Explore the role of web browsers and web servers in delivering web content.",Beginner,3.0,Medium
Advanced Data Structures and Algorithms,"This advanced-level course delves deep into data structures and algorithms. Explore advanced data structures like AVL trees, advanced sorting algorithms, and dynamic programming.","Master advanced data structures like AVL trees and B-trees.
Explore advanced sorting algorithms like merge sort and quicksort.
Understand dynamic programming for solving complex problems.
Apply advanced algorithms in competitive programming and optimization tasks.",Advanced,3.0,Low
Cloud Migration Strategies and Best Practices,This intermediate-level course covers cloud migration strategies and best practices. Learn to migrate applications and data to the cloud.,"Understand cloud migration fundamentals and challenges.
Learn cloud migration strategies and planning.
Explore best practices for cloud migration execution.
Successfully migrate applications and data to cloud platforms.",Intermediate,2.7,Low
AI for Natural Language Understanding,This advanced-level course explores AI for natural language understanding. Learn to develop advanced NLP models and applications.,"Master advanced natural language processing (NLP) techniques.
Learn to build NLP models for complex language understanding tasks.
Explore advanced NLP applications in chatbots, language translation, and more.
Develop and deploy advanced NLP solutions.",Advanced,2.8,Very High
Advanced Cybersecurity Threat Analysis,This intermediate-level course delves into advanced cybersecurity threat analysis. Learn to detect and respond to cyber threats effectively.,"Master advanced cybersecurity threat analysis techniques.
Learn to identify and assess cyber threats and vulnerabilities.
Explore incident response and threat mitigation strategies.
Enhance your skills in protecting systems and data from cyberattacks.",Intermediate,3.1,High
Operating Systems Concepts,"This intermediate-level course explores operating systems concepts. Learn about process management, memory allocation, file systems, and OS security.","Understand process management and multitasking in operating systems.
Learn about memory management and virtual memory concepts.
Explore file systems and storage management in OS.
Understand OS security principles and vulnerabilities.",Intermediate,3.1,High
Ethical Hacking for Penetration Testers,This intermediate-level course covers ethical hacking for penetration testers. Learn to assess and strengthen cybersecurity defenses.,"Master ethical hacking techniques and methodologies.
Learn to conduct penetration tests and vulnerability assessments.
Explore advanced hacking tools and exploitation techniques.
Enhance cybersecurity through ethical hacking expertise.",Intermediate,2.7,Very High
Advanced Cryptography,"This advanced-level course covers advanced cryptography. Learn about cryptographic protocols, cryptographic algorithms, and encryption standards.","Explore cryptographic protocols like SSL/TLS and IPsec.
Learn about advanced encryption algorithms like AES and RSA.
Understand cryptographic key management and secure communication.
Implement advanced cryptographic techniques in secure systems.",Advanced,3.2,Medium
Introduction to Software Testing,"This beginner-level course introduces software testing concepts. Learn about manual testing, test cases, and quality assurance in software development.","Understand the importance of software testing in the development process.
Create and execute manual test cases for software applications.
Learn about quality assurance practices and bug tracking.
Explore different types of testing, including functional and regression testing.",Beginner,2.8,Medium
Human-Robot Interaction,"This advanced-level course covers human-robot interaction (HRI). Learn about robot behavior, natural language processing, and user-centered design for robots.","Understand principles of human-robot interaction and robot behavior.
Learn about natural language processing (NLP) for robot communication.
Design user-centered robot interfaces and interactions.
Explore real-world applications of human-robot interaction.",Advanced,2.8,Medium
AI in Healthcare and Medical Diagnosis,This advanced-level course explores AI in healthcare and medical diagnosis. Learn to develop AI solutions for medical applications.,"Master AI techniques for healthcare and medical image analysis.
Learn to build AI systems for disease diagnosis and patient care.
Explore medical imaging, clinical data analysis, and healthcare AI ethics.
Contribute to advancements in AI-driven healthcare solutions.",Advanced,3.2,Low
Blockchain for Supply Chain Management,This advanced-level course covers blockchain for supply chain management. Learn to apply blockchain technology to improve supply chain processes.,"Master blockchain technology and its applications in supply chain management.
Learn to design and implement blockchain-based supply chain solutions.
Explore transparency, traceability, and security in supply chain blockchain.
Contribute to the adoption of blockchain in supply chain optimization.",Advanced,4.3,Low
Advanced Machine Learning Algorithms,"This intermediate-level course covers advanced machine learning algorithms. Learn about deep learning, reinforcement learning, and neural network architectures.","Explore advanced machine learning techniques, including deep learning.
Master neural network architectures like convolutional and recurrent networks.
Understand reinforcement learning and its applications.
Implement advanced machine learning algorithms in projects.",Intermediate,2.7,Low
AI in Robotics and Automation,This intermediate-level course focuses on AI in robotics and automation. Learn to develop AI systems for autonomous robots and automation.,"Understand AI technologies for robotics and automation.
Learn to build AI systems for autonomous robots and industrial automation.
Explore perception, decision-making, and control in AI-driven robotics.
Contribute to the advancement of AI-driven automation solutions.",Intermediate,3.2,Very High
Cloud Architecture and Deployment,"This intermediate-level course covers cloud architecture and deployment. Learn about cloud service models, scaling, and cloud-based application development.","Explore cloud service models like Platform as a Service (PaaS) and Function as a Service (FaaS).
Design scalable cloud architectures for high availability.
Develop cloud-native applications and deploy them in cloud environments.
Implement cloud security and compliance measures.",Intermediate,2.6,Medium
Programming Fundamentals,"This course is designed for beginners and covers the fundamental concepts of programming. You will learn about variables, data types, control structures, and how to write basic programs in a programming language.","Understand the basics of programming languages and their syntax.
Learn about variables and data types used in programming.
Explore control structures like loops and conditionals.
Write simple programs to solve basic problems.",Beginner,3.3,Low
Cloud Security and Compliance,This advanced-level course covers cloud security and compliance. Learn about securing cloud environments and complying with regulations.,"Implement advanced cloud security measures and best practices.
Ensure compliance with industry regulations and standards.
Perform cloud security audits and assessments.
Manage security incidents and breaches in cloud environments.",Advanced,3.3,Low
Advanced Artificial Intelligence Applications,"This advanced-level course explores advanced applications of artificial intelligence (AI). Learn about AI in healthcare, finance, and autonomous systems.","Explore advanced AI applications in healthcare, finance, and autonomous systems.
Understand AI ethics and regulations in specialized domains.
Learn about AI research and development in cutting-edge fields.
Develop AI solutions for real-world applications.",Advanced,3.1,Very High
Artificial Intelligence and Machine Learning,"This advanced-level course covers artificial intelligence and machine learning in-depth. Learn about reinforcement learning, neural network architectures, and AI ethics.","Explore advanced machine learning techniques, including reinforcement learning.
Master neural network architectures like convolutional and recurrent networks.
Understand natural language processing (NLP) and computer vision.
Discuss AI ethics and responsible AI development.",Advanced,2.3,Low
Introduction to Digital Marketing,This beginner-level course introduces the basics of digital marketing. Learn to promote products and services online through various channels.,"Understand the fundamentals of digital marketing and its importance.
Learn about online marketing channels, including social media and email marketing.
Explore digital advertising and content marketing strategies.
Create a digital marketing plan for promoting businesses or products.",Beginner,2.2,Low
Mobile App Security,"This intermediate-level course covers mobile app security. Learn about securing mobile apps, data encryption, and best practices for app security.","Understand mobile app security threats and vulnerabilities.
Learn about data encryption and secure communication in mobile apps.
Implement best practices for mobile app security and user privacy.
Conduct security testing and vulnerability assessment for mobile apps.",Intermediate,3.6,Low
Introduction to Virtualization,"This beginner-level course provides an introduction to virtualization technology. Learn about virtual machines, hypervisors, and use cases.","Understand the fundamentals of virtualization and its benefits.
Learn about virtual machines (VMs) and their deployment.
Explore different virtualization platforms and hypervisors.
Implement virtualization for various use cases.",Beginner,2.0,Low
Advanced Database Management and Administration,This intermediate-level course covers advanced database management and administration. Learn to design and maintain robust databases.,"Master advanced database design and optimization techniques.
Learn to administer and secure databases for performance and reliability.
Explore database scalability, replication, and clustering.
Design and manage complex database systems for diverse applications.",Intermediate,1.8,Low
Artificial General Intelligence  Development,"This advanced-level course focuses on artificial general intelligence (AGI) development. Learn about AGI principles, cognitive architectures, and AGI research.","Master AGI principles and theories for advanced intelligence systems.
Learn about cognitive architectures and AGI development frameworks.
Explore AGI research areas and emerging trends in artificial intelligence.
Contribute to the development of artificial general intelligence.",Advanced,2.5,Low
Quantum Computing Algorithms and Quantum Machine Learning,This advanced-level course delves into quantum computing algorithms and quantum machine learning. Explore the future of quantum computing.,"Master advanced quantum computing concepts and principles.
Learn about quantum algorithms and quantum hardware architectures.
Explore quantum software development and optimization.
Contribute to advancements in quantum computing research and applications.",Advanced,2.2,Low
Introduction to Augmented Reality  Apps,This beginner-level course introduces augmented reality (AR) apps. Learn how AR technology works and create your own AR experiences.,"Understand the concept of augmented reality (AR).
Learn to develop simple AR apps and experiences.
Explore AR development tools and platforms.
Immerse yourself in the world of augmented reality app creation.",Beginner,2.4,Low
