course_id,course_name,difficulty,description,learning,tags,Average rating,Number of reviews,Popularity
ITIOTFB_160,Introduction to Internet of Things  for Beginners,Beginner,"This beginner-level course provides an introduction to the Internet of Things (IoT). Learn about IoT devices, applications, and their impact on various industries.","Understand the basics of the Internet of Things (IoT).
Learn about IoT devices, sensors, and communication protocols.
Explore IoT applications and use cases across different industries.
Gain insights into the impact of IoT on the modern world.","['Internet of Things', 'IoT', 'beginner', 'IoT devices', 'IoT applications']",3.1,9,Medium
ITWA_115,Introduction to Web Accessibility,Beginner,This beginner-level course focuses on web accessibility. Learn about the importance of accessible web design and how to create inclusive web experiences.,"Understand the significance of web accessibility for all users.
Learn about web accessibility standards and guidelines.
Apply accessible design principles and practices to web content.
Test and evaluate websites for accessibility compliance.","['web accessibility', 'beginner', 'accessible web design', 'inclusivity']",3.8,5,Low
ITMAD_64,Introduction to Mobile App Development,Beginner,"This beginner-level course introduces mobile app development. Learn about app design, user interfaces, and basic app development using a no-code or low-code platform.","Understand mobile app design principles and user interfaces.
Learn to create basic mobile apps using no-code or low-code platforms.
Explore app deployment to mobile devices.
Get started with mobile app development for Android or iOS.","['mobile app development', 'beginner', 'app design', 'no-code']",3.7,10,High
BACB_148,Bioinformatics and Computational Biology,Advanced,"This advanced-level course focuses on bioinformatics and computational biology. Learn about sequence analysis, genomics, and computational tools in biology.","Master bioinformatics techniques for DNA and protein sequence analysis.
Learn about genomics, structural biology, and computational tools.
Apply computational methods to biological research and analysis.
Contribute to advancements in bioinformatics and biology research.","['bioinformatics', 'computational biology', 'advanced', 'sequence analysis', 'genomics']",2.6,10,High
CF_10,Cybersecurity Fundamentals,Beginner,"This course provides an introduction to the fundamentals of cybersecurity. You will learn about common threats, security principles, and best practices to protect digital assets.","Understand the importance of cybersecurity in today's digital world.
Learn about common cybersecurity threats and attack vectors.
Explore security principles and best practices to safeguard data and systems.
Develop foundational knowledge in cybersecurity for personal and professional use.","['cybersecurity', 'beginner', 'security', 'threats', 'best practices']",2.2,9,Medium
CFBSP_102,Coding for Beginners: Scratch Programming,Beginner,"This beginner-level course teaches coding basics using Scratch, a visual programming language. Learn to create interactive animations and games.","Get started with coding using the Scratch visual programming language.
Learn coding concepts like loops, conditionals, and variables.
Create interactive animations, stories, and games in Scratch.
Develop problem-solving skills and computational thinking.","['coding', 'beginner', 'Scratch', 'visual programming']",2.8,9,Medium
HI_59,Human-Computer Interaction ,Advanced,"This advanced-level course covers human-computer interaction (HCI). Learn about usability, user-centered design, and HCI research methodologies.","Explore usability principles and user-centered design techniques.
Learn about HCI research methodologies and user testing.
Understand HCI in the context of mobile and wearable devices.
Design and evaluate user interfaces for improved user experience.","['human-computer interaction', 'advanced', 'usability', 'user-centered design']",2.7,9,Medium
AFDD_187,AI for Drug Discovery,Advanced,This advanced-level course focuses on AI for drug discovery. Learn to apply AI and computational methods to accelerate drug development.,"Understand the role of AI in drug discovery and pharmaceutical research.
Learn to leverage AI and computational tools for drug design and screening.
Explore drug discovery pipelines and AI-driven drug development.
Contribute to the advancement of AI-driven drug discovery solutions.","['AI', 'drug discovery', 'advanced', 'pharmaceutical research', 'drug development']",2.2,11,High
AIFAAT_233,AI in Finance and Algorithmic Trading,Advanced,This advanced-level course covers AI in finance and algorithmic trading. Learn to develop AI-driven trading strategies and financial models.,"Master AI techniques for financial analysis and algorithmic trading.
Learn to build AI-driven trading models and risk assessment tools.
Explore applications in quantitative finance and market prediction.
Contribute to AI advancements in the financial industry.","['AI', 'finance', 'algorithmic trading', 'advanced', 'financial models']",2.5,8,Medium
ADW_165,Advanced Data Warehousing,Intermediate,"This intermediate-level course delves into advanced data warehousing concepts. Learn about data modeling, ETL processes, and data warehousing solutions.","Master advanced data modeling techniques for data warehousing.
Learn about ETL processes and data integration in data warehousing.
Explore data warehousing solutions and architectures.
Design and implement advanced data warehousing projects.","['data warehousing', 'intermediate', 'data modeling', 'ETL processes', 'data integration']",3.0,11,High
SMADL_152,Social Media and Digital Literacy,Beginner,"This beginner-level course covers social media usage and digital literacy. Learn about online safety, privacy, and effective use of social media platforms.","Understand the basics of social media platforms and their usage.
Learn about online safety, privacy, and digital footprints.
Explore effective communication and engagement on social media.
Develop digital literacy skills for the modern online world.","['social media', 'digital literacy', 'beginner', 'online safety', 'privacy']",3.1,11,High
OPIJ_24,Object-Oriented Programming in Java,Intermediate,"This intermediate-level course delves into object-oriented programming (OOP) using the Java programming language. Explore OOP principles, design patterns, and Java application development.","Master object-oriented programming principles in Java.
Learn about Java classes, inheritance, and polymorphism.
Explore design patterns for software development.
Develop Java applications using OOP concepts and design patterns.","['Java', 'object-oriented programming', 'intermediate', 'design patterns']",2.9,12,Very High
QCAQSC_147,Quantum Cryptography and Quantum Secure Communication,Advanced,This advanced-level course explores quantum cryptography and secure communication. Learn about quantum key distribution and quantum encryption techniques.,"Master quantum cryptography principles and quantum secure communication.
Learn about quantum key distribution (QKD) and quantum encryption.
Understand the security advantages of quantum technologies.
Explore practical applications of quantum cryptography.","['quantum cryptography', 'secure communication', 'advanced', 'quantum key distribution', 'quantum encryption']",3.0,10,High
SDL_38,Software Development Lifecycle,Intermediate,"This intermediate-level course covers the software development lifecycle (SDLC). Learn about SDLC models, requirements engineering, and project management.","Understand various software development lifecycle models.
Learn requirements engineering and software design.
Explore project management and software testing in SDLC.
Apply SDLC principles in real-world software projects.","['software development lifecycle', 'SDLC', 'intermediate', 'requirements engineering']",4.0,4,Low
CIRAF_136,Cybersecurity Incident Response and Forensics,Advanced,This advanced-level course focuses on cybersecurity incident response and digital forensics. Learn to investigate and respond to security incidents.,"Master incident response techniques for cybersecurity emergencies.
Learn digital forensics methodologies and evidence collection.
Conduct investigations and analyze security incidents.
Develop incident response plans and strategies.","['cybersecurity', 'advanced', 'incident response', 'digital forensics']",2.9,15,Very High
AASD_169,Advanced Agile Software Development,Intermediate,This intermediate-level course delves into advanced agile software development practices. Learn to enhance agility in software development projects.,"Master advanced agile software development principles and methodologies.
Learn to lead and manage agile software development teams.
Explore agile scaling frameworks for large projects.
Apply agile practices to complex software development scenarios.","['agile software development', 'intermediate', 'agile methodologies', 'team management', 'scaling frameworks']",3.0,5,Low
ITDPFC_198,Introduction to Data Privacy for Consumers,Beginner,This beginner-level course focuses on data privacy for consumers. Learn how to protect your personal information online and safeguard your privacy.,"Understand the importance of data privacy in the digital age.
Learn about online privacy threats and data breaches.
Explore best practices for securing personal information online.
Take proactive steps to protect your digital privacy.","['data privacy', 'beginner', 'online privacy threats', 'digital privacy protection']",3.1,8,Medium
CSE_12,Computer Science Essentials,Intermediate,"This intermediate-level course delves into essential topics in computer science, including data structures, algorithms, and software development concepts.","Review key concepts in computer science, including data structures and algorithms.
Explore software development principles and best practices.
Understand the role of databases in modern computing.
Apply computer science knowledge to solve real-world problems.","['computer science', 'intermediate', 'data structures', 'algorithms', 'software development']",2.9,9,Medium
IOTD_53,Internet of Things  Development,Advanced,"This advanced-level course covers Internet of Things (IoT) development. Learn about IoT architectures, sensor networks, and IoT security.","Explore IoT architectures and edge computing in IoT systems.
Learn about sensor networks, IoT protocols, and IoT device programming.
Understand IoT security measures and privacy considerations.
Develop IoT applications and projects in various domains.","['IoT development', 'advanced', 'sensor networks', 'IoT security']",3.3,11,High
ADS_49,Advanced Database Systems,Advanced,"This advanced-level course covers advanced database systems. Learn about distributed databases, NoSQL databases, and big data storage solutions.","Explore distributed database architectures and replication.
Learn about NoSQL databases like MongoDB and Cassandra.
Understand big data storage solutions like Hadoop and Spark.
Design and implement advanced database systems for complex data requirements.","['database systems', 'advanced', 'distributed databases', 'NoSQL']",3.6,5,Low
ACGR_179,Advanced Computer Graphics Rendering,Advanced,This advanced-level course focuses on advanced computer graphics rendering techniques. Learn to create realistic and high-quality graphics.,"Master advanced computer graphics rendering techniques.
Learn about ray tracing, global illumination, and advanced rendering algorithms.
Explore real-time graphics and advanced visual effects (VFX).
Create high-quality and visually stunning graphics projects.","['computer graphics', 'advanced', 'graphics rendering', 'ray tracing', 'visual effects']",2.6,10,High
AIES_232,AI in Environmental Sustainability,Advanced,This advanced-level course explores AI in environmental sustainability. Learn to use AI for environmental monitoring and conservation.,"Master AI techniques for environmental monitoring and analysis.
Learn to develop AI systems for sustainable resource management.
Explore applications in climate modeling, conservation, and ecology.
Contribute to environmental sustainability through AI innovations.","['AI', 'environmental sustainability', 'advanced', 'climate modeling', 'conservation']",3.1,16,Very High
SDWAM_83,Software Development with Agile Methodology,Intermediate,"This intermediate-level course focuses on software development with Agile methodology. Learn about Agile principles, Scrum, and Agile project management.","Understand Agile principles and values in software development.
Learn about the Scrum framework and Agile project management.
Practice Agile methodologies in software development projects.
Collaborate with cross-functional teams and adapt to changing requirements.","['Agile methodology', 'intermediate', 'Scrum', 'project management']",3.7,7,Low
AMLA_218,Advanced Machine Learning Applications,Intermediate,This intermediate-level course focuses on advanced machine learning applications. Learn to apply ML techniques to real-world problems.,"Master advanced machine learning algorithms and models.
Learn to apply ML in domains like healthcare, finance, and more.
Explore deep learning, reinforcement learning, and transfer learning.
Solve complex problems with advanced machine learning applications.","['machine learning', 'applications', 'intermediate', 'deep learning', 'reinforcement learning']",2.5,13,Very High
AHID_228,Advanced Human-Robot Interaction Design,Advanced,This advanced-level course focuses on advanced human-robot interaction design. Explore the design of intuitive and collaborative robot interfaces.,"Master advanced principles of human-robot interaction (HRI) design.
Learn to create intuitive and collaborative robot interfaces.
Explore HRI evaluation, gesture recognition, and social robotics.
Contribute to the development of advanced HRI systems and robots.","['human-robot interaction', 'design', 'advanced', 'robot interfaces', 'social robotics']",3.3,7,Low
AEABM_229,AI Ethics and Bias Mitigation,Advanced,This advanced-level course covers AI ethics and bias mitigation. Learn to address ethical challenges and biases in AI systems.,"Master advanced AI ethics principles and frameworks.
Learn to identify and mitigate biases in AI algorithms and data.
Explore fairness, transparency, and accountability in AI.
Contribute to the ethical development and deployment of AI technologies.","['AI ethics', 'bias mitigation', 'advanced', 'fairness', 'accountability']",2.8,13,Very High
MLMD_167,Machine Learning Model Deployment,Intermediate,This intermediate-level course focuses on deploying machine learning models. Learn to take machine learning projects from development to production.,"Understand the deployment process for machine learning models.
Learn about containerization and deployment platforms.
Explore best practices for scaling and monitoring deployed models.
Deploy machine learning projects in real-world scenarios.","['machine learning', 'model deployment', 'intermediate', 'containerization', 'scaling']",2.3,7,Low
ANLP_216,Advanced Natural Language Processing,Intermediate,This intermediate-level course focuses on advanced natural language processing (NLP). Explore NLP models and applications.,"Master advanced NLP techniques and deep learning models.
Learn to build NLP applications for text analysis and understanding.
Explore sentiment analysis, language generation, and chatbots.
Apply advanced NLP skills to real-world language processing tasks.","['natural language processing', 'NLP', 'intermediate', 'deep learning', 'text analysis']",2.4,7,Low
DACID_55,DevOps and Continuous Integration/Continuous Deployment ,Advanced,"This advanced-level course covers DevOps and CI/CD practices. Learn about automation, infrastructure as code, and continuous delivery pipelines.","Master DevOps principles and practices for software development and deployment.
Learn about infrastructure as code (IaC) and configuration management.
Set up CI/CD pipelines for automated testing and deployment.
Implement monitoring and observability in DevOps environments.","['DevOps', 'CI/CD', 'advanced', 'automation', 'IaC']",2.6,7,Low
SDB_16,Software Development Basics,Beginner,"This course covers the basics of software development, including software development methodologies, version control, and debugging techniques.","Understand the software development life cycle and methodologies.
Learn about version control systems and their importance in collaborative coding.
Explore debugging techniques to identify and fix software errors.
Apply software development principles in practical coding scenarios.","['software development', 'beginner', 'development methodologies', 'version control', 'debugging']",3.2,8,Medium
IL:_116,Intermediate Level :,Beginner,Explore intermediate-level courses in computer science and related fields.,"Discover intermediate-level topics and skills in computer science.
Choose from a variety of courses to continue your learning journey.
Expand your knowledge and practical skills in the field of your choice.
Prepare for more advanced coursework and career opportunities.","['computer science', 'intermediate', 'course selection', 'career preparation']",3.7,9,Medium
ITCN_103,Introduction to Computer Networks,Beginner,"This beginner-level course provides an introduction to computer networks. Learn about network architecture, protocols, and basic troubleshooting.","Understand the fundamentals of computer networks and their importance.
Learn about network topologies, protocols, and addressing schemes.
Configure and troubleshoot basic network connections.
Explore real-world applications of computer networks.","['computer networks', 'beginner', 'network architecture', 'network protocols']",3.2,9,Medium
ITCWS_151,Introduction to Coding with Scratch,Beginner,"This beginner-level course introduces coding using Scratch, a visual programming language. Learn the basics of programming and create interactive projects.","Understand the fundamentals of programming and algorithms.
Learn to code using Scratch, a visual programming language.
Create interactive animations, games, and stories.
Develop problem-solving skills through coding projects.","['coding', 'beginner', 'Scratch', 'visual programming', 'problem-solving']",3.0,6,Low
ADD_78,Advanced Database Design,Intermediate,"This intermediate-level course covers advanced database design topics. Learn about normalization, indexing, and designing complex database systems.","Understand advanced database normalization techniques.
Design and optimize database schemas for performance.
Explore indexing strategies and query optimization.
Design complex database systems for specific application requirements.","['database design', 'intermediate', 'normalization', 'indexing']",3.4,5,Low
ADAWP_171,Advanced Data Analysis with Pandas,Intermediate,"This intermediate-level course focuses on advanced data analysis using the Pandas library. Learn to manipulate, analyze, and visualize complex datasets.","Master advanced data manipulation techniques with Pandas.
Learn to perform complex data analysis tasks using Pandas.
Explore data visualization with Pandas and other Python libraries.
Apply advanced data analysis skills to real-world datasets.","['data analysis', 'Pandas', 'intermediate', 'data manipulation', 'data visualization']",2.6,7,Low
SAADP_48,Software Architecture and Design Patterns,Advanced,"This advanced-level course focuses on software architecture and design patterns. Learn about architectural styles, design principles, and patterns for software development.","Explore software architectural styles like microservices and monolithic architecture.
Learn design principles like SOLID and DRY.
Master common design patterns like Singleton and Observer.
Apply software architecture and design patterns in software projects.","['software architecture', 'design patterns', 'advanced', 'architectural styles']",2.8,8,Medium
ATIWS_166,Advanced Topics in Web Security,Intermediate,"This intermediate-level course explores advanced topics in web security. Learn about web vulnerabilities, secure coding practices, and threat mitigation.","Master advanced web security concepts and vulnerabilities.
Learn secure coding practices and techniques.
Explore threat detection and mitigation strategies.
Apply security measures to protect web applications and data.","['web security', 'intermediate', 'web vulnerabilities', 'secure coding', 'threat mitigation']",3.1,10,High
DEAE_85,Data Engineering and ETL,Intermediate,"This intermediate-level course focuses on data engineering and ETL (Extract, Transform, Load) processes. Learn about data pipelines, data integration, and data warehousing.","Understand data engineering concepts and data pipeline design.
Learn about ETL processes for data integration and transformation.
Explore data warehousing solutions and architectures.
Develop data engineering projects for real-world scenarios.","['data engineering', 'intermediate', 'ETL', 'data warehousing']",2.5,8,Medium
BDA_52,Big Data Analytics,Advanced,"This advanced-level course focuses on big data analytics. Learn about data processing frameworks, distributed storage, and data analysis at scale.","Explore big data processing frameworks like Apache Hadoop and Spark.
Learn about distributed storage solutions like HDFS and NoSQL databases.
Analyze and visualize large datasets for data-driven insights.
Apply big data analytics in business intelligence and decision-making.","['big data analytics', 'advanced', 'Hadoop', 'Spark']",3.7,7,Low
ACSAC_227,Advanced Cloud Security and Compliance,Advanced,This advanced-level course covers advanced cloud security and compliance. Learn to secure and govern cloud environments effectively.,"Master advanced cloud security principles and practices.
Learn to ensure compliance with industry standards and regulations.
Explore cloud security architecture, monitoring, and incident response.
Enhance cloud security and compliance for diverse business needs.","['cloud security', 'compliance', 'advanced', 'security architecture', 'incident response']",3.6,8,Medium
AHI_149,Advanced Human-Computer Interaction,Advanced,"This advanced-level course delves into advanced human-computer interaction (HCI) principles. Explore user-centered design, usability testing, and HCI research.","Master advanced HCI principles for user-centered design.
Learn about usability testing, user research, and HCI evaluation.
Explore HCI design methodologies and emerging HCI trends.
Contribute to HCI research and design innovative user interfaces.","['human-computer interaction', 'HCI', 'advanced', 'user-centered design', 'usability testing']",2.7,14,Very High
ATIQC_182,Advanced Topics in Quantum Computing,Advanced,"This advanced-level course delves into advanced topics in quantum computing. Explore quantum algorithms, quantum hardware, and quantum software.","Master advanced quantum computing concepts and principles.
Learn about quantum algorithms and quantum hardware architectures.
Explore quantum software development and optimization.
Contribute to advancements in quantum computing research and applications.","['quantum computing', 'advanced', 'quantum algorithms', 'quantum hardware', 'quantum software']",1.9,7,Low
ATIQC_230,Advanced Topics in Quantum Cryptography,Advanced,This advanced-level course delves into advanced topics in quantum cryptography. Explore cutting-edge cryptographic techniques and quantum security.,"Master advanced quantum cryptographic concepts and protocols.
Learn to design and analyze quantum-resistant encryption schemes.
Explore quantum key distribution and post-quantum cryptography.
Contribute to the development of quantum-secure cryptographic solutions.","['quantum cryptography', 'advanced', 'encryption', 'quantum security', 'key distribution']",3.0,10,High
CSA_87,Computer Systems Architecture,Intermediate,"This intermediate-level course focuses on computer systems architecture. Learn about CPU design, memory systems, and computer organization.","Understand computer systems architecture and its components.
Learn about CPU design, instruction set architecture, and microarchitecture.
Explore memory systems, storage technologies, and input/output systems.
Design and optimize computer systems for specific applications.","['computer systems architecture', 'intermediate', 'CPU design', 'memory systems']",3.3,9,Medium
BT_40,Blockchain Technology,Intermediate,"This intermediate-level course covers blockchain technology. Learn about blockchain architecture, cryptocurrencies, and smart contracts.","Understand the fundamentals of blockchain technology.
Explore blockchain architecture and distributed ledger concepts.
Learn about cryptocurrencies and digital wallets.
Develop and deploy smart contracts on blockchain platforms.","['blockchain technology', 'intermediate', 'cryptocurrencies', 'smart contracts']",2.3,6,Low
BOIOT_112,Basics of Internet of Things ,Beginner,"This beginner-level course covers the basics of the Internet of Things (IoT). Learn about IoT devices, connectivity, and IoT applications.","Understand the concept and significance of the Internet of Things (IoT).
Learn about IoT devices, sensors, and connectivity technologies.
Explore real-world IoT applications across various industries.
Get hands-on experience with IoT projects and experiments.","['Internet of Things', 'beginner', 'IoT devices', 'IoT applications']",3.3,13,Very High
