course_name,description,learning,difficulty,Average rating,Popularity
Cyber-Physical Systems and IoT Integration,This advanced-level course focuses on cyber-physical systems (CPS) and their integration with the Internet of Things (IoT). Learn about CPS design and IoT connectivity.,"Master the principles of cyber-physical systems (CPS).
Learn about IoT integration and connectivity for CPS applications.
Explore real-world CPS and IoT use cases in industry.
Design and develop advanced CPS and IoT solutions.",Advanced,3.0,High
Web Application Security,"This intermediate-level course focuses on web application security. Learn about common vulnerabilities, security protocols, and secure coding practices.","Identify and mitigate common web application vulnerabilities.
Implement security protocols like HTTPS and OAuth2.
Practice secure coding techniques to protect web applications.
Perform security assessments and penetration testing.",Intermediate,2.9,Very High
Web Development with WordPress,This beginner-level course introduces web development with WordPress. Learn to create and customize websites using this popular content management system.,"Get started with web development using WordPress as a content management system.
Create and customize websites with themes and plugins.
Learn about web design principles and user-friendly website development.
Publish and maintain websites using WordPress.",Beginner,2.9,Medium
Advanced Topics in Cybersecurity Research,This advanced-level course delves into advanced topics in cybersecurity research. Explore cutting-edge cybersecurity challenges and solutions.,"Master advanced concepts in cybersecurity research and innovation.
Learn to analyze and address emerging cyber threats and vulnerabilities.
Explore security testing, threat intelligence, and cyber defense strategies.
Contribute to the advancement of cybersecurity knowledge and practices.",Advanced,2.6,Medium
Quantum Machine Learning,This advanced-level course focuses on quantum machine learning. Learn to leverage quantum computing for advanced machine learning algorithms.,"Understand quantum computing and its applications in machine learning.
Learn to implement quantum algorithms for machine learning tasks.
Explore quantum machine learning libraries and frameworks.
Develop and optimize quantum machine learning models.",Advanced,2.5,Very High
Introduction to Social Media Security,This beginner-level course covers social media security practices. Learn to protect your online presence and privacy on social platforms.,"Understand the importance of social media security.
Learn to set privacy settings and manage online profiles.
Explore common social media threats and scams.
Safeguard your personal information and digital identity on social media.",Beginner,3.4,High
Advanced Data Visualization,This intermediate-level course focuses on advanced data visualization techniques. Learn about interactive visualizations and storytelling with data.,"Create advanced data visualizations using tools like D3.js and Tableau.
Understand principles of data storytelling and effective communication.
Develop interactive dashboards and data-driven narratives.
Visualize complex data sets for insights and decision-making.",Intermediate,3.1,Very High
AI in Autonomous Vehicles,This advanced-level course focuses on AI in autonomous vehicles. Learn to develop AI systems for self-driving cars and autonomous mobility.,"Understand AI technologies for autonomous vehicles.
Learn to build AI systems for self-driving cars and mobility solutions.
Explore perception, decision-making, and control in autonomous vehicles.
Contribute to the advancement of AI-driven autonomous mobility.",Advanced,2.7,Low
Computer Science for Non-Majors,This course is designed for individuals who are not computer science majors but want to gain a basic understanding of computer science concepts and applications.,"Gain a foundational understanding of computer science and its relevance in various fields.
Learn about key computer science topics, including algorithms and data structures.
Explore practical applications of computer science in everyday life and various industries.
Acquire problem-solving skills through hands-on exercises and projects.",Beginner,3.4,High
Building Your First Mobile App,This beginner-level course guides you in building your first mobile app. Learn app development basics and create your own mobile application.,"Understand the mobile app development process.
Learn to create a simple mobile app from scratch.
Explore app development tools and platforms.
Turn your app idea into a reality with hands-on development.",Beginner,2.8,Low
Introduction to 3D Printing and Modeling,"This beginner-level course introduces 3D printing and modeling. Learn about 3D design, modeling software, and the 3D printing process.","Understand the basics of 3D printing and its applications.
Learn 3D modeling using software like Tinkercad or Blender.
Explore the 3D printing process from design to printing.
Create 3D-printable models and objects.",Beginner,3.0,Medium
Cybersecurity Best Practices,"This intermediate-level course focuses on cybersecurity best practices. Learn about threat detection, risk assessment, and security measures to protect digital assets.","Identify common cybersecurity threats and vulnerabilities.
Perform risk assessments and develop security strategies.
Implement security measures to protect networks and data.
Stay updated with cybersecurity best practices and compliance standards.",Intermediate,3.2,Very High
Computer Literacy for Seniors,This beginner-level course is designed for seniors to learn computer literacy. Develop basic computer skills and navigate the digital world with confidence.,"Learn the basics of computer hardware and software.
Explore common computer applications and tools.
Develop essential computer skills for everyday tasks.
Become a confident and empowered digital user as a senior.",Beginner,3.7,Low
Computer Hardware Basics,"This beginner-level course covers computer hardware fundamentals. Learn about components, peripherals, and basic troubleshooting techniques.","Understand computer hardware components like CPU, RAM, and storage devices.
Learn about input and output peripherals, including keyboards and monitors.
Troubleshoot common hardware issues and perform basic upgrades.
Explore computer hardware terminology and specifications.",Beginner,2.8,Very High
Back-End Web Development,"This intermediate-level course covers back-end web development. Learn server-side programming, API development, and database integration for building robust web applications.","Master server-side programming using languages like Python, Node.js, or Ruby.
Develop RESTful APIs for communication between front-end and back-end systems.
Integrate databases and perform CRUD operations on data.
Build scalable and secure web applications with back-end development skills.",Intermediate,2.6,High
Advanced Topics in Software Engineering Research,This advanced-level course delves into advanced topics in software engineering research. Explore cutting-edge research areas and contribute to the field.,"Explore advanced topics in software engineering research.
Stay updated with cutting-edge research areas and trends.
Contribute to ongoing software engineering research projects.
Publish research findings and advance the field of software engineering.",Advanced,2.2,Medium
Advanced Robotics and Automation,"This advanced-level course explores advanced robotics and automation technologies. Learn about robot perception, control systems, and autonomous robots.","Master advanced robotics concepts and technologies.
Explore robot perception and sensor fusion techniques.
Understand advanced control systems for robotic applications.
Design and develop autonomous robots and robotic systems.",Advanced,2.8,Medium
Bioinformatics and Computational Genomics,This advanced-level course focuses on bioinformatics and computational genomics. Learn to analyze biological data and genomics using computational tools.,"Master bioinformatics techniques for analyzing biological data.
Learn about genomics, structural biology, and computational tools.
Apply computational methods to biological research and analysis.
Contribute to advancements in bioinformatics and genomics research.",Advanced,2.2,High
Introduction to Game Development,"This beginner-level course provides an introduction to game development. Learn about game design, game engines, and creating simple games.","Understand the fundamentals of game design and game development.
Explore popular game engines like Unity and Godot.
Create simple 2D and 3D games with interactive gameplay.
Learn about the game development process from idea to playable game.",Beginner,2.3,High
Computer Basics for Beginners,"This course is designed for individuals with little or no prior knowledge of computers. You will learn about computer hardware, software, operating systems, and basic computer usage.","Gain an understanding of computer hardware components and their functions.
Learn about different types of software and their applications.
Explore common operating systems and their features.
Acquire basic computer skills for tasks like file management and internet browsing.",Beginner,3.1,Very High
Computer Vision and Deep Learning,"This advanced-level course focuses on computer vision and deep learning. Learn about image recognition, neural networks, and advanced vision applications.","Master computer vision techniques and deep learning models.
Learn about image recognition, object detection, and image segmentation.
Explore advanced vision applications in healthcare, robotics, and more.
Develop computer vision and deep learning projects.",Advanced,3.4,Medium
Introduction to Cloud Computing,"This intermediate-level course provides an introduction to cloud computing. Learn about cloud service models, deployment models, and cloud security.","Understand cloud computing fundamentals and its benefits.
Learn about cloud service models like IaaS, PaaS, and SaaS.
Explore cloud deployment models and cloud security measures.
Migrate applications to the cloud and manage cloud resources.",Intermediate,2.4,Very High
Big Data Ethics and Privacy,This advanced-level course covers big data ethics and privacy. Learn to address ethical and privacy concerns in big data analytics.,"Master advanced big data ethics principles and privacy regulations.
Learn to implement privacy-preserving techniques in big data analytics.
Explore ethical considerations in data collection, storage, and analysis.
Contribute to responsible and ethical big data practices.",Advanced,2.7,High
High-Performance Computing,"This advanced-level course focuses on high-performance computing (HPC). Learn about parallel processing, cluster computing, and GPU acceleration.","Explore parallel computing architectures and distributed computing.
Learn about GPU acceleration and CUDA programming.
Optimize algorithms and applications for high-performance computing.
Apply HPC techniques in scientific and engineering simulations.",Advanced,4.0,Medium
Advanced C++ Programming,"This intermediate-level course builds on C++ fundamentals. Explore advanced C++ features, including templates, exception handling, and memory management.","Master advanced C++ concepts like templates and exception handling.
Understand memory management and smart pointers in C++.
Explore C++ libraries and advanced topics like multithreading.
Develop efficient and robust C++ applications.",Intermediate,3.7,Very High
Cybersecurity Governance and Risk Management,This intermediate-level course covers cybersecurity governance and risk management. Learn to establish and maintain cybersecurity policies.,"Understand cybersecurity governance principles and frameworks.
Learn to assess and manage cybersecurity risks.
Explore compliance and regulatory requirements.
Implement effective governance and risk management practices.",Intermediate,2.4,Low
Advanced Topics in Machine Learning Ethics,This advanced-level course delves into advanced topics in machine learning ethics. Explore ethical considerations in AI and machine learning.,"Master advanced topics in machine learning ethics.
Learn to analyze and address ethical challenges in AI and machine learning.
Explore fairness, transparency, and accountability in AI models.
Contribute to ethical AI development and responsible AI research.",Advanced,2.8,Medium
Internet Safety for Parents,This beginner-level course is designed for parents to learn about internet safety. Ensure your child's online safety and digital well-being.,"Understand the online risks and challenges children may face.
Learn to set up parental controls and monitor online activities.
Explore safe internet usage guidelines for kids.
Promote a secure and responsible online environment for your family.",Beginner,3.5,High
Introduction to Robotics Programming,This beginner-level course introduces robotics programming. Learn the fundamentals of coding and controlling robots.,"Understand the basics of robotics and programming.
Learn to code and control robots for various tasks.
Explore robotics programming languages and platforms.
Embark on your journey into the exciting world of robotics.",Beginner,2.8,High
Cloud Native DevOps Practices,This intermediate-level course covers cloud-native DevOps practices. Learn to deploy and manage applications in cloud-native environments.,"Understand cloud-native architecture and its benefits.
Learn DevOps practices for deploying and managing applications in the cloud.
Explore containerization and orchestration tools like Docker and Kubernetes.
Implement CI/CD pipelines for automated application deployment.",Intermediate,2.4,Low
Computer Vision and Image Processing,"This advanced-level course focuses on computer vision and image processing. Learn about image recognition, feature extraction, and computer vision applications.","Master image processing techniques like image filtering and segmentation.
Learn about feature extraction and object recognition in images.
Explore computer vision applications in autonomous vehicles and healthcare.
Develop computer vision projects and applications.",Advanced,2.6,Low
Introduction to Cloud Services,"This beginner-level course provides an introduction to cloud services. Learn about cloud computing models, cloud providers, and cloud-based applications.","Understand the basics of cloud computing and its advantages.
Learn about cloud service models like Infrastructure as a Service (IaaS) and Software as a Service (SaaS).
Explore popular cloud providers and their offerings.
Get hands-on experience with cloud-based applications.",Beginner,1.9,Low
Basics of Mobile App Design,This beginner-level course covers the basics of mobile app design. Learn to create user-friendly and visually appealing mobile app interfaces.,"Understand the principles of mobile app design.
Learn about user interface (UI) and user experience (UX) design.
Explore mobile app design tools and best practices.
Design a basic mobile app interface for improved user engagement.",Beginner,2.5,Very High
Computer Programming with Scratch,This beginner-level course introduces computer programming using Scratch. Learn the fundamentals of coding through visual programming.,"Learn the basics of computer programming concepts.
Explore visual programming with Scratch.
Create interactive animations and games using Scratch.
Build coding skills for beginners with hands-on projects.",Beginner,3.9,Very High
Cybersecurity for Small Businesses,This beginner-level course focuses on cybersecurity for small businesses. Learn to protect your business from online threats and attacks.,"Understand the importance of cybersecurity for small businesses.
Learn to identify and mitigate common cyber threats.
Explore best practices for securing business data and networks.
Implement cybersecurity measures for your small business.",Beginner,3.1,Very High
Advanced Network Security,"This advanced-level course focuses on advanced network security. Learn about intrusion detection systems, secure network design, and security protocols.","Master intrusion detection and prevention techniques.
Design and implement secure network architectures.
Explore advanced security protocols and encryption methods.
Analyze network traffic for security threats and anomalies.",Advanced,2.6,Very High
Programming with Scratch,"This beginner-level course teaches programming concepts using Scratch, a visual programming language. Learn coding basics through interactive projects.","Get started with coding using the Scratch visual programming language.
Learn programming concepts like loops, conditionals, and variables.
Create interactive stories, animations, and games in Scratch.
Develop computational thinking and problem-solving skills.",Beginner,3.0,Medium
Digital Literacy for Beginners,"This beginner-level course focuses on digital literacy basics. Learn about internet safety, online communication, and digital tools for everyday life.","Understand the importance of digital literacy in the modern world.
Learn about internet safety, online etiquette, and privacy.
Explore digital tools for communication, productivity, and information.
Build digital skills for daily life and online interactions.",Beginner,3.4,Very High
Advanced Web Design and User Experience ,This intermediate-level course covers advanced web design and user experience (UX) principles. Enhance your web design skills.,"Master advanced web design techniques and principles.
Learn to create user-centered web interfaces.
Explore advanced UX design methodologies.
Design and prototype responsive and engaging web experiences.",Intermediate,2.9,High
Networking for Beginners,"This beginner-level course covers the basics of computer networking. You will learn about network components, protocols, and how data is transmitted over networks.","Understand the key components of computer networks, including routers, switches, and cables.
Learn about network protocols and their role in data transmission.
Explore the fundamentals of IP addressing and subnetting.
Gain knowledge about network security and troubleshooting.",Beginner,2.6,Medium
Human-AI Interaction Design,This intermediate-level course focuses on human-AI interaction design. Learn to create intuitive and user-friendly AI-driven interfaces and experiences.,"Understand the principles of human-AI interaction design.
Learn to design user-friendly AI-driven interfaces and applications.
Explore AI ethics and responsible AI design.
Design and prototype AI-powered user interfaces.",Intermediate,2.5,Very High
Advanced Topics in Computer Science Research,This advanced-level course explores cutting-edge topics in computer science research. Learn about emerging technologies and research trends.,"Explore cutting-edge topics in computer science research.
Learn about emerging technologies like quantum computing and AI advancements.
Understand research methodologies and scholarly writing in computer science.
Contribute to ongoing research projects.",Advanced,3.1,Very High
Robotics and Autonomous Systems,"This advanced-level course focuses on robotics and autonomous systems. Learn about robot kinematics, control systems, and autonomous navigation.","Explore robot kinematics and dynamics for robotic arm control.
Learn about control systems and sensors in robotics.
Understand autonomous navigation and path planning algorithms.
Develop autonomous robotic systems for various applications.",Advanced,3.4,High
Basics of Operating Systems,"This beginner-level course covers the basics of operating systems, including their functions, components, and management.","Understand the role of operating systems in managing computer hardware.
Learn about key components of operating systems, such as file systems and memory management.
Explore process management and multitasking in operating systems.
Gain insights into operating system security and maintenance.",Beginner,2.3,Low
Introduction to Virtual Reality  Development,"This beginner-level course introduces virtual reality (VR) development. Learn about VR hardware, 3D modeling, and creating VR experiences.","Understand the basics of virtual reality (VR) and its applications.
Explore VR hardware and devices like VR headsets.
Learn 3D modeling for creating VR environments and objects.
Create immersive VR experiences and applications.",Beginner,2.4,Medium
Introduction to Databases,"This beginner-level course introduces the fundamentals of databases. You will learn about data modeling, SQL queries, and database management systems.","Understand the importance of databases in data storage and retrieval.
Learn about data modeling techniques and database design principles.
Write SQL queries to retrieve and manipulate data in databases.
Explore different database management systems and their features.",Beginner,3.1,Very High
Cybersecurity Risk Assessment,"This intermediate-level course covers cybersecurity risk assessment. Learn to identify, assess, and mitigate security risks in various contexts.","Understand the principles of cybersecurity risk assessment.
Learn to identify and analyze security threats and vulnerabilities.
Explore risk mitigation strategies and security controls.
Conduct practical risk assessments in real-world scenarios.",Intermediate,3.5,High
Quantum Computing,"This advanced-level course covers quantum computing. Learn about quantum algorithms, quantum gates, and quantum hardware.","Explore quantum computing principles and quantum bits (qubits).
Learn about quantum algorithms like Shor's algorithm and Grover's algorithm.
Understand quantum gates and quantum circuit design.
Experiment with quantum computing using simulators and real quantum hardware.",Advanced,3.0,High
Introduction to Cybersecurity for Kids,"This beginner-level course introduces cybersecurity concepts to kids. Learn about online safety, cyber threats, and safe internet practices.","Understand the importance of online safety and cybersecurity.
Learn about common cyber threats and how to protect against them.
Explore safe internet practices and responsible online behavior.
Develop foundational knowledge of cybersecurity for a safe digital experience.",Beginner,2.5,High
Computer Science and Society,"This beginner-level course explores the impact of computer science on society. Learn about ethical considerations, digital citizenship, and societal challenges.","Understand the role of computer science in shaping modern society.
Explore ethical issues related to technology and data privacy.
Learn about digital citizenship and responsible technology use.
Discuss societal challenges and opportunities in the digital age.",Beginner,1.8,Low
Advanced Data Mining and Analytics,This intermediate-level course focuses on advanced data mining and analytics. Learn to extract valuable insights from large datasets.,"Master advanced data mining techniques and algorithms.
Learn to analyze and interpret complex data patterns.
Explore predictive analytics and machine learning for data-driven insights.
Apply advanced data mining skills to real-world analytics projects.",Intermediate,3.1,Low
Advanced Mobile App Architecture,This intermediate-level course covers advanced mobile app architecture. Learn to design and build scalable and maintainable mobile applications.,"Master advanced mobile app architecture patterns and principles.
Learn to design scalable and maintainable mobile applications.
Explore architectural best practices for mobile app development.
Build advanced mobile apps with a focus on performance and reliability.",Intermediate,3.6,Medium
Introduction to Augmented Reality ,"This beginner-level course introduces augmented reality (AR) technology. Learn about AR applications, development, and creating interactive AR experiences.","Understand the basics of augmented reality (AR) technology.
Learn about AR applications and its potential uses.
Explore AR development and tools for creating AR experiences.
Create interactive AR projects and applications.",Beginner,2.4,Low
Cryptocurrency and Blockchain Applications,"This advanced-level course covers cryptocurrency and blockchain applications. Learn about blockchain technology, cryptocurrencies, and decentralized applications (DApps).","Understand the fundamentals of blockchain technology and its applications.
Learn about cryptocurrencies, smart contracts, and tokenomics.
Develop decentralized applications (DApps) on blockchain platforms.
Explore real-world use cases of blockchain in finance, supply chain, and more.",Advanced,3.5,Very High
Web Application Development Frameworks,This intermediate-level course covers web application development frameworks. Learn about popular frameworks for building robust web applications.,"Explore web application frameworks like Ruby on Rails and Angular.
Learn to build RESTful APIs and single-page applications (SPAs).
Develop full-stack web applications using modern frameworks.
Collaborate on web development projects with best practices.",Intermediate,2.4,High
Machine Learning and Deep Learning,"This intermediate-level course explores machine learning and deep learning techniques. Learn about neural networks, deep learning frameworks, and model training.","Understand machine learning algorithms and techniques.
Explore neural networks and deep learning frameworks like TensorFlow and PyTorch.
Train machine learning and deep learning models for various tasks.
Apply machine learning and deep learning in real-world projects.",Intermediate,3.2,Low
