course_name,description,learning,difficulty,Average rating,Popularity
Data Analysis with Python,"This intermediate-level course focuses on data analysis with Python. Learn about data manipulation, visualization, and statistical analysis.","Master data manipulation with Python libraries like pandas.
Create data visualizations using tools like Matplotlib and Seaborn.
Perform statistical analysis and hypothesis testing on data.
Work with real-world datasets to gain data analysis skills.",Intermediate,2.6,Low
Advanced Computer Vision and Object Recognition,This advanced-level course covers advanced computer vision and object recognition. Learn to develop AI systems for visual perception.,"Master advanced computer vision techniques and deep learning models.
Learn to build AI systems for object detection and recognition.
Explore image segmentation, tracking, and visual scene understanding.
Contribute to the field of advanced computer vision and AI.",Advanced,3.0,Very High
Introduction to User Experience  Design,"This beginner-level course introduces the fundamentals of User Experience (UX) design. Learn about user research, prototyping, and usability testing.","Understand the importance of user-centered design in product development.
Conduct user research to gather insights and requirements.
Create interactive prototypes and design user interfaces.
Perform usability testing to improve product usability.",Beginner,3.1,Medium
Secure Software Development Principles,This intermediate-level course focuses on secure software development principles. Learn to code with security in mind.,"Understand the importance of secure software development.
Learn secure coding practices and techniques.
Explore threat modeling and vulnerability assessment.
Develop secure software applications and protect against cyber threats.",Intermediate,2.5,High
Software Development with React,"This intermediate-level course focuses on software development with React, a popular JavaScript library for building user interfaces.","Master React concepts and component-based development.
Build interactive and dynamic web applications using React.
Learn about state management with Redux and React Router for routing.
Develop modern web applications with React and associated tools.",Intermediate,3.5,Very High
Computer Science for Absolute Beginners,"This course is designed for absolute beginners in computer science. Learn the very basics of programming, algorithms, and computer hardware.","Get started with the absolute basics of computer science.
Learn introductory programming concepts using a beginner-friendly language.
Understand fundamental algorithms and problem-solving techniques.
Explore the basics of computer hardware and how it works.",Beginner,3.1,Very High
Natural Language Processing,"This advanced-level course covers natural language processing (NLP). Learn about text analysis, sentiment analysis, and machine translation.","Explore text analysis techniques for NLP tasks.
Learn about sentiment analysis and opinion mining.
Understand machine translation and language generation in NLP.
Develop NLP applications for chatbots and language processing tasks.",Advanced,2.3,High
Digital Citizenship for Beginners,"This beginner-level course focuses on digital citizenship. Learn about responsible online behavior, ethical internet use, and digital rights.","Understand the principles of digital citizenship.
Learn about responsible online behavior and digital ethics.
Explore digital rights and responsibilities.
Develop good practices for a positive digital presence.",Beginner,2.4,Very High
Compiler Design and Optimization,"This advanced-level course covers compiler design and optimization. Learn about lexical analysis, parsing, code generation, and optimization techniques.","Explore lexical analysis and parsing techniques for language processing.
Learn about intermediate code generation and code optimization.
Understand compiler frontends and backends.
Develop a complete compiler for a programming language.",Advanced,3.0,High
Big Data Analytics for Business,"This advanced-level course focuses on big data analytics for business. Learn about data-driven decision-making, predictive analytics, and business intelligence.","Apply big data analytics to make data-driven business decisions.
Learn about predictive analytics and machine learning for business applications.
Develop business intelligence dashboards for reporting and visualization.
Analyze large-scale data sets for strategic insights.",Advanced,3.1,High
Cloud-Native Application Development,"This advanced-level course focuses on cloud-native application development. Learn about containerization, Kubernetes, and microservices architecture.","Explore containerization technologies like Docker and container orchestration with Kubernetes.
Learn about microservices architecture and cloud-native design principles.
Develop cloud-native applications and deploy them in cloud environments.
Manage and scale cloud-native applications with modern DevOps practices.",Advanced,3.0,Very High
Python for Beginners,"This course is an introduction to the Python programming language. You will learn Python syntax, data structures, and how to write simple programs.","Familiarize yourself with Python syntax, including variables, loops, and conditionals.
Learn about common data structures in Python, such as lists and dictionaries.
Write Python programs to solve basic problems and tasks.
Understand how Python can be used in various applications, including web development and data analysis.",Beginner,2.4,Very High
Introduction to Cybersecurity Awareness,"This beginner-level course introduces the basics of cybersecurity awareness. Learn about common threats, online safety, and best practices for staying secure.","Understand the importance of cybersecurity in the digital world.
Learn about common cyber threats and how to protect yourself online.
Practice good online safety habits and recognize phishing attempts.
Implement best practices for password security and data protection.",Beginner,2.9,High
Network Administration,"This intermediate-level course covers network administration. Learn about network configuration, maintenance, and troubleshooting in a corporate environment.","Configure and manage network devices, including routers and switches.
Monitor network performance and troubleshoot connectivity issues.
Implement security measures to protect corporate networks.
Manage user access and permissions in a networked environment.",Intermediate,3.3,Low
High-Performance Computing Clusters and Grids,This advanced-level course explores high-performance computing clusters and grid computing. Learn to design and manage high-performance computing environments.,"Master the principles of high-performance computing clusters and grids.
Design and deploy high-performance computing environments.
Optimize cluster and grid performance for scientific and research applications.
Manage and troubleshoot complex computing clusters.",Advanced,3.9,Very High
JavaScript Basics,"This beginner-level course introduces JavaScript, a popular programming language used for web development. You will learn the basics of JavaScript syntax and its usage in web development.","Familiarize yourself with JavaScript syntax, variables, and data types.
Learn how to use JavaScript to manipulate web page elements and respond to user interactions.
Write JavaScript code to create interactive web applications.
Explore the role of JavaScript in modern web development.",Beginner,2.9,Very High
Advanced Data Visualization with Tableau,This intermediate-level course explores advanced data visualization techniques using Tableau. Learn to create interactive and informative data dashboards.,"Master advanced data visualization techniques with Tableau.
Learn to design and create interactive data dashboards.
Explore data storytelling and visualization best practices.
Communicate insights effectively through data visualizations.",Intermediate,3.1,Very High
Introduction to Algorithms,"This intermediate-level course explores algorithms and their role in computer science. You will learn about algorithm design, analysis, and their practical applications.","Understand the fundamentals of algorithm design and analysis.
Explore various algorithmic techniques, such as sorting and searching algorithms.
Learn how to analyze the time and space complexity of algorithms.
Apply algorithms to solve real-world problems and computational challenges.",Intermediate,3.0,Low
Front-End Web Development,"This intermediate-level course focuses on front-end web development. Learn about HTML5, CSS3, and JavaScript frameworks for building modern and responsive web interfaces.","Master HTML5, CSS3, and responsive web design techniques.
Learn popular front-end frameworks like React or Angular.
Explore web accessibility and cross-browser compatibility.
Build interactive and visually appealing web interfaces.",Intermediate,2.8,Low
Introduction to Software Development Tools,"This beginner-level course introduces software development tools and best practices. Learn about version control, integrated development environments (IDEs), and more.","Understand the essential software development tools and their roles.
Learn about version control systems like Git and GitHub.
Explore integrated development environments (IDEs) for coding efficiency.
Practice software development best practices and collaboration tools.",Beginner,3.0,Medium
Web Design for Beginners,"This beginner-level course covers the fundamentals of web design. Learn HTML and CSS basics, layout design, and creating responsive web pages.","Master HTML and CSS fundamentals for web design.
Understand web layout design and responsive web development.
Create basic web pages and simple interactive elements.
Design visually appealing and user-friendly websites.",Beginner,2.6,High
Advanced Robotics Perception,This advanced-level course covers advanced robotics perception techniques. Learn to enhance robot perception and decision-making capabilities.,"Master advanced robotics perception methods and algorithms.
Learn to integrate sensors and perception modules into robotic systems.
Explore computer vision and sensor fusion for robotics.
Enhance robot perception for autonomous navigation and interaction.",Advanced,2.8,Very High
Advanced Python Programming,"This intermediate-level course builds upon the fundamentals of Python. You will learn advanced Python concepts, including decorators, generators, and metaclasses. Explore real-world applications and best practices in Python programming.","Master advanced Python concepts like decorators and metaclasses.
Explore Python libraries and frameworks for various applications.
Understand best practices for Python code organization and optimization.
Apply Python programming skills to develop real-world applications.",Intermediate,3.0,Medium
Advanced Cloud Computing Services,"This intermediate-level course explores advanced cloud computing services. Learn about cloud architecture, service models, and advanced cloud solutions.","Master advanced cloud computing concepts and architectures.
Learn about cloud service models and their applications.
Explore advanced cloud solutions for specific business needs.
Design and implement advanced cloud projects.",Intermediate,3.2,Medium
Programming Logic and Design,"This beginner-level course focuses on programming logic and design principles. Learn algorithmic thinking, flowcharting, and problem-solving techniques.","Develop algorithmic thinking and problem-solving skills.
Create flowcharts to represent program logic.
Understand basic programming constructs like loops and conditionals.
Apply programming logic to solve simple computational problems.",Beginner,3.1,High
Web Development with JavaScript,"This intermediate-level course focuses on web development using JavaScript. You will learn client-side scripting, DOM manipulation, and asynchronous programming. Build interactive web applications.","Master JavaScript for client-side web development.
Learn about Document Object Model (DOM) manipulation.
Explore asynchronous programming and AJAX for web applications.
Build interactive and dynamic web applications with JavaScript.",Intermediate,2.8,Medium
Advanced Human-Computer Interaction Research,This advanced-level course delves into advanced human-computer interaction (HCI) research. Explore HCI methodologies and user-centered design.,"Master advanced HCI research methodologies and techniques.
Learn to conduct user-centered design studies and evaluations.
Explore advanced HCI topics, including augmented reality and wearables.
Contribute to the advancement of HCI research and interactive technology.",Advanced,2.5,High
Advanced Computer Graphics and Animation,"This advanced-level course focuses on advanced computer graphics and animation techniques. Learn about 3D rendering, animation pipelines, and visual effects.","Master advanced computer graphics techniques for realistic 3D rendering.
Learn about animation pipelines, rigging, and character animation.
Explore visual effects (VFX) and simulations in computer graphics.
Create advanced graphics and animation projects.",Advanced,2.9,Very High
Advanced Python Scripting,This intermediate-level course focuses on advanced Python scripting. Learn to automate tasks and build Python applications.,"Master advanced Python scripting techniques and libraries.
Learn to automate repetitive tasks with Python scripts.
Explore web scraping, data manipulation, and scripting best practices.
Develop Python applications for various purposes.",Intermediate,3.6,Very High
Introductory Machine Learning,"This intermediate-level course provides an introduction to machine learning techniques and algorithms. You will learn about supervised and unsupervised learning, as well as model evaluation and selection.","Understand the fundamentals of machine learning, including supervised and unsupervised learning.
Explore machine learning algorithms and their applications.
Learn how to evaluate and select machine learning models for different tasks.
Apply machine learning techniques to real-world datasets and problems.",Intermediate,3.2,Low
Computer Science for Kids,"This beginner-level course is designed for kids and introduces computer science concepts in a fun and engaging way. Learn about coding, problem-solving, and digital creativity.","Get started with coding using block-based programming languages.
Develop problem-solving skills through interactive projects and games.
Learn about digital creativity and basic computer science principles.
Explore the world of technology and its impact on society.",Beginner,3.1,Medium
Distributed Systems,"This advanced-level course covers distributed systems. Learn about distributed architectures, consensus algorithms, and fault tolerance.","Explore distributed system architectures like microservices and containers.
Learn about consensus algorithms like Raft and Paxos.
Understand fault tolerance and replication in distributed systems.
Develop distributed applications and services.",Advanced,3.2,Very High
Advanced Natural Language Understanding and Generation,This advanced-level course focuses on advanced natural language understanding and generation. Explore advanced NLP and language models.,"Master advanced NLP techniques and state-of-the-art language models.
Learn to build AI systems for natural language understanding and generation.
Explore language translation, text summarization, and conversational AI.
Contribute to the development of advanced NLP applications.",Advanced,3.1,High
Introduction to Cybersecurity,"This beginner-level course introduces the basics of cybersecurity. Learn about common threats, security measures, and best practices to protect digital assets.","Understand common cybersecurity threats and vulnerabilities.
Learn security measures to protect personal and organizational data.
Explore best practices for safe online behavior and secure communication.
Apply basic cybersecurity principles to safeguard digital assets.",Beginner,2.8,High
Data Science with Python,"This intermediate-level course focuses on data science using Python. Learn data analysis, visualization, and machine learning techniques for data-driven insights.","Explore data preprocessing, analysis, and visualization using Python libraries.
Learn machine learning techniques for predictive modeling.
Work with real-world datasets and solve data science problems.
Communicate data-driven insights effectively.",Intermediate,3.1,Low
Web Application Development with Vue.js,This intermediate-level course focuses on web application development with Vue.js. Learn to build interactive and responsive web apps.,"Master Vue.js, a popular JavaScript framework for web development.
Learn to create interactive and responsive web applications.
Explore component-based development and state management in Vue.js.
Build advanced web apps with Vue.js and Vue Router.",Intermediate,2.0,Medium
Quantum Algorithms and Quantum Computing Applications,This advanced-level course covers quantum algorithms and applications in quantum computing. Learn about quantum programming and quantum simulations.,"Understand quantum algorithms and their advantages over classical algorithms.
Learn about quantum programming languages and quantum simulators.
Explore real-world applications of quantum computing in various fields.
Develop and optimize quantum algorithms for specific tasks.",Advanced,3.4,High
Cloud Native Security and DevSecOps,This advanced-level course covers cloud native security and DevSecOps practices. Learn to secure cloud-native applications and adopt a DevSecOps culture.,"Master cloud native security practices and tools.
Implement security measures for cloud-native applications.
Integrate security into the DevOps process with DevSecOps practices.
Adopt a culture of security and automation in cloud environments.",Advanced,2.7,Low
Advanced DevOps Practices,This intermediate-level course delves into advanced DevOps practices. Learn to automate software development and deployment pipelines.,"Master advanced DevOps principles and practices.
Learn to set up continuous integration and continuous deployment (CI/CD) pipelines.
Explore containerization, orchestration, and infrastructure as code (IaC).
Improve software delivery and deployment with DevOps expertise.",Intermediate,2.2,Medium
Introduction to Video Game Design,"This beginner-level course introduces video game design concepts. Learn about game development, mechanics, and creating interactive gameplay.","Understand the fundamentals of video game design and development.
Learn about game mechanics, storyboarding, and level design.
Explore interactive gameplay and user engagement strategies.
Create basic video game prototypes and projects.",Beginner,3.3,High
Software Quality Assurance,This intermediate-level course covers software quality assurance (QA) principles and practices. Learn about testing methodologies and QA processes.,"Understand the importance of software quality assurance in the development cycle.
Learn about different testing methodologies, including manual and automated testing.
Perform test planning, test case design, and test execution.
Implement QA processes and strategies for delivering high-quality software.",Intermediate,2.9,High
Computer Graphics and Visualization,"This intermediate-level course covers computer graphics and data visualization. Learn about rendering techniques, 3D graphics, and interactive visualization.","Explore computer graphics principles, including rendering and shading.
Learn about 3D graphics and modeling techniques.
Create interactive visualizations and simulations.
Apply computer graphics and visualization in multimedia and gaming.",Intermediate,2.4,High
Introduction to Artificial Intelligence,"This beginner-level course introduces the field of artificial intelligence (AI). You will learn about AI concepts, machine learning, and practical AI applications.","Understand the basics of artificial intelligence and its applications.
Learn about machine learning and its role in AI.
Explore practical AI applications in areas like image recognition and natural language processing.
Get an overview of ethical considerations in AI development.",Beginner,2.9,Very High
Introduction to Cloud-Based Productivity Tools,"This beginner-level course introduces cloud-based productivity tools. Learn about cloud applications for collaboration, document management, and more.","Understand the benefits of cloud-based productivity tools.
Learn to use cloud applications for collaboration and document management.
Explore productivity-enhancing features and functionalities.
Integrate cloud-based tools into daily tasks for improved efficiency.",Beginner,2.8,Low
IoT Security and Protocols,This intermediate-level course focuses on IoT security and protocols. Learn to secure Internet of Things (IoT) devices and networks.,"Understand the importance of IoT security and protocols.
Learn about IoT device authentication and encryption.
Explore common IoT security threats and mitigation strategies.
Secure IoT ecosystems and protect against cyber threats.",Intermediate,3.8,Medium
Database Management Systems,"This intermediate-level course covers database management systems (DBMS). Learn about relational databases, SQL, normalization, and database design.","Understand relational databases and DBMS architecture.
Learn SQL for data retrieval and manipulation.
Explore database normalization and design principles.
Design and implement databases for various applications.",Intermediate,3.1,Medium
AI in Art and Creativity,This advanced-level course explores AI in art and creativity. Learn to create AI-generated art and innovative creative applications.,"Master AI techniques for generative art and creative content creation.
Learn to build AI-driven creative tools and applications.
Explore applications in music composition, visual arts, and design.
Contribute to the intersection of AI and art for creative innovations.",Advanced,2.4,Very High
High-Performance Computing Clusters,"This advanced-level course focuses on high-performance computing clusters. Learn about cluster architecture, parallel processing, and HPC applications.","Explore high-performance computing (HPC) cluster architecture.
Learn about parallel processing and distributed computing.
Develop and optimize applications for HPC clusters.
Apply HPC techniques in scientific simulations and data analysis.",Advanced,2.4,Medium
Introduction to HTML and CSS,"This beginner-level course focuses on the fundamentals of web development, covering HTML for content structure and CSS for styling web pages.","Learn the basics of HTML for creating structured web content.
Understand how CSS is used to style and format web pages.
Create simple web pages using HTML and CSS.
Explore web development best practices and standards.",Beginner,3.0,High
Introduction to Computer Science,"This course provides an introduction to the field of computer science. You will learn about the fundamental concepts, history, and various areas within computer science. Topics covered include algorithms, data structures, programming, and problem-solving.","Understand the basics of computer science and its importance in today's world.
Learn about algorithms and their role in solving problems efficiently.
Explore data structures and their applications in software development.
Get an overview of programming languages and their usage in computer science.",Beginner,2.9,Low
C++ Programming for Beginners,"This course is designed for beginners and covers the fundamentals of the C++ programming language. You will learn about C++ syntax, data types, and basic programming concepts.","Familiarize yourself with C++ syntax, including variables, loops, and functions.
Learn about C++ data types and their usage.
Write C++ programs to solve basic problems and tasks.
Understand how C++ can be used in various applications, including game development and system programming.",Beginner,2.9,Medium
Advanced Blockchain Development,This advanced-level course delves into advanced blockchain development. Learn to build decentralized applications (DApps) and smart contracts.,"Master advanced blockchain development techniques.
Learn to build decentralized applications (DApps) on blockchain platforms.
Explore smart contract development and blockchain security.
Implement blockchain solutions for various industries.",Advanced,2.8,Very High
Ethical Hacking for Cybersecurity Experts,This advanced-level course covers ethical hacking for cybersecurity experts. Learn advanced penetration testing and security assessment techniques.,"Master advanced ethical hacking techniques and methodologies.
Learn to conduct in-depth penetration tests and security assessments.
Explore advanced hacking tools and vulnerability exploitation.
Enhance cybersecurity defenses through ethical hacking expertise.",Advanced,3.0,High
Cybersecurity Risk Management,"This advanced-level course focuses on cybersecurity risk management. Learn about risk assessment, threat modeling, and risk mitigation strategies.","Conduct cybersecurity risk assessments for organizations.
Perform threat modeling and vulnerability assessments.
Develop risk mitigation strategies and incident response plans.
Manage cybersecurity risks in complex environments.",Advanced,2.7,Low
Basics of Gaming and Game Development,"This beginner-level course covers the basics of gaming and game development. Learn about game design, development tools, and game industry insights.","Understand the fundamentals of gaming and the game development process.
Learn about game design principles and game mechanics.
Explore game development tools and platforms.
Begin your journey into the world of game creation and design.",Beginner,2.6,Medium
