course_name,description,learning,difficulty,Average rating,Popularity
Fundamentals of 3D Printing,"This beginner-level course covers the fundamentals of 3D printing technology. Learn about 3D modeling, printing processes, and applications of 3D printing.","Understand the basics of 3D printing technology and its applications.
Learn about 3D modeling and design for 3D printing.
Explore different 3D printing processes and materials.
Gain hands-on experience in 3D printing projects.",Beginner,3.6,High
Human-AI Collaboration,This advanced-level course explores human-AI collaboration. Learn how humans and artificial intelligence can work together in various domains.,"Understand the principles of human-AI collaboration.
Explore case studies of AI-human collaboration in healthcare, finance, and more.
Learn about AI augmentation of human capabilities.
Develop strategies for effective human-AI collaboration.",Advanced,2.5,High
Advanced Topics in Machine Learning Research,This advanced-level course explores advanced topics in machine learning research. Learn about cutting-edge algorithms and research trends.,"Explore advanced machine learning algorithms and models.
Understand recent research developments in machine learning.
Contribute to ongoing machine learning research projects.
Publish and present research findings in machine learning.",Advanced,2.8,Medium
Introduction to Virtual Private Networks ,This beginner-level course introduces virtual private networks (VPNs). Learn how VPNs work and how to use them for online security and privacy.,"Understand the concept of virtual private networks (VPNs).
Learn how VPNs enhance online security and privacy.
Explore VPN setup and configuration on different devices.
Use VPNs to protect your online activities and sensitive data.",Beginner,2.6,Low
Advanced Web Development,"This intermediate-level course delves deeper into web development. Learn about advanced web technologies, frameworks, and web application deployment.","Explore advanced web technologies like Node.js and Django.
Learn about web application frameworks and RESTful APIs.
Deploy web applications to production servers and cloud platforms.
Develop feature-rich web applications with modern UI/UX design.",Intermediate,2.8,Very High
Web Hosting and Domain Management,"This beginner-level course covers web hosting and domain management basics. Learn how to register domains, choose hosting providers, and manage websites.","Register and manage domain names for websites.
Choose appropriate web hosting providers and plans.
Set up and configure websites on web hosting servers.
Understand DNS and domain-related terminology.",Beginner,3.3,Low
Computer Science for Educators,"This beginner-level course is designed for educators. Learn about computer science concepts, programming basics, and integrating CS into education.","Understand fundamental computer science concepts and principles.
Learn the basics of programming and algorithmic thinking.
Explore strategies for integrating computer science into educational curricula.
Develop teaching approaches to enhance computer science education.",Beginner,2.3,Low
AI in Business Strategy,This intermediate-level course focuses on the strategic use of AI in business. Learn to develop AI-driven business strategies and solutions.,"Understand the strategic implications of AI in business.
Learn to develop AI-driven business strategies and use cases.
Explore AI implementation in various business domains.
Leverage AI for competitive advantage and business growth.",Intermediate,2.0,Medium
Cybersecurity Governance and Compliance,This advanced-level course covers cybersecurity governance and compliance. Learn to establish robust cybersecurity frameworks and compliance measures.,"Master cybersecurity governance principles and best practices.
Learn to establish cybersecurity compliance measures.
Explore regulatory frameworks and cybersecurity audits.
Develop and implement cybersecurity policies and procedures.",Advanced,2.1,Low
Advanced User Experience  Research,This intermediate-level course delves into advanced user experience (UX) research. Learn to conduct in-depth UX research and usability studies.,"Master advanced UX research methodologies and techniques.
Learn to conduct usability studies and user testing.
Explore user journey mapping and persona development.
Apply advanced UX research skills to improve product design.",Intermediate,3.9,Very High
Advanced Front-End Frameworks,This intermediate-level course covers advanced front-end frameworks. Learn to build dynamic and responsive web interfaces.,"Master advanced front-end frameworks, such as React and Angular.
Learn to create interactive and responsive web applications.
Explore state management, routing, and component-based development.
Build advanced web interfaces with modern front-end technologies.",Intermediate,3.2,Low
Advanced Cloud Security Management,This advanced-level course focuses on advanced cloud security management. Learn to secure cloud environments and protect cloud-based assets.,"Master advanced cloud security concepts and best practices.
Learn to secure cloud infrastructure and data in diverse cloud environments.
Explore identity and access management (IAM) in cloud security.
Implement advanced cloud security strategies and incident response.",Advanced,2.5,Medium
Network Security and Penetration Testing,This intermediate-level course focuses on network security and penetration testing. Learn about securing networks and ethical hacking techniques.,"Master network security principles and secure network design.
Conduct penetration testing and vulnerability assessment.
Explore ethical hacking techniques for network security.
Analyze network traffic for security threats and anomalies.",Intermediate,3.4,High
Introduction to Cloud File Storage,This beginner-level course introduces cloud file storage services. Learn to store and manage files in the cloud.,"Understand the basics of cloud file storage services.
Learn to upload, download, and organize files in the cloud.
Explore file sharing and collaboration features in cloud storage.
Securely manage your digital files using cloud storage solutions.",Beginner,2.0,Low
Advanced Topics in Computer Graphics,"This advanced-level course explores advanced topics in computer graphics. Learn about real-time rendering, 3D modeling, and graphics programming.","Explore advanced techniques in real-time rendering and computer graphics.
Learn about 3D modeling, animation, and visualization.
Develop graphics applications and games using modern graphics APIs.
Apply computer graphics concepts in virtual reality and augmented reality.",Advanced,3.1,Medium
Introduction to Cloud Storage and Backup,"This beginner-level course introduces cloud storage and backup solutions. Learn about cloud storage providers, data backup strategies, and cloud data management.","Understand the advantages of cloud storage and backup solutions.
Learn about popular cloud storage providers and their offerings.
Implement data backup strategies in cloud environments.
Manage cloud-based data and ensure data security.",Beginner,3.3,Very High
Quantum Computing for Cryptanalysis,This advanced-level course focuses on quantum computing for cryptanalysis. Learn to analyze and strengthen cryptographic systems against quantum attacks.,"Master advanced quantum computing concepts and cryptographic principles.
Learn to assess the vulnerability of cryptographic systems to quantum attacks.
Explore post-quantum cryptography and quantum-resistant algorithms.
Contribute to the security of digital communications in the quantum era.",Advanced,2.2,Medium
Introduction to Data Analysis,"This beginner-level course focuses on data analysis basics. Learn about data exploration, visualization, and basic statistical analysis techniques.","Understand the fundamentals of data analysis and its applications.
Learn data exploration techniques and data cleaning.
Create data visualizations using tools like Excel and basic statistical analysis.
Analyze real-world data sets to gain data analysis skills.",Beginner,3.6,High
Data Structures for Beginners,"This beginner-level course introduces data structures and their importance in computer science. You will learn about arrays, linked lists, stacks, and queues.","Understand the concept of data structures and their significance.
Learn about commonly used data structures like arrays and linked lists.
Explore the principles of stack and queue data structures.
Implement and use data structures in practical programming scenarios.",Beginner,3.6,Low
Mobile App Development,"This intermediate-level course covers mobile app development for iOS and Android platforms. Learn about app design, development frameworks, and deployment.","Explore mobile app design principles and user interfaces.
Learn mobile app development using platforms like Swift (iOS) or Java/Kotlin (Android).
Understand app testing, debugging, and deployment.
Develop and publish mobile apps for real-world use.",Intermediate,2.8,High
Introduction to Data Science,"This beginner-level course provides an introduction to data science. Learn about data analysis, visualization, and basic machine learning concepts.","Explore data analysis and visualization using tools like Excel or Python.
Understand data cleaning and preprocessing techniques.
Learn about basic machine learning algorithms and their applications.
Get hands-on experience with data science projects.",Beginner,2.7,Low
Cybersecurity and Ethical Hacking,"This advanced-level course covers cybersecurity and ethical hacking. Learn about advanced threat detection, penetration testing, and ethical hacking techniques.","Master advanced threat detection and incident response techniques.
Conduct penetration testing and vulnerability assessment.
Explore ethical hacking techniques for network and web application security.
Understand security auditing and compliance standards.",Advanced,2.8,Medium
Introduction to Java Programming,"This beginner-level course introduces the Java programming language. You will learn Java syntax, object-oriented programming concepts, and how to write Java applications.","Familiarize yourself with Java syntax, including variables, classes, and methods.
Learn about object-oriented programming principles in Java.
Write Java programs to solve basic problems and tasks.
Explore the versatility of Java in various applications, including web development and mobile app development.",Beginner,3.2,Medium
Introduction to E-Commerce,"This beginner-level course introduces the fundamentals of e-commerce. Learn about online shopping, payment systems, and e-commerce business models.","Understand the basics of e-commerce and its evolution.
Learn about online shopping platforms and payment gateways.
Explore e-commerce business models and strategies.
Start your journey into the world of online selling and entrepreneurship.",Beginner,2.9,Medium
Advanced Cryptocurrency and Blockchain Technologies,"This advanced-level course delves into advanced cryptocurrency and blockchain technologies. Learn about smart contracts, consensus algorithms, and blockchain scaling.","Master advanced cryptocurrency and blockchain concepts.
Explore smart contracts and decentralized applications (DApps).
Understand blockchain consensus algorithms and scalability solutions.
Participate in advanced blockchain development and research.",Advanced,2.7,High
Advanced Cloud Architecture Design,This intermediate-level course covers advanced cloud architecture design. Learn to design scalable and resilient cloud solutions.,"Master advanced cloud architecture concepts and principles.
Learn to design cloud solutions for high availability and performance.
Explore cloud security and compliance considerations.
Design and implement cloud architectures for diverse business needs.",Intermediate,2.6,High
Introduction to Robotics,"This beginner-level course introduces robotics concepts. Learn about robot components, sensors, and basic robot programming.","Understand the components and sensors commonly used in robots.
Learn basic robot programming and control techniques.
Explore real-world applications of robotics in various fields.
Get hands-on experience with robot building and programming.",Beginner,2.8,Medium
Natural Language Processing for Advanced Applications,"This advanced-level course focuses on natural language processing (NLP) for advanced applications. Learn about sentiment analysis, chatbots, and NLP in healthcare.","Master advanced NLP techniques for text analysis and understanding.
Learn about sentiment analysis, chatbot development, and NLP in healthcare.
Explore real-world NLP applications in various industries.
Develop advanced NLP projects and solutions.",Advanced,3.0,Low
Introduction to Internet of Things  for Beginners,"This beginner-level course provides an introduction to the Internet of Things (IoT). Learn about IoT devices, applications, and their impact on various industries.","Understand the basics of the Internet of Things (IoT).
Learn about IoT devices, sensors, and communication protocols.
Explore IoT applications and use cases across different industries.
Gain insights into the impact of IoT on the modern world.",Beginner,3.1,Medium
Introduction to Web Accessibility,This beginner-level course focuses on web accessibility. Learn about the importance of accessible web design and how to create inclusive web experiences.,"Understand the significance of web accessibility for all users.
Learn about web accessibility standards and guidelines.
Apply accessible design principles and practices to web content.
Test and evaluate websites for accessibility compliance.",Beginner,3.8,Low
Introduction to Mobile App Development,"This beginner-level course introduces mobile app development. Learn about app design, user interfaces, and basic app development using a no-code or low-code platform.","Understand mobile app design principles and user interfaces.
Learn to create basic mobile apps using no-code or low-code platforms.
Explore app deployment to mobile devices.
Get started with mobile app development for Android or iOS.",Beginner,3.7,High
Bioinformatics and Computational Biology,"This advanced-level course focuses on bioinformatics and computational biology. Learn about sequence analysis, genomics, and computational tools in biology.","Master bioinformatics techniques for DNA and protein sequence analysis.
Learn about genomics, structural biology, and computational tools.
Apply computational methods to biological research and analysis.
Contribute to advancements in bioinformatics and biology research.",Advanced,2.6,High
Cybersecurity Fundamentals,"This course provides an introduction to the fundamentals of cybersecurity. You will learn about common threats, security principles, and best practices to protect digital assets.","Understand the importance of cybersecurity in today's digital world.
Learn about common cybersecurity threats and attack vectors.
Explore security principles and best practices to safeguard data and systems.
Develop foundational knowledge in cybersecurity for personal and professional use.",Beginner,2.2,Medium
Coding for Beginners: Scratch Programming,"This beginner-level course teaches coding basics using Scratch, a visual programming language. Learn to create interactive animations and games.","Get started with coding using the Scratch visual programming language.
Learn coding concepts like loops, conditionals, and variables.
Create interactive animations, stories, and games in Scratch.
Develop problem-solving skills and computational thinking.",Beginner,2.8,Medium
Human-Computer Interaction ,"This advanced-level course covers human-computer interaction (HCI). Learn about usability, user-centered design, and HCI research methodologies.","Explore usability principles and user-centered design techniques.
Learn about HCI research methodologies and user testing.
Understand HCI in the context of mobile and wearable devices.
Design and evaluate user interfaces for improved user experience.",Advanced,2.7,Medium
AI for Drug Discovery,This advanced-level course focuses on AI for drug discovery. Learn to apply AI and computational methods to accelerate drug development.,"Understand the role of AI in drug discovery and pharmaceutical research.
Learn to leverage AI and computational tools for drug design and screening.
Explore drug discovery pipelines and AI-driven drug development.
Contribute to the advancement of AI-driven drug discovery solutions.",Advanced,2.2,High
AI in Finance and Algorithmic Trading,This advanced-level course covers AI in finance and algorithmic trading. Learn to develop AI-driven trading strategies and financial models.,"Master AI techniques for financial analysis and algorithmic trading.
Learn to build AI-driven trading models and risk assessment tools.
Explore applications in quantitative finance and market prediction.
Contribute to AI advancements in the financial industry.",Advanced,2.5,Medium
Advanced Data Warehousing,"This intermediate-level course delves into advanced data warehousing concepts. Learn about data modeling, ETL processes, and data warehousing solutions.","Master advanced data modeling techniques for data warehousing.
Learn about ETL processes and data integration in data warehousing.
Explore data warehousing solutions and architectures.
Design and implement advanced data warehousing projects.",Intermediate,3.0,High
Social Media and Digital Literacy,"This beginner-level course covers social media usage and digital literacy. Learn about online safety, privacy, and effective use of social media platforms.","Understand the basics of social media platforms and their usage.
Learn about online safety, privacy, and digital footprints.
Explore effective communication and engagement on social media.
Develop digital literacy skills for the modern online world.",Beginner,3.1,High
Object-Oriented Programming in Java,"This intermediate-level course delves into object-oriented programming (OOP) using the Java programming language. Explore OOP principles, design patterns, and Java application development.","Master object-oriented programming principles in Java.
Learn about Java classes, inheritance, and polymorphism.
Explore design patterns for software development.
Develop Java applications using OOP concepts and design patterns.",Intermediate,2.9,Very High
Quantum Cryptography and Quantum Secure Communication,This advanced-level course explores quantum cryptography and secure communication. Learn about quantum key distribution and quantum encryption techniques.,"Master quantum cryptography principles and quantum secure communication.
Learn about quantum key distribution (QKD) and quantum encryption.
Understand the security advantages of quantum technologies.
Explore practical applications of quantum cryptography.",Advanced,3.0,High
Software Development Lifecycle,"This intermediate-level course covers the software development lifecycle (SDLC). Learn about SDLC models, requirements engineering, and project management.","Understand various software development lifecycle models.
Learn requirements engineering and software design.
Explore project management and software testing in SDLC.
Apply SDLC principles in real-world software projects.",Intermediate,4.0,Low
Cybersecurity Incident Response and Forensics,This advanced-level course focuses on cybersecurity incident response and digital forensics. Learn to investigate and respond to security incidents.,"Master incident response techniques for cybersecurity emergencies.
Learn digital forensics methodologies and evidence collection.
Conduct investigations and analyze security incidents.
Develop incident response plans and strategies.",Advanced,2.9,Very High
Advanced Agile Software Development,This intermediate-level course delves into advanced agile software development practices. Learn to enhance agility in software development projects.,"Master advanced agile software development principles and methodologies.
Learn to lead and manage agile software development teams.
Explore agile scaling frameworks for large projects.
Apply agile practices to complex software development scenarios.",Intermediate,3.0,Low
Introduction to Data Privacy for Consumers,This beginner-level course focuses on data privacy for consumers. Learn how to protect your personal information online and safeguard your privacy.,"Understand the importance of data privacy in the digital age.
Learn about online privacy threats and data breaches.
Explore best practices for securing personal information online.
Take proactive steps to protect your digital privacy.",Beginner,3.1,Medium
Computer Science Essentials,"This intermediate-level course delves into essential topics in computer science, including data structures, algorithms, and software development concepts.","Review key concepts in computer science, including data structures and algorithms.
Explore software development principles and best practices.
Understand the role of databases in modern computing.
Apply computer science knowledge to solve real-world problems.",Intermediate,2.9,Medium
Internet of Things  Development,"This advanced-level course covers Internet of Things (IoT) development. Learn about IoT architectures, sensor networks, and IoT security.","Explore IoT architectures and edge computing in IoT systems.
Learn about sensor networks, IoT protocols, and IoT device programming.
Understand IoT security measures and privacy considerations.
Develop IoT applications and projects in various domains.",Advanced,3.3,High
Advanced Database Systems,"This advanced-level course covers advanced database systems. Learn about distributed databases, NoSQL databases, and big data storage solutions.","Explore distributed database architectures and replication.
Learn about NoSQL databases like MongoDB and Cassandra.
Understand big data storage solutions like Hadoop and Spark.
Design and implement advanced database systems for complex data requirements.",Advanced,3.6,Low
Advanced Computer Graphics Rendering,This advanced-level course focuses on advanced computer graphics rendering techniques. Learn to create realistic and high-quality graphics.,"Master advanced computer graphics rendering techniques.
Learn about ray tracing, global illumination, and advanced rendering algorithms.
Explore real-time graphics and advanced visual effects (VFX).
Create high-quality and visually stunning graphics projects.",Advanced,2.6,High
AI in Environmental Sustainability,This advanced-level course explores AI in environmental sustainability. Learn to use AI for environmental monitoring and conservation.,"Master AI techniques for environmental monitoring and analysis.
Learn to develop AI systems for sustainable resource management.
Explore applications in climate modeling, conservation, and ecology.
Contribute to environmental sustainability through AI innovations.",Advanced,3.1,Very High
Software Development with Agile Methodology,"This intermediate-level course focuses on software development with Agile methodology. Learn about Agile principles, Scrum, and Agile project management.","Understand Agile principles and values in software development.
Learn about the Scrum framework and Agile project management.
Practice Agile methodologies in software development projects.
Collaborate with cross-functional teams and adapt to changing requirements.",Intermediate,3.7,Low
Advanced Machine Learning Applications,This intermediate-level course focuses on advanced machine learning applications. Learn to apply ML techniques to real-world problems.,"Master advanced machine learning algorithms and models.
Learn to apply ML in domains like healthcare, finance, and more.
Explore deep learning, reinforcement learning, and transfer learning.
Solve complex problems with advanced machine learning applications.",Intermediate,2.5,Very High
Advanced Human-Robot Interaction Design,This advanced-level course focuses on advanced human-robot interaction design. Explore the design of intuitive and collaborative robot interfaces.,"Master advanced principles of human-robot interaction (HRI) design.
Learn to create intuitive and collaborative robot interfaces.
Explore HRI evaluation, gesture recognition, and social robotics.
Contribute to the development of advanced HRI systems and robots.",Advanced,3.3,Low
AI Ethics and Bias Mitigation,This advanced-level course covers AI ethics and bias mitigation. Learn to address ethical challenges and biases in AI systems.,"Master advanced AI ethics principles and frameworks.
Learn to identify and mitigate biases in AI algorithms and data.
Explore fairness, transparency, and accountability in AI.
Contribute to the ethical development and deployment of AI technologies.",Advanced,2.8,Very High
Machine Learning Model Deployment,This intermediate-level course focuses on deploying machine learning models. Learn to take machine learning projects from development to production.,"Understand the deployment process for machine learning models.
Learn about containerization and deployment platforms.
Explore best practices for scaling and monitoring deployed models.
Deploy machine learning projects in real-world scenarios.",Intermediate,2.3,Low
Advanced Natural Language Processing,This intermediate-level course focuses on advanced natural language processing (NLP). Explore NLP models and applications.,"Master advanced NLP techniques and deep learning models.
Learn to build NLP applications for text analysis and understanding.
Explore sentiment analysis, language generation, and chatbots.
Apply advanced NLP skills to real-world language processing tasks.",Intermediate,2.4,Low
